sense,sentence,centroid_cs
small.a.01,"He rather wished he had never got into the business , and still - scarcely to be resisted , a nice little profit with not much work involved , easy money .",0.7613912400594666
small.a.01,"She 'd be smart about it , get him to give it to her in little bills so 's nobody would suspect - maybe could n't get it until Monday account of that , the banks - But that was n't really long to wait .",0.7547714837782109
small.a.01,"She 'd say she did n't feel good on Sunday , could n't go to church - there 'd be a little argument , but she could be stubborn - and when the old woman had gone , quick pack the things she 'd need to take , all but the dress she 'd wear Monday , and take the bag down to that place in the station where you could put things in a locker overnight , for a dime .",0.560895095402418
small.a.01,"Sarah had begun to tell Lucien of Emile , she had begun to question and a little draft had crept across the room from the bedroom door , open barely enough to show a rim of blackness in the hall .",0.7314859397536987
small.a.01,"Behind him on the steps of the little office sat old man Arthur ; he was straight , something angry in his attitude , as if he might be waiting to report something .",0.8182727517272096
small.a.01,"He knew that anything a brainy little lady like her had to say would be plumb important , as well as pleasin ' to the ear , and he did n't want to miss a word of it .",0.7341562131496108
small.a.01,"The seventh man was Red Hogan , a wiry little puncher with a wild streak and a liking for hell raising .",0.7274945947489677
small.a.01,"I found a trooper once the Apache had spread-eagled on an ant hill , and another time we ran across some teamsters they 'd caught , tied upside down on their own wagon wheels over little fires until their brains was exploded right out o ' their skulls .",0.7640024427604006
small.a.01,"The way his red rubber lips were stretched across his pearly little teeth I though he was only having a little joke , but , no , he wanted me to bend down from the roar of wind so he could roar something into my ear .",0.7053788037229521
small.a.01,"There was no time to pick out a penny ; I got a coin between my thumb and forefinger , leaned my elbows in a very natural and casual manner on top of the truck cab and flipped my little missile .",0.7517310941264967
small.a.01,"In fact , I was watching you on that little seventeen inch screen when you rang my bell .",0.7766428780215565
small.a.01,"The keys were still in it , and I was miles away before I remembered that my clothes and purse and everything were still in the little cabana where I 'd changed '' .",0.8010435454393596
small.a.01,"At the pool 's far end was the little cabana Joyce had mentioned , and on the water 's surface floated scattered lavender patches of limp looking lather .",0.8285919788529196
small.a.01,"As cheerfully as possible , he said , `` Well , I guess we could all do with a little drink '' .",0.5441016921195316
small.a.01,"Out of the church and into his big car , it tooling over the road with him driving and the headlights sweeping the pike ahead and after he hit college , his expansiveness , the quaint little pine board tourist courts , cabins really , with a cute naked light bulb in the ceiling ( unfrosted and naked as a streetlight , like the one on the corner where you used to play when you were a kid , where you watched the bats swooping in after the bugs , watching in between your bouts at hopscotch ) , a room complete with moths pinging the light and the few casual cockroaches cruising the walls , an insect Highway Patrol with feelers waving .",0.8083336150443783
small.a.01,"He can even be a mild voiced little town guy with big town ideas and level gray eyes and a heart even Houdini could n't figure out , how it is unlocked .",0.7561954533324121
small.a.01,The toilet had n't had a sincere scrubbing in years and there were things written on the walls of the little boxed in place because you could n't keep the public out - entirely .,0.8047489985253531
small.a.01,"The two little bangs meant that he was getting impatient to have a crowd of customers waited on and that if he had to he would jerk open the door and drag out , by the opposite door handle which she would be clutching , whichever-the-hell clerk it was who thought she could waste so much store time on the pot .",0.7159631344226857
small.a.01,"Her little brown face wrinkled up , her brown eyes gleamed , and with her little gestures she said all the courteous things .",0.7196969021580393
small.a.01,"Her little brown face wrinkled up , her brown eyes gleamed , and with her little gestures she said all the courteous things .",0.7196969021580393
small.a.01,And they sat down and began their little coffee party .,0.7693038189497761
small.a.01,Now a little flush came on her pale homely face and enchantment in her eyes .,0.7247655135685349
small.a.01,You certainly could n't take them into the little apartment and if you tried to farm them out for two or three days every week they would become so confused that they would have nervous breakdowns .,0.8349118128985744
