sense,sentence,centroid_cs
announce.v.01,"He will be succeeded by Ivan Allen Jr. , who became a candidate in the Sept. 13 primary after Mayor Hartsfield announced that he would not run for reelection .",0.7597270926247145
announce.v.01,"Prior to the featured race , the stewards announced that apprentice James P. Verrone is suspended ten days for crowding horses and crossing the field sharply in two races on Wednesday .",0.817281681935043
announce.v.01,"The Texas Aggies got a day off Monday - a special gift from Coach Jim Myers for its conference victory last Saturday night , but Myers announced that halfback George Hargett , shaken up in the Tech game , would not play against Trinity Saturday .",0.8034366557725499
announce.v.01,The appointment was announced at a news conference at which Skorich said he would retain two members of Shaw 's staff - Jerry Williams and Charlie Gauer .,0.7820761456679912
announce.v.01,"Solly Hemus announced a switch in his starting pitcher , from Bob Gibson to Ernie Broglio , for several reasons :",0.7826201484224621
announce.v.01,"For example , in accordance with the fashion of the times , most transitional societies have announced economic development plans of varying numbers of years ; such is the mystique of planning that people expect that fulfillment of the plan will follow automatically upon its announcement .",0.7747219828402953
announce.v.01,"In January , 1958 , the Minister of the Interior announced that an election law was ready to be submitted to the King , the rumors of election dates appeared once again , first for spring of 1958 and later for the summer .",0.8680123855663767
announce.v.01,"`` We have nine hundred and eleven members in our charge '' , Mama announced , `` and three hundred and eighty Sunday-school scholars '' .",0.7871503176026599
announce.v.01,The one thing he missed from his farm in the Po Valley was the animals ; frequently he would take his leave of Michelangelo by announcing :,0.7086726153907379
announce.v.01,"He had already been studying the Bible ; he knew the fundamentals , and after studying with Fletcher for a time he approached Rector , announced that he wanted to be baptized and that was that .",0.7265909974627394
announce.v.01,A bustle of sheets being smoothed and pillows being arranged indicated the fille de chambre 's presence inside ; they listened and suddenly a step towards the door announced another important fact .,0.7175125480742973
announce.v.01,"`` We '' , Gibby announced , `` are not philosophers .",0.7020498561395409
announce.v.01,"Charlie Marble was back and forth on several occasions , first to confer with Andy on the advisability of cancelling the Las Vegas engagement - they decided it was wise - and later to announce that a prominent comedian , also an agency client , had agreed to fill the casino 's open date .",0.7824576446985607
announce.v.01,"A Tibetan swami from Palermo , Sicily , announced in Beverly Hills a newly discovered , ancient yoga discipline for ripple breathing which increased both pranha and cosmic attraction between sexes .",0.8138621108825156
announce.v.01,"Fosterite bishops , after secret conclave , announced the Church 's second Major Miracle : Supreme Bishop Digby had been translated bodily to Heaven and spot-promoted to Archangel , ranking with-but-after Archangel Foster .",0.8596474990984694
announce.v.01,"Jubal did not hear of Digby 's disappearance when it was announced , and , when he did , while he had a fleeting suspicion , he dismissed it ; if Mike had had a finger in it , he had gotten away with it - and what happened to supreme bishops worried Jubal not at all as long as he was n't bothered .",0.7111947320577274
announce.v.01,In 1959 SAAMI 's shooting development program announced a new activity designed to expose thousands of teen-age boys and girls to the healthy fun enjoyed through the participation in the shooting sports .,0.8054421944150698
announce.v.01,A group of sailors announced to Hudson that they would sail no farther .,0.7934787997353847
announce.v.01,`` Witt House happily announces the engagement of Fran Horowitz to Erwin Schwartz of Fife House '' .,0.7069826498477726
announce.v.01,"The dweller at p is last to hear about a new cure , the slowest to announce to his neighbors his urgent distresses , the one who goes the farthest to trade , and the one with the greatest difficulty of all in putting over an idea or getting people to join him in a cooperative effort .",0.7236696816361075
announce.v.01,"The Leopard 's Spots came from the pen of Thomas Dixon in 1902 , and in this he announced an `` unchangeable '' law .",0.7738011797500959
announce.v.01,"He has announced results on Hokan , Penutian , Uto-Aztecan , and almost all other American families and phyla , and has diagrammed their degree of interrelation ; but he has not worked out by lexicostatistics one comprehensively complete classification of even a single family other than Salish .",0.7067697310279688
announce.v.01,"The morning he walked in to announce to her , blushing , that he was married .",0.6996598778375688
announce.v.01,"Then , six weeks after the day Kitti first came into the office , Stanley announced he and Kitti were married .",0.8240487183561634
announce.v.01,"`` Exterminatin ' cow thieves is just a business proposition with me '' , he 'd blandly announce .",0.7123813372453867
announce.v.01,"Vincent G. Ierulli has been appointed temporary assistant district attorney , it was announced Monday by Charles E. Raymond , District Attorney .",0.7994417330183384
announce.v.01,"Gene Marshall , genial manager of the club , has announced that the Garden of the Gods will open to members Thursday , June 1 .",0.8288243669396609
announce.v.01,"The committee for the annual Central City fashion show has been announced by Mrs. D. W. Moore , chairman .",0.8005198022390388
announce.v.01,"Mr. and Mrs. James Janssen announce the birth of a daughter , Patricia Lynn Janssen , on March 2 .",0.6789651608442951
announce.v.01,"Mr. and Mrs. Charles Marella announce the engagement of their daughter , Miss Mary Ann Marella , to Mr. Robert L. Orcutt , son of Mr. and Mrs. Donald R. Orcutt , of Drexel Hill .",0.649177121087378
announce.v.01,"Dr. and Mrs. Richard Peter Vieth announce the engagement of their daughter , Miss Susan Ann Vieth , to Mr. Conrad Wall 3 , , son of Dr. Conrad Wall 2 , , and Mrs. Nell Kennedy Wall .",0.6890661940847642
announce.v.01,The Baltimore and Ohio Railroad announced yesterday it would reduce the total amount of its payroll by 10 per cent through salary cuts and lay-offs effective at 12.01 A. M. next Saturday .,0.8166656102557461
announce.v.01,Governor Tawes announced that a triple swearing-in ceremony will be held in his office next Friday .,0.810345047484029
announce.v.01,"But just before luncheon today the fact was announced grimly by the British navy 's chief adviser to the cabinet on underwater warfare , Capt. George Symonds .",0.8246113221973932
announce.v.01,"The jury , which was locked up in a motel overnight , was canvassed at the request of Walker after the verdict was announced .",0.7455279278820627
announce.v.01,"John C. Houghton , president of the Tareytown Acres Homeowners Association , followed that by announcing plans last night for a door-to-door fund drive throughout their subdivision on behalf of the Kowalski family .",0.8371682543826066
announce.v.01,"Student Council officers announced today the Kowalski family would be given the combined proceeds from a school dance held two weeks ago , and another dance for Fuhrmann 's 770 students this Friday night .",0.8540487889608519
announce.v.01,Britain announced that it is asking the Soviet Union to agree tomorrow to an immediate cease-fire .,0.76439402871451
announce.v.01,Britain 's plans to press Russia for a definite cease-fire timetable was announced in London by Foreign Secretary Lord Home .,0.8252662449550158
announce.v.01,"The executions took place at dawn only a few hours after Havana radio announced their conviction by a revolutionary tribunal at Pinar del Rio , where the executions took place .",0.7835149328122347
announce.v.01,Emory University 's Board of Trustees announced Friday that it was prepared to accept students of any race as soon as the state 's tax laws made such a step possible .,0.866788801086613
announce.v.01,"The New York University Board of Trustees has elected the youngest president in the 130 - year history of NYU , it was announced yesterday .",0.798637078940461
announce.v.01,"John Di Massimo has been elected president of the 1961 Columbus Day Celebration Committee , it was announced yesterday .",0.8185170911579202
announce.v.01,"Greece and West Germany have ratified an agreement under which Germany will pay $ 28700000 to Greek victims of Nazi persecution , it was announced today .",0.8027707967468453
announce.v.01,"Election of Howard L. Taylor to membership in Pacific Coast Stock Exchange , effective Tuesday , has been announced by Thomas P. Phelan , president of the exchange .",0.8030630094725872
announce.v.01,"The Service announced that taxpayers making such claims may be called on to furnish a statement from the recipient organization showing the date , purpose , amount and other particulars of the contribution .",0.7795895253046815
announce.v.01,"Enrique Jorda , conductor and musical director of the San Francisco Symphony , will fulfill two more guest conducting engagements in Europe before returning home to open the symphony 's Golden Anniversary season , it was announced .",0.7564134135993361
announce.v.01,"In announcing Jorda 's return , the orchestra also announced that the sale of single tickets for the 50 th anniversary season will start at the Sherman Clay box office on Wednesday .",0.8356826825090795
announce.v.01,"In announcing Jorda 's return , the orchestra also announced that the sale of single tickets for the 50 th anniversary season will start at the Sherman Clay box office on Wednesday .",0.8356826825090795
announce.v.01,Participating members may attend five of the concerts for $ 9 ( not all ten concerts as was erroneously announced earlier in The Chronicle ) .,0.7806325723644983
announce.v.01,"Mrs. Lenygon 's committee associates , announced formally yesterday by the AID in New York , include Mrs. Allen Lehman McCluskey and Stephen J. Jussel , both wellknown Manhattan decorators .",0.7758592122048822
announce.v.01,Last Friday the White House announced :,0.8337181159940856
announce.v.01,The principal of the school announced that - despite the help of private tutors in Hollywood and Philadelphia - Fabian is a 10 - o ' clock scholar in English and mathematics .,0.8270627591321041
announce.v.01,"`` I 'm a slob '' , he announced .",0.7532505720362439
announce.v.01,"On July 11 the head of the mineral-rich province of Katanga , Moise Tshombe , announced that his province had seceded from the country .",0.8389676593230269
announce.v.01,"The wildly erratic nature of Patrice Lumumba caused constant problems - he frequently announced that he wanted the U. N. to get out of the Congo along with the Belgians , and appealed to Russia for help .",0.763445995725933
announce.v.01,"Congressman Walter has been all-powerful in immigration matters , but he has announced plans to retire in 1962 .",0.7561161163041062
announce.v.01,The Twenty-second Soviet Communist Party Congress opens in Moscow today in a situation contrasting sharply with the script prepared many months ago when this meeting was first announced .,0.7646787179689241
announce.v.01,"And pretty soon gray fox is announcing that he won n't have anyone around that 's against him , and setting out to break his second territorial treaty with the birds .",0.7932493677425558
announce.v.01,"At the same time the orchestra announced that next season it would be giving twenty-five programs at Carnegie , and that it would be taking these concerts to the suburbs , repeating each of them in five different communities .",0.8650150502069129
announce.v.01,"This news , announced by Jerome Toobin , the orchestra 's administrative director , brought applause from the 2800 persons who filled the hall .",0.7787503118221625
announce.v.01,"The details of the suburban concerts next season , and the centers in which they will be given , will be announced later , Mr. Toobin said .",0.7653893103172676
announce.v.01,A voice on the loudspeaker system announced that if the rain let up the performance would resume in ten minutes .,0.7734219504415051
announce.v.01,My father went as a missionary to China in a generation that responded to Student Volunteer Movement speakers who held watches in their hands and announced to the students in their audiences how many Chinese souls were going to hell each second because these students were not over there saving them .,0.7222508047198958
announce.v.01,"Before the Juniors entered the ring the Steward announced that after all Juniors had moved their dogs around the ring and set them up , they could relax with their dogs .",0.7835294319962907
announce.v.01,"This dish much resembles the oysters Rockefeller made famous by Antoine 's in New Orleans , though the Palace chef announced it as a variant of Manning 's roast oysters .",0.7784772879772117
announce.v.01,"For example , the steering committee might announce that the group felt a topic under study should not be dropped for an additional week as there was still too much of it untouched .",0.7722591127031471
announce.v.01,"`` Oh , you ! '' she announced .",0.7225353909014111
announce.v.01,"He cupped his ear and shook his head at her repetition , announcing in a nettled way that he had heard her the first time .",0.715842967554769
announce.v.01,"`` What you need is a steady martingale '' , the cowboy announced after watching Owen play .",0.7640465967636252
announce.v.01,"After an unspeakable siege , lasting the better part of two months , it was announced that the studio '' owed `` the government a tax debt in excess of eight million dollars while I , who had always remained aloof from such iniquitous practices as paying taxes on the salary I had earned and the little I legally inherited as Morris ' helpless relict , was '' stung `` with a personal bill of such astronomical proportions as to '' wipe out `` all but a fraction of my poor , hard-come-by savings .",0.763000428204482
announce.v.01,"And at three different times during our turbulent marriage strange girls , with the commonest of accents , telephoned to announce to me that Letch had sired their unborn children !",0.7012400061490521
announce.v.02,"Once the full extent of this Russian military penetration of Cuba was clear , President Kennedy announced we would take whatever action was appropriate to prevent this , even if we had to go it alone .",0.7836588139234508
announce.v.02,"The Navy , on April 25 , announced it is bringing back the carrier Shangri-La from the Mediterranean , increasing to four the number of attack carriers in the vicinity of Cuba .",0.8299944335273491
announce.v.02,"On May 9 , 1958 , the Commissioner announced his rulings .",0.8397096135778346
announce.v.02,"But where the core of NATO is concerned , the Secretary of State has not only reiterated the United States ' profound attachment to the alliance , `` cornerstone '' of its foreign policy , but has announced that five nuclear submarines will eventually be at NATO 's disposal in European waters .",0.7765853454790556
announce.v.02,"Simultaneously the President announced Thursday the appointment of David L. Hackett , a special assistant ot the Attorney General , as executive director of the new Committee on Juvenile Delinquency and Youth Crime .",0.867486029836181
announce.v.02,"But as I have said before , if I announce my candidacy , I will have something definite to say about running mates '' .",0.770894291684377
announce.v.02,"Appointment of William S. Pfaff Jr. , 41 , as promotion manager of The Times-Picayune Publishing Company was announced Saturday by John F. Tims , president of the company .",0.8338393701228463
announce.v.02,"Mr. and Mrs. Jerry Chase announce the birth of a daughter , Sheila , on Wednesday in Mercy Hospital .",0.7350817897056625
announce.v.02,"Mr. and Mrs. Andrew S. Kelsey of Washington , D. C. , announce the birth of a daughter , Kira Ann Kelsey , on Monday in Washington , D. C. .",0.7648186118671905
announce.v.02,"`` This is the first time in 100 years that a candidate for the presidency announced the result of an election in which he was defeated '' , he said .",0.8115884621122371
announce.v.02,"At one point late in the day , when Palmer was lining up a 25 - foot putt on the 16 th , a thunderous cheer from the direction of the 18 th green unmistakably announced that Player had birdied the final hole .",0.750992183074716
announce.v.02,"Staged by way of announcing the gift of a large and intimate Sloan collection by the artist 's widow , Helen Farr Sloan , to the Wilmington Society of the Fine Arts , the exhibition presents a survey of Sloan 's work .",0.7659387689261826
announce.v.02,Officers who participate in the continual practice drills assured me that the President 's decision could be made and announced on the gold circuit within minutes after the first flash from BMEWS .,0.8143187370035049
