sense,sentence,centroid_cs
continue.v.01,"The inclination here is to accept a de facto cease-fire in Laos , rather than continue to insist on a verification of the cease-fire by the international control commission before participating in the Geneva conference .",0.7969333719747427
continue.v.01,"The bride , daughter of Mr. and Mrs. Charles Ervin Glison of Pampa , has attended Texas Woman 's University and will continue her studies at SMU .",0.7001251155607306
continue.v.01,"`` Emory could not continue to operate according to its present standards as an institution of higher learning , of true university grade , and meet its financial obligations , without the tax-exemption privileges which are available to it only so long as it conforms to the aforementioned constitutional and statutory provisions '' , the statement said .",0.7993479958373811
continue.v.01,National competition was the culmination of work which began with the school year last fall and continued until just before summer vacation .,0.6865745049066868
continue.v.01,"On the local level , compacts continue to grab a larger share of the market at the expense of lower-priced standard models and foreign cars .",0.7830636427624902
continue.v.01,"There they continued their studies at the university , she in art , he in architecture .",0.7187652425603734
continue.v.01,Sunday New Orleans brunches continue at the Trade Winds but the daily French buffets have been called off .,0.7514908062732429
continue.v.01,"To continue their important conversations about the Tunisian issue and the whole range of other problems , Mr. Kennedy invited stevenson to Cape Cod for the weekend .",0.7113756863020326
continue.v.01,That improvement is continuing .,0.7954048206785476
continue.v.01,It is good to know that Georgia will continue to have sufficient electrical power not only to meet the demands of normal growth but to encourage a more rapid rate of industrialization .,0.8315104762337893
continue.v.01,Both Mr. K 's have so far continued to speak softly and carry big sticks over Laos .,0.7988819056224051
continue.v.01,"`` The established pattern of relative calm in the field of race relations has continued in all areas '' , reported this group headed by Harold Colee of Jacksonville and including two South Floridians , William D. Singer and John B. Turner of Miami .",0.7892641380715342
continue.v.01,"I settled it tonight '' , he continued .",0.6094949772355344
continue.v.01,"Certainly , most continue to lack a certain warmth in communication with other people , but many adjust to school , even college , to jobs and even to marriage and parenthood .",0.7555225307401396
continue.v.01,"Until professional planners meet this situation squarely and update the concepts of zoning in a manner acceptable to the courts , I hope we in East Greenwich can continue to shape our own destiny .",0.8257888002854813
continue.v.01,Sir - People continue to inquire the reason for the race for outer space .,0.8003908622136601
continue.v.01,We feel that The Detroit News is to be complimented upon arranging for articles on these subjects and we hope that it will continue to provide material along wholesome lines .,0.8513706391647948
continue.v.01,The war could have continued many years with many thousands killed on both sides .,0.741384152410683
continue.v.01,"But our outlook has been , and continues to be , defensive .",0.7120572352084158
continue.v.01,We welcome this able brief for the negative as part of a many-sided discussion of the Atlantic Common Market which NR will be continuing in our pages .,0.7506847018889501
continue.v.01,In his concluding paragraph he writes : `` The devoted writer of humor will continue to try to come as close to truth as he can '' .,0.8486140930728469
continue.v.01,"The original impulses came to England late ( in the sixteenth century ) and continue strong long after everyone else had gone on to the baroque basso continuo , sonatas , operas and the like .",0.7287370672294237
continue.v.01,"Nostalgia Week at Lewisohn Stadium , which had begun with the appearance of the 70 - year-old Mischa Elman on Tuesday night , continued last night as Lily Pons led the list of celebrities in an evening of French operatic excerpts .",0.6878957085575517
continue.v.01,"It will continue to be important as a means of orientation to the Negro , seeking to become urbanized , as he tries to make adjustment to the urban life .",0.8513188013352277
continue.v.01,"Doubts thus inculcated left me floundering for a while and , like some higher critical friends , trying to continue to use the Bible as the Word of God while at the same time holding it to have been subjected to a vast number of redactions and interpolations :",0.814366901305104
continue.v.01,"Mr. Philip Toynbee writes , for example , that `` in terms of probability it is surely as likely as not that mutual fear will lead to accidental war in the near future if the present situation continues .",0.7454452039166011
continue.v.01,If it continues indefinitely it is nearly a statistical certainty that a mistake will be made and that the devastation will begin '' .,0.7814998628800662
continue.v.01,"Even Professor Arnold Toynbee , agreeing with his son , does so in these terms : `` Compared to continuing to incur a constant risk of the destruction of the human race , all other evils are lesser evils .",0.7700299658908626
continue.v.01,We should not allow the image of an immanent end brought about indirectly by our own action in the continuing human struggle for a just endurable order of existence to blind us to the fact that in some measure accelerating the end of our lease may be one consequence among others of many other of mankind 's thrusts toward we know not what future .,0.7575451438305008
continue.v.01,"As our discussion continued , the inadequacy of the `` client relationship '' as an interpretation of their `` way of operating '' became evident .",0.6907787435047893
continue.v.01,"It seems reasonable that if general nuclear war is not to be one cataclysmic act of burning each other 's citizens to cinders , we must have a manned strategic force of long-endurance aircraft capable of going into China or Russia to find and destroy their strategic forces which continued to threaten us .",0.712095325721344
continue.v.01,The American Pointer Club is still continuing to donate a trophies to Juniors who win at Junior Showmanship Classes with Pointers .,0.7836705713627968
continue.v.01,"In 1453 when the last vestige of ancient Roman power fell to the Turks , the city officially shifted religions - although the Patriarch , or Pope , of the Orthodox Church continued to live there , and still does - and became the capital of the Ottoman Empire .",0.7947828654645271
continue.v.01,"Outside I walked past the entrance to St. Sophia , turned left at the end of it , and continued toward a gate in the wall ahead .",0.6017112164349243
continue.v.01,"To release clay from mold , place hands in a cupped position around project ; gently lift the edge on far side , then continue to release edge completely around mold .",0.7575657746503099
continue.v.01,"Centering around this historic old structure , a group of public-spirited Barbour County citizens have organized and planned a week-long series of events , beginning on May 28 th and continuing through June 3 rd , to observe most appropriately the centennial of the first land engagement of the Civil War at Philippi .",0.6160501463521272
continue.v.01,"Such extra-thick insulation not only permits a much smaller cooling installation , but will continue to reduce operating expenses both in heating and cooling .",0.8246262180169542
continue.v.01,"`` Pulley Bey insisted that she bestow her favors on him '' , the friend continued .",0.6215716933506635
continue.v.01,"It 's perfectly normal for babies to suck their thumbs , and no mother need worry if a child continues this habit until he is two or three years old .",0.7128934518989236
continue.v.01,"The values and talents which made the tile and the dome , the rug , the poem and the miniature , continue in certain social institutions which rise above the ordinary life of this city , as the great buildings rise above blank walls and dirty lanes .",0.7560066302063428
continue.v.01,"The promenade , for example , continues to take place on the Chahar Bagh , a mile-long garden of plane and poplar trees that now serves as the city 's principal street .",0.8639357615524537
continue.v.01,"And of course religious life continues to center in the more famous mosques , and commercial life - very much a social institution - in the bazaar .",0.7872219264838392
continue.v.01,"`` But you want a job guaranteed when you return '' , I continued my attack .",0.6978915194909986
continue.v.01,"Indeed , it seems that only in today 's Southern fiction does Tobacco Road , with all the traditional trimmings of sowbelly and cornbread and mint juleps , continue to live - but only as a weary , overexploited phantom .",0.7808721314178941
continue.v.01,The depersonalization continued as the dancer was further metamorphosed by the play of lights upon his figure .,0.7900328245732022
continue.v.01,"Lincoln saw that the act of secession made the issue for the Union a vital one : Whether it was a Union of sovereign citizens that should continue to live , or an association of sovereign states that must fall prey either to `` anarchy or despotism '' .",0.7721157772153492
continue.v.01,"Monogamy is the vice from which the abjectly fearful middle class continue to suffer , whereas the beatnik has the courage to break out of that prison of respectability .",0.7550997045795452
continue.v.01,My sincere wish is that he continues to add to this record he sets here today .,0.8049367761558509
continue.v.01,"Notwithstanding state aid , the local governments are continuing to seek additional revenue of their own by strengthening the property tax .",0.7980248008893959
continue.v.01,"This condition will undoubtedly continue until such time as a state uniform system of evaluation is established , or through mutual agreement of the local assessing officials for a method of standard assessment practice to be adopted .",0.7656634817190127
continue.v.01,We also continued to run a series of ads featuring endorsement of Rhode Island by industrialists who had recently established new plants here .,0.8320073630253052
continue.v.01,It will continue to be an objective of this division to encourage the acceptance of planning as a proper and continuing responsibility of local government .,0.7764129469689426
continue.v.01,"To this end , the community assistance program of the planning division will continue to be operated as a staff function to make available , on a shared cost basis , technical planning assistance to those communities in the state unable to maintain their own planning staff .",0.808986744472927
continue.v.01,"It is at this time that we should imitate the Pilgrims by accompanying our prayers of thanks with the conviction that we shall continue to be in dire need for the Lord 's protection in the future , if we are to have peace ; Now , therefore , do I , John A. Notte , Jr. , Governor of the State of Rhode Island and Providence Plantations , proclaim Thursday , November 23 rd , 1961 , as Thanksgiving Day ,",0.787893010910782
continue.v.01,"And so , let us remember on this day not only to thank the Almighty Who gave hope and courage to the Pilgrims , but also to place our trust in Him that He will continue to protect us in the future as He has in the past .",0.8203365760323278
continue.v.01,The demand for teaching sets continues unabated since they provide the means for the military physicians to review the pathology of selected disease processes or organ systems for review of basic sciences and correlation of clinical physiological behavior with structural changes .,0.821456252173946
continue.v.01,"In fiscal year 1959 , the Medical Museum was moved to Chase Hall , a temporary building on Independence Avenue at Ninth Street , Southwest , and continued to display to the public the achievements of the Armed Forces Medical Services .",0.783468800787221
continue.v.01,"Throughout the period and during the movement operation , the Museum continued its functional support of the Armed Forces Institute of Pathology .",0.819524803789892
continue.v.01,"Since the writer had not noticed this characteristic in married students scattered throughout the various sections previous to this experiment , nor , as a matter of fact , in those who were continuing in `` single sections '' , he can only conclude that there must have been something `` contagious '' within the specific group which caused this to occur .",0.7242622685801836
continue.v.01,They continued to give an arm-elevation .,0.7926822948361442
continue.v.01,"But because it was a suspense gangster story of the Capone era , many of us felt that it might catch on for a run in Chicago , continue as a road company , and eventually become a movie .",0.7678447074339999
continue.v.01,"Nevertheless , she continued to move upward .",0.7774198206648303
continue.v.01,"Then she continued with energy , `` I myself did not see her until a week after she had run off to find the father .",0.6153525693604026
