sense,sentence,centroid_cs
continue.v.03,"Rookie Ron Nischwitz continued his pinpoint pitching Monday night as the Bears made it two straight over Indianapolis , 5 - 3 .",0.7231690823356959
continue.v.03,"According to a newspaper report of the 1961 statistics of the Church of England , the `` total of confirmed members is 9748000 , but only 2887671 are registered on the parochial church rolls '' , and `` over 27 million people in England are baptized into the Church of England , but roughly only a tenth of them continue '' .",0.7572754115883779
continue.v.03,The numbering system used in Tables 1 and 2 and Figures 1 and 2 was continued for the 21 growth centers .,0.8058396490316201
continue.v.03,"This medication was continued until February , 1958 .",0.7908761564944352
continue.v.03,"Because of increasing anemia , triamcinolone , 8 mg. daily , was started on Feb. 23 , 1958 , and was continued until july , 1958 .",0.7500718039027408
continue.v.03,"In an attempt to reverse the downhill trend by stimulating the bone marrow and controlling any hemolytic component , triamcinolone , 16 mg. daily , was begun on Sept. 26 , 1958 , and continued until Feb. 18 , 1959 .",0.6777366221984122
continue.v.03,"When radio came in , it continued the misplaced modifier in its routines as a standard device .",0.860737555599147
continue.v.03,"My advice , if you live long enough to continue your vocation , is that the next time you 're attracted by the exotic , pass it up - it 's nothing but a headache .",0.7347927923879626
continue.v.03,"Equally a master of prose and verse , he recreates the glory of Sweden in the past and continues it into the present .",0.7550455951768226
continue.v.03,"They isolate out easily , naturally , and unambiguously from the continuum of nature and existence ; and they should be given priority in the basic list as long as they continue to show these qualities .",0.7732658450919955
continue.v.03,The international theme will be continued with the Balkan strings playing for a dinner the Byron Harveys will give in the Racquet club after the tea .,0.7694417201679851
continue.v.03,The Troop is proud of its camping-out program - on year-round schedule and was continued even when sub-zero temperatures were registered during the past winter .,0.8313003700854802
continue.v.03,"When this and other units combined to form the present group , it was taken on as a continuing fund-raiser .",0.7849492329825583
continue.v.03,"He was found guilty of reckless driving yesterday by Traffic Judge George T. Murphy , who continued his no-driving probation for another year and ordered him to spend 15 days in the Detroit House of Correction .",0.7914711689298589
continue.v.03,"`` When and if it can do so without jeopardizing constitutional and statutory tax-exemption privileges essential to the maintenance of its educational program and facilities , Emory University will consider applications of persons desiring to study or work at the University without regard to race , color or creed , continuing university policy that all applications shall be considered on the basis of intellectual and moral standards and other criteria designed to assure the orderly and effective conduct of the university and the fulfillment of its mission as an institution of Christian higher education '' .",0.6746666885298678
continue.v.03,It could have continued testing to the full on the grounds that the radiation danger was far less than the danger of Communist world domination .,0.8100615122951378
continue.v.03,Thanks for continuing to capture the attention and uncover so many areas of need in this amazing world .,0.6187625499007671
continue.v.03,"The Constitution of the Southern `` Confederation '' differed from that of the Federal Union only in two important respects : It openly , defiantly , recognized slavery - an institution which the Southerners of 1787 , even though they continued it , found so impossible to reconcile with freedom that they carefully avoided mentioning the word in the Federal Constitution .",0.8316551761673102
continue.v.03,"Much as he abhorred slavery , Lincoln was always willing to concede to each `` slave state '' the right to decide independently whether to continue or end it .",0.771952898679557
continue.v.03,"Our media advertising continued , during 1960 , its previous effective program that stressed such specifics as 100 % financing , plant availabilities , and location advantages .",0.8167922176321214
continue.v.03,Approximately 100 representatives of business attended this conclave and the R. I. Export Conference Committee later voted to continue the activity as an annual event .,0.8490425526175817
continue.v.03,"This comment and others similar to it , would seem to indicate a possible justification for continuing the status quo .",0.822930224297189
continue.v.02,Can we continue to alienate precisely those whose gifts we so desperately need and apart from whose co-operation our mission in the world must become increasingly precarious ?,0.7340492708141858
continue.v.02,"And yet this is exactly the risk we run when we assume , as we too often do , that we can continue to preach the gospel in a form that makes it seem incredible and irrelevant to cultured men .",0.8308963856297701
continue.v.02,"Continuing glibly in this vein , he paused to comfort her :",0.770701945687538
continue.v.02,"The two major newspapers in Providence continued , throughout the crisis , to accuse each other of misrepresenting the facts and attempting to falsify history .",0.8250012117201031
continue.v.02,"While the Daily Post continued to accuse Republicans and the Daily Journal continued to accuse Democrats , the Woonsocket Patriot complained that the Virginia authorities showed indecent and cowardly haste to condemn Brown and his men .",0.8376123593724965
continue.v.02,"While the Daily Post continued to accuse Republicans and the Daily Journal continued to accuse Democrats , the Woonsocket Patriot complained that the Virginia authorities showed indecent and cowardly haste to condemn Brown and his men .",0.8376123593724965
continue.v.02,"Monsieur Favre 's threat would become a reality , for he continued to proclaim loudly that the city must rid itself of `` that Frenchman '' .",0.8237909541769359
continue.v.02,"Kahler continued : `` I fixed his dog the other day and I guess he 's sore , so I expected him to come barging in '' .",0.6816637187077768
continue.v.02,`` Who 's in it '' ? she continued .,0.7418625842227797
continue.v.02,"Too many husbands , Dr. Schillinger continues , worry about `` how well they 're doing '' , and fear that their success depends on some trick or technique of sexual play .",0.6514313335534642
continue.v.02,Pasley continued : `` They became an institution of the Chicago scene and marked the way to the moral and financial collapse of the municipal and county governments in 1928 - 29 '' .,0.6863238973158328
continue.v.02,"However , I am recommending that development work on the B-70 air-frame and engines be continued .",0.7597160251546982
continue.v.02,Funds are also included in this budget to continue the equipping of the B-52 wings with the Hound Dog air-to-surface missile .,0.7358382191256787
continue.v.02,"`` Onleh one thiihng '' , Mrs. Roebuck continued .",0.7580600258473991
continue.v.02,"Then he could tell them to go home , while the administration continued to wage the battle with the $ 28 million in extra revenues the sales tax measure would bring in over an eight months period .",0.7977087585277857
continue.v.02,Mr. Werner said yesterday that operations continued through the week .,0.699164289996397
continue.v.02,"Altho federal and city narcotic agents sometimes worked together , Sokol continued , rivalries developed when they were `` aiming at the same criminals '' .",0.6567783665440562
continue.v.02,"`` In the same five year period that the United States says they [ the detectives ] were engaged in this conspiracy '' , Sokol continued , `` these three young men received a total of 26 creditable mentions and many special compensations , and were nominated for the Lambert Tree award and the mayor 's medal '' .",0.6958280626144501
continue.v.02,"Attendance continued to run ahead of last year 's during the five-day show , with clear skies helping attract fairgoers .",0.77781298200755
continue.v.02,"At the very moment that every attempt is being made to take management out from under the irrationality of anti-trust legislation , a drive is on to abolish collective bargaining under the guise of extending the anti-monopoly laws to unions who want no more than to continue to set wages in the same way that ship operators set freight rates .",0.7708826656575324
continue.v.02,"The problem grows in intensity each year as man 's knowledge , and his capacity to translate such knowledge to the written word , continue to expand .",0.7375737217265359
continue.v.02,`` The committee continues to feel that Florida has progressed in a sound and equitable program at both the state and local levels in its efforts to review and assess transition problems as they arise from time to time in the entire spectrum of civil rights '' .,0.7240899409667059
continue.v.02,"More recently , the chairman of the Atomic Energy Commission , Dr. Glenn T. Seaborg , `` admitted '' to a news conference in Las Vegas , Nevada , that the US might fall behind Russia ( he apparently meant in weapons development ) if the Soviets continue to test in the atmosphere while we abstain .",0.7793587580509257
continue.v.02,"But the army which Mao continues to feed well , where are its sympathies ?",0.7818225537229498
continue.v.02,"WBAI is on the right track : in the sound medium there has been excessive emphasis on music and news and there could and should be a place for theatre , as the Canadian and British Broadcasting Corporations continue to demonstrate .",0.7893861394321111
continue.v.02,"We have to tell ourselves that when Parker spoke in this vein , he believed what he said , because he could continue , `` But the truth , which cost me bitter tears to say , I must speak , though it cost other tears hotter than fire '' .",0.6789476491339332
continue.v.02,And may you all continue to show at Westminster in the years to come '' !,0.7599150427499104
continue.v.02,"With the Ambassador as headquarters , she continued to promote good will abroad .",0.8486942701198054
continue.v.02,"The lives so many of them gave , to forestall what they believed would be a fatal encroachment by the Union on the powers reserved to their states have continued ever since to safeguard all Americans against freedom 's other foe .",0.737733376115607
continue.v.02,"Continuing with the case in which \ g is a * * f curve on a quadric Q , we first observe that the second regulus of Q consists precisely of the lines which join the two free intersections of \ g and the planes through any one of the multiple secants .",0.5884281235560771
continue.v.01,`` Failure to do this will continue to place a disproportionate burden '' on Fulton taxpayers .,0.8219792872692787
continue.v.01,"This year , I am told , the CBS network will continue to abide by the rule but NBC will play to a conclusion here .",0.8513036481115348
continue.v.01,"Other items on the agenda during the meetings , which are expected to continue through Saturday , concern television , rules changes , professional football 's hall of fame , players ' benefits and constitutional amendments .",0.700534787779648
continue.v.01,"The opinion continues here that with a 162 - game schedule , pitching spread thin through a 10 - team league and a most inviting target in Los Angeles ' Wrigley Field Jr. , Mantle just might break the most glamorous record on the books , Babe Ruth 's 60 homers of 1927 .",0.6162211813042576
continue.v.01,During this precarious period of development the mother should continue to influence the growth of the child 's conscience .,0.854109243601592
continue.v.01,It will continue all month .,0.7239608762765144
continue.v.01,"It is they , of course , who keep it alive and preserve it so the same spirit will continue to be present in the Corps for future recruits to find as they come into it .",0.8368775958653935
continue.v.01,"Although the theological forms of the past continue to exist in a way they do not in a more secularized situation , the striking thing is the rapidity with which they are being reduced to a marginal existence .",0.8256879470204491
continue.v.01,"There was so much interest shown in this present-day venture that it was continued on B.B.C. , where comments were equally made by an Anglican parson , a Free Church minister and a Catholic priest .",0.7194287547746145
continue.v.01,"`` Wherefore also He [ God ] drove him [ man ] out of Paradise , and removed him far from the tree of life , not because He envied him the tree of life , as some venture to assert , but because He pitied him , [ and did not desire ] that he should continue a sinner for ever , nor that the sin which surrounded him should be immortal , and evil interminable and irremediable .",0.7097210060325537
continue.v.01,But to continue to divorce advanced students from reality is inexcusable .,0.8052604512758709
continue.v.01,"When consciousness deserts the sleeping body and the wakeful world , it continues in the myriad progressions of the ever-present past and future , in a life as vibrant and real as the one left when the body tired and required sleep .",0.7693590059007045
continue.v.01,The material of the Porter film is simplicity itself ; much of it has continued to be used over the years and the heart of it - good guys and bad guys in the old West - pretty well dominated television toward the end of the 1950's .,0.8003481806255061
continue.v.01,Yet paradoxically my liberal friends continue to view Jefferson as one of their patron saints .,0.7947300510572053
continue.v.01,The social and psychological consequences of this continue to affect the area .,0.8107010735399379
continue.v.01,"A 5 - percent royalty is paid on any production during the period the contract is in effect ; if the Government certifies that production may be possible from the property , the royalty obligation continues for the 10 - year period usually specified in the contract or until the Government 's contribution is repaid with interest .",0.7431833578196633
continue.v.01,She continues to add to the pollen supply as needed .,0.7255685879532515
continue.v.01,"The pulmonary artery , in addition to supplying the distal portion of the respiratory bronchiole , the alveolar duct , and the alveoli , continues on and directly supplies the thin pleura ( fig. 8 ) .",0.6754795574365857
continue.v.01,"Third , the process of calcification is seen to begin later and to continue much longer for these boys than for the girls , a fact which confirms data for other groups of children .",0.7502903693627231
continue.v.01,They must continue to satisfy basic capital needs ; and there persists the dual problem of maintaining operational unity around a national program of modernization while simultaneously decentralizing participation in the program to wider and wider groups .,0.8084891121291939
continue.v.01,"Voter registration began in late November 1959 and continued until early January , 1960 .",0.6739030804735943
continue.v.01,Ripe Geometric potters continued to employ the old syntax of ornaments and shapes and made use of the well-defined though limited range of motifs which they had inherited .,0.8052828689613808
continue.v.01,The Village office of Western Union with George Towsley as manager and telegrapher continued in Hard 's drugstore until 1905 .,0.7593131659554161
continue.v.01,"It was because of this chain-reaction as much as for any other reason - that is , because of the growing independence of the planar unit in collage as a shape - that the identity of depicted objects , or at least parts of them , re-emerged in Braque 's and Picasso 's papiers colles and continued to remain more conspicuous there - but only as flattened silhouettes - than in any of their paintings done wholly in oil before the end of 1913 .",0.7927207932425856
continue.v.01,"However , the building of freeways and garages cannot continue forever .",0.7784579759617744
continue.v.01,"If the retailer and hotelman 's downtown unit sales have been decreasing , however , his dollar volume continues to rise , and it is dollars which you put in the bank .",0.7877847985214165
continue.v.01,Accounting procedures which continue to charge a disproportionate overhead and warehouse expense to the main store make the branches seem more profitable than they are .,0.804321656089681
continue.v.01,"The downtown store continues to offer the great inducement of variety , both within its gates and across the street , where other department stores are immediately convenient for the shopper who wants to see what is available before making up her mind .",0.8319415798122243
continue.v.01,"A dozen cows mooed sadly and regarded us as if we were insane , as perhaps we were at that moment , with the crazy excitement of our first encounter , the yelling and shooting still continuing up at the road , and the thirst of some of the men , which was so great that they waded into the muddy water and scooped up handfuls of it .",0.7337780892743823
continue.v.01,But William continued to find a bitter joy in smashing images and tearing down symbols sacred to the Old Church .,0.766340079110842
continue.v.01,"Geneva , instead of becoming the City of God , as John had dreamed , had in the two years since he had been there , continued to be a godless place where all manner of vice flourished .",0.7630107098377263
continue.v.01,"She lost not a second , picking herself up and continuing her pilgrimage to Laura .",0.6814878237045273
continue.v.01,"It could continue this way , hitting 106 and more in the Valley , Joe McFeeley knew , into October .",0.7494246286873081
continue.v.01,We all seek the same thing through different ways - an end to this long night of two thousand years of darkness and unspeakable abuses which will continue to plague us until the Star of David flies over Zion '' .,0.7505166811625991
continue.v.01,"But that year was different , for just as the city , in the form of my street clothes , had intruded upon my mountain nights , so an essential part of the summer gave promise of continuing into the fall : Jessica and I , about to be separated not by a mere footbridge or mess-hall kitchen but by the immense obstacle of residing in cruelly distant boroughs , had agreed to correspond .",0.701570240914525
continue.v.01,On Earth elections continued and a very advanced poet published a limited edition of verse consisting entirely of punctuation marks and spaces ; Time magazine reviewed it and suggested that the Federation Assembly Daily Record should be translated into the medium .,0.71999902429668
continue.v.01,"This continued most of the week following that ill-starred trip to church , during which period Mike stayed in his room and usually in a trance so deep that Jubal would have pronounced him dead had he not seen it before .",0.7011157568508539
continue.v.01,"It is not an entirely happy book , as Mrs. Fink soon becomes jealous of Alicia and , in retaliation , refuses to continue to scrape the algae off her glass .",0.7302785683097422
continue.v.01,"The battle of the drib-drool continues , but most of New York 's knowing sophisticates of Abstract Expressionism are stamping their feet impatiently in expectation of V ( for Vindication ) Day , September first , when Augustus Quasimodo 's first one-man show opens at the Guggenheim .",0.6553144999697661
continue.v.01,"During all this time Roy continued to paint , first only on weekends , and then , as the family business permitted , for longer periods .",0.760302740080916
continue.v.01,"The brothers continued to help each other during their studies , sharing a joint purse , lodging together in the dormitory and dining together at the home of their aunt .",0.8117524961967061
continue.v.01,"Oersted joined Ritter at Jena and stayed with him for 3 weeks , continuing their correspondence after he left .",0.7014880982789555
continue.v.01,"However , he continued experimenting and lecturing , publishing the results of his experiments in German and Danish periodicals .",0.7913262603481662
continue.v.01,He continued as a popular lecturer .,0.813588747030679
continue.v.01,There has been an intensification of price consciousness in recent years ; there is every indication it will continue .,0.8339962276631732
continue.v.01,These shifts will continue in the next 10 yr. .,0.7843793364892674
continue.v.01,"Display merchandising , backed by pre selling through advertising and promotion , will continue to make strides in the sixties .",0.8030360417554844
continue.v.01,"The growth of business has outdistanced the available supply , and the demand will continue to exceed the supply in the sixties .",0.8464946730400825
continue.v.01,"He thereby precipitated a bitter controversy involving Protestants , Jews and Roman Catholics that continued for two months , until the city 's Board of Hospitals lifted the ban on birth-control therapy .",0.6416008583297402
continue.v.01,"When in 1816 an act of Congress forced the foreign firm out of the United States , its British born employees , now become American citizens - Joseph Rolette , Joseph Renville and Alexis Bailly - continued in the fur business .",0.7587698641954816
continue.v.01,"New Englanders were a bit sensitive on the subject of their complicity in Negro slavery at the time of the drafting of the Declaration of Independence , as Jefferson explained in his `` Autobiography '' : `` The clause reprobating the enslaving the inhabitants of Africa was struck out in complaisance to South Carolina and Georgia , who had never attempted to restrain the importation of slaves , and who on the contrary still wished to continue it .",0.7715473170285579
continue.v.01,"On the other hand , if he wishes to continue in his chosen profession , he must abandon his own code and sacrifice his precious individualism .",0.7791098794269568
continue.v.01,Its growth continues steadily on a par with past growth ; and no limitation is in evidence .,0.7799153475088239
continue.v.01,"It would be profitable , I believe , to read these realistic humorists alongside Faulkner 's works , the thought being not that he necessarily read them and owed anything to them directly , but rather that they dealt a hundred years ago with a class of people and a type of life which have continued down to our time , to Faulkner 's time .",0.7011116648783068
continue.v.01,"This result is preliminary , and work is continuing .",0.7573668663843509
continue.v.01,Research continues on the very complex spectra of the rare earth elements .,0.7527338916710706
continue.v.01,I am pleased to note that Mr. Sulzberger will continue to serve as chairman of the board of the New York Times .,0.7886736548560728
continue.v.01,Work on the roof continues in this way .,0.8005997111204384
continue.v.01,There should be a regular electrical outlet in the shelter as power may continue in many areas .,0.7352886727867707
continue.v.01,"By making inroads in the name of law enforcement into the protection which Congress has afforded to the marriage relationship , the Court today continues in the path charted by the recent decision in Wyatt v. United States , 362 U. S. 525 , where the Court held that , under the circumstances of that case , a wife could be compelled to testify against her husband over her objection .",0.7184560182386441
continue.v.01,Text reading continues with the next occurrence .,0.7236335810302218
continue.v.01,Text reading continues with the next occurrence .,0.7236335810302218
continue.v.01,Text reading continues with the next occurrence .,0.7236335810302218
continue.v.01,Tone analysis will continue to be difficult and unsatisfactory until a more representative selection of systems is familar to every practicing field linguist .,0.8154281212532103
continue.v.01,The U. S. Office of Education continues to stress local surveys rather than national surveys .,0.806820893388252
continue.v.01,"As a strike continues , these parties increase their pressure on the industry to reach an agreement .",0.6675129328573464
continue.v.01,"The change was not quite so dramatic as it sounds because in fact common norms continued to be invoked by municipal courts and were only gradually changed by legislation , and then largely in marginal situations .",0.8055991896923959
continue.v.01,"For exactly one week , she was able to continue in this manner .",0.7896973440499396
continue.v.01,"Two millions were added to what had been set aside for it in Mrs. Meeker 's lifetime , and the proviso made that as long as Brian Thayer continued to discharge his duties as administrator of the fund to the satisfaction of the board of trustees ( hereinafter appointed by the bank administering the estate ) he was to be retained in his present capacity at a salary commensurate with the increased responsibilities enlargement of the fund would entail .",0.7403213543972845
continue.v.01,"Brenner continued to smile , but his eyes were cold .",0.7281097347383093
continue.v.01,The horse continued to snort .,0.7475430810206822
continue.v.01,"Visibility continued to be limited , and Greg was never able to get above a thousand feet .",0.7210434451032133
continue.v.01,The opposing aircraft continued to come on .,0.7261502208966641
continue.v.01,Greg wished the Air Corps had continued to camouflage planes .,0.7804438761277009
continue.v.01,The clearly identifiable enemy continued on as if no one else were around .,0.7181592668203434
continue.v.01,"This was a training ship and the training would continue , but there was an element of frightful absurdity here which Alexander recognized .",0.80856657912689
