sense,sentence,centroid_cs
postdate.v.01,It should be possible to free carbon tetrachloride of any interfering substances by the usual purification methods followed by prechlorination prior to addition of radioactive chlorine .,0.7392855732608646
postdate.v.01,A mild electrical shock served as a conditioned stimulus and was followed by feeding .,0.7944038934386304
postdate.v.01,"For example , in accordance with the fashion of the times , most transitional societies have announced economic development plans of varying numbers of years ; such is the mystique of planning that people expect that fulfillment of the plan will follow automatically upon its announcement .",0.7756549880183843
postdate.v.01,Man is first religious ; the instrumentalities follow .,0.753341134596534
postdate.v.01,"There followed a long and sometimes bitter discussion of the feasibility of elections for the fall of 1957 , in which it appears that the Minister of the Interior took the most pessimistic view and that the Istiqlal was something less than enthusiastic .",0.6457215077645423
postdate.v.01,The increase in oxygen uptake rates from 1.2 to 2.6 mg / l / hr which followed an increase in rotor speed was believed to be related to resuspension of solids which had settled at the lower rotor speeds .,0.7628220059475043
postdate.v.01,"Within this framework , what followed was strained , even macabre .",0.6901168335343842
postdate.v.01,"The story opens on the eve of his fifty-third birthday , as he prepares for the two weeks of festivities that are to follow .",0.7679947319312733
postdate.v.01,"Outputs of the two systems are measured by a pulse timing circuit and a resistance bridge , followed by a simple analogue computer which feeds a multichannel recorder .",0.6839254056025824
postdate.v.01,"Han 's student days were at a time when Europe was in a new intellectual ferment following the revolutions in America and in France , Germany and Italy were rising from divisive nationalisms and a strong wave of intellectual awareness was sweeping the Continent .",0.70858217660686
postdate.v.01,"Following the kick-off of SAAMI 's shooting development program in 1954 , a most interesting meeting took place in Washington , D. C. .",0.7243881812167217
postdate.v.01,"Following a vigorous campaign of interpretation and leadership development by OEP director Dr. Julian Smith , today thousands of secondary schools , colleges and universities have shooting and hunting education in their physical education and recreation programs .",0.679652358915526
postdate.v.01,This is followed by a tremendous suck of water away from the shore as the first great trough arrives .,0.7949331313434627
postdate.v.01,"During the decade that followed , the common man , as that piece put it , grew uncomfortable as the Voice of God and fled from behind Saint Woodrow ( Wilson ) only to learn from Science , to his shocked relief that after all there was no God he had to speak for and that he was just an animal anyhow - that there was a chemical formula for him , and that too much could n't be expected of him .",0.670268687228074
postdate.v.01,Let us survey for a moment the development of modern thought - turning our attention from the Reformation toward the revolutionary and romantic movements that follow and dwelling finally on more recent decades .,0.7506571400682139
postdate.v.01,Fiscal year taxpayers have until the last day of the first month following the close of the fiscal year ( farmers until the 15 th day of the 2 d month ) .,0.6780148617745243
postdate.v.01,"If a taxpayer dies , the executor , administrator , or legal representative must file the final return for the decedent on or before the 15 th day of the 4 th month following the close of the deceased taxpayer 's normal tax year .",0.7175996752170126
postdate.v.01,The Congress of Vienna is a convenient starting point because it both epitomized and symbolized what was to follow .,0.7157761922828558
postdate.v.01,"Codification was followed in all countries by a growing amount of legislation , some changing and adjusting the older law , much dealing with entirely new situations .",0.7328979167750651
postdate.v.01,"Two minutes later it came again - a double explosion , followed by a third , sounding more distant .",0.6985763011096254
postdate.v.01,She also was the original GOP national committeewoman from New Jersey in the early 1920 s following adoption of the women 's suffrage amendment .,0.6997950138519168
postdate.v.01,A small reception will follow in the Oak Park Arms hotel .,0.7293015821117492
postdate.v.01,"A plea of nolo contendere , followed by a nominal fine , after all is a small price to pay for this untrammeled license .",0.7284561402494157
postdate.v.01,But since last fall the United States has been moving toward a pro-neutralist position and now is ready to back the British plan for a cease-fire patrolled by outside observers and followed by a conference of interested powers .,0.7763299649823612
postdate.v.01,"Rouben Ter-Arutunian , in his stage settings , often uses the scrim curtain behind which Mr. Cole has placed couples or groups who sing and set the mood for the scenes which are to follow .",0.7853995394643765
postdate.v.01,"Among the particular gems in this collection is the impudent opening song of `` The Garrick Gaieties '' , an impressive forecast of the wit and melody that were to come from Rodgers and Hart in the years that followed ; Dorothy Loudon 's raucous listing of the attractions `` At the Roxy Music Hall '' from `` I Married an Angel '' ; and the incisive style with which Charlotte Rae delivers the top-drawer Hart lyrics of `` I Blush '' , a song that was cut from `` A Connecticut Yankee '' .",0.6758991891827701
postdate.v.01,"These men - for the most part educated in our `` best '' New England colleges , well established financially and socially in the community - under kindly but insistent probing , reveal little or no objective or explicit criteria or data for their generalizations about the interests and attitudes of the people they claim to serve , or about the public responses that actually follow their occasional breach of a `` client-service relationship '' .",0.772805123186666
postdate.v.01,"A jigger of dry Sherry follows , and as the mixture stiffens , in go a hundred of the little oysters .",0.6923659979788591
postdate.v.01,Construction follows a thorough study of the drawings .,0.6880633578803946
postdate.v.01,The `` Barre Aviation Field '' was set to receive its first aircraft the Sunday following the flood .,0.7430023271522322
postdate.v.01,"During the excitement following Lindbergh 's flight to Paris earlier in 1927 , dare devil aviators overnight became legendary heroes .",0.7313485389758777
postdate.v.01,This is followed by a boom in conferences .,0.7928894058939095
postdate.v.01,"In addition to the authentication and acknowledgment procedures which precede and follow the sending of the go messages , again in special codes , each message also contains an `` internal authenticator '' , another specific signal to convince the recipient that he is getting the real thing .",0.7812856889293383
postdate.v.01,The process stipulates that the choreographer sense the quality of the initial movement he has discovered and that he feel the rightness of the quality that is to follow it .,0.7971364189210068
postdate.v.01,He bases his approach on the belief that anything can follow anything .,0.6696348311619079
postdate.v.01,"Now did Welch truly become the man of the hour , and everything that followed in the procedure of Justice was a new triumph for him .",0.7392676704954634
postdate.v.01,"`` It is as though '' , I said on the historic three-hour , coast-to-coast radio broadcast which I bought ( following Father Coughlin and pre empting the Eddie Cantor , Manhattan Merry-go-round and Major Bowes shows ) `` That Man in the White House , like some despot of yore , insisted on reading my diary , raiding my larder and ransacking my lingerie ! ''",0.6500011276542554
comply.v.01,To know God he must follow in Papa 's footsteps .,0.7726846325743222
comply.v.01,Follow manufacturer 's recommendation carefully .,0.7942248560055934
comply.v.01,Jackson runs first and his Cavalry are well drilled to follow their leader .,0.7751465982284496
comply.v.01,"Today the Nasser and Kassem governments are adamantly hostile to the West , are dependent for their military power on Soviet equipment and personnel ; in almost every particular follow the Kremlin 's foreign policy line .",0.7574463266953906
comply.v.01,"Therefore , civil defense instructions received over CONELRAD or by other means should be followed .",0.8442278637001004
comply.v.01,"The first pretrial conference - held to appoint amici curiae to represent the interest of the stockholders of du Pont and General Motors and to consider the procedure to be followed in the subsequent hearings - took place on September 25 , 1957 .",0.7740855561725389
comply.v.01,Roleplaying used for analysis follows these general steps leading to training .,0.7615508800124815
comply.v.01,He expects that if the present timetable is followed a vote will be scheduled during the last week in September .,0.7617260543068066
comply.v.01,The jobs formula is understood to follow these lines :,0.7650698215631575
comply.v.01,I think everybody is agreed that we need to hear some voice on the national level that would make some sense and in which we would have some confidence in following .,0.7919765497165907
comply.v.01,The fact is that any business that wants to operate successfully cannot follow the law .,0.8589494238212059
comply.v.01,"Actually , of course , that label `` controversial '' applied only because he was carrying out the mandate given him by the world organization he headed rather than following the dictates of the Soviet Union .",0.8404486608510388
comply.v.01,"If the church has followed the plan of cultivation of prospects and carried through a program of membership preparation as outlined earlier in this book , the process of assimilation and growth will be well under way .",0.8197110653485146
comply.v.01,"Stained with Jacquelyn 's ceramic unfired stain , polished , following manufacturer 's directions .",0.7966229062338324
comply.v.01,"Follow pool-care instructions to the letter , and be sure that one person ( in the family or not ) is regularly responsible for each aspect of the job , with no chance for claiming , `` It was n't my turn '' .",0.781341596277778
comply.v.01,"In his recognition of his impersonal self the dancer moves , and this self , in the `` first revealed stroke of its existence '' , states the theme from which all else must follow .",0.7381798844867358
comply.v.01,You 're the only man the Night Riders will follow .,0.7675193987871716
comply.v.01,Ready to follow her impulse .,0.8240169355828927
follow.v.04,"The pulmonary vein , however , without the limiting supportive tissue septa as in type 1 , , follows a more direct path to the hilum and does not maintain this close relationship ( figs. 8 , 22 ) .",0.7911083231998511
follow.v.04,"Here the pulmonary vein , as in type 2 , , is noted to draw away from the bronchus , and to follow a more direct , independent course to the hilum ( figs. 23 , 24 ) .",0.8184893142462922
follow.v.04,Some of these were obviously filling from interlobular branches of the bronchial arteries while others were filling from direct hilar branches following along the pleural surface .,0.7711394260580742
follow.v.04,This was accounted for primarily by the presence of a bronchial artery closely following the pulmonary artery .,0.7761312994377614
follow.v.04,"This vessel could be followed to the parenchyma where it directly provided bronchial arterial blood to the alveolar capillary bed ( figs. 17 , 18 ) .",0.7743926783605387
follow.v.04,"In type 1 , the pulmonary vein closely follows the course of the bronchus and the pulmonary artery from the periphery to the hilum .",0.7843376078685378
follow.v.04,"In type 3 , this general relationship is maintained peripherally but not centrally where the pulmonary vein follows a more independent path to the hilum as is the case throughout the lung in type 2 , .",0.8257556886401528
follow.v.04,"Before daylight Sunday morning , a posse of twenty-three men under the leadership of Deputy Sheriff Frank MacPherson of Catskill followed the trail to the house of Francisco Chaves , where 100 to 150 Mexicans had gathered .",0.7435003932013622
follow.v.04,They were going to follow it for part of their journey .,0.8163889203101093
follow.v.04,The route which he had traveled and which he believed might develop into a trade route was followed by his settlers earlier than he might have expected .,0.7789129714191404
follow.v.04,"The Fisher Body division , long controlled by the Fisher brothers under a voting trust even though General Motors owned a majority of its stock , followed an independent course for many years , but by 1947 and 1948 `` resistance had collapsed '' and its purchases from du Pont `` compared favorably '' with purchases by other General Motors divisions .",0.7055119058834094
follow.v.04,I followed a shrubbery lined gravel path alongside the house to the pool .,0.7817560257097901
follow.v.04,"He told some 350 persons that the United States ' challenge was to help countries build their own societies their own ways , following their own paths .",0.7696350078434897
follow.v.04,"Again , as faith reveals God my Father and Christ my Saviour , I follow without question where He leads me daily by His Spirit of love , wisdom , power and prayer .",0.7582222041104975
follow.v.04,"Following arrowed signs , I veered right toward the former kitchens , complete with chimneys , which now house one of the world 's greatest collections of Chinese porcelain and a fabulous array of silver dinner services .",0.7033744183026462
follow.v.04,We followed the asphalt road for a few miles and then swung off onto a smaller road which was nothing more than two tire marks on the earth .,0.7924427251853265
follow.v.04,"They did not have the wit to follow the stars in their courses , to exchange names with each other , to harvest the experience of each for the wisdom of all .",0.7757202447935626
follow.v.04,He scuttled in shadow along the east wall of the stockade and then followed the south wall until he was at the rear of the two frame buildings .,0.8225593475945954
follow.v.04,"They moved slowly , toward the main gate , following the wall .",0.7968774578224328
follow.v.04,"She stood quite still , trying to focus upon a direction in which to turn , a path to follow , a clue to guide her .",0.7790661067114472
