sense,sentence,centroid_cs
follow.v.07,It was assumed that the shift in autonomic hypothalamic balance occurring spontaneously in neuropsychiatric patients from the application of certain therapeutic procedures follows the pattern known from the sleep wakefulness cycle .,0.8136783974010551
follow.v.07,"In following this general principle , Mason provides the observer with a natural eye progression from foreground to background , and the illusion of depth is instantly created .",0.7837845813635537
follow.v.07,`` I like to follow the holidays when they come along .,0.7450522026867562
follow.v.07,"In a mobile society , congregational health depends on a constant process of recruitment ; this recruitment , however , must follow the pattern of economic integration or it will disrupt the congregation ; therefore , the recruitment or missionary outreach of the congregation will be co-optation rather than proclamation - like elements will have to be assimilated .",0.8464089458544577
follow.v.07,"Following the theme of Incarnation in the Gospels , the Christian artist and critic sees in the most commonplace and ordinary events `` figures '' of divine power and reality .",0.7602336448106115
follow.v.07,"I was just doing my job , just following orders , and for that he 's going to kill me .",0.6509014555094608
follow.v.07,"Each dancer follows the ancient Oriental pattern - she glides sideways with shoulders motionless while her stomach migrates , and , through breathing and muscle control , she sends ripples across her body to the fingertips and away to the far end of the room .",0.8104109804338103
follow.v.07,Terms and rates of interest for motors generally follow those for home appliances .,0.7880040824606042
follow.v.07,"The interlocking frame we built at the Model Railroader workshop and then installed on Paul Larson 's railroad follows the Fig. 1 scheme and is shown beginning in Fig. 7 , page 65 , and in the photos .",0.8289592651904918
follow.v.07,"And , if we follow the Rayburn pattern , as consciously or by an instinctual political sense I like to think I have followed it , then the very nature of our loyalty to our own immediate areas must necessarily be reflected in the devotion of our services to our country .",0.8233970325240821
follow.v.07,"And , if we follow the Rayburn pattern , as consciously or by an instinctual political sense I like to think I have followed it , then the very nature of our loyalty to our own immediate areas must necessarily be reflected in the devotion of our services to our country .",0.8233970325240821
follow.v.07,"While some regression is inevitable , it is discouraged rather than encouraged so that the transference does not follow the stages of planned regression associated with certain casework adaptations of the psychoanalytic model for insight therapy .",0.8567896601458637
follow.v.07,He pointed out the switch to me and for a moment I foolishly believed that he would let deed follow words .,0.6709006152988837
follow.v.03,"It follows , then , provided the possibilities have been exhausted , that the only real alternative is the general viewpoint of the `` left '' , which has been represented on the Continent by Fritz Buri and , to some extent at least , is found in much that is significant in American and English theology .",0.8426900825327474
follow.v.03,"This follows naturally since frontage on an ocean , stream , or lake provides scenic values and opportunities for the very popular recreation activities of bathing , fishing , boating , and other water sports .",0.763583914786048
follow.v.03,The real question that follows is - how are those four years used and what is their value as training ?,0.7053409965519829
follow.v.03,"It seems to follow that by and large an antagonism exists between the paleo - and the neocortex as far as emotional reactivity is concerned , and that the balance between the two systems determines the emotional responsiveness of the organism .",0.7974999954311163
follow.v.03,"It then follows that * * f is large enough , but this is not obvious from the above expression . )",0.8809913968165267
follow.v.03,"The fact that there can not be any limit points of the set except in closed intervals follows from the argument used in Lemma 1 , namely , that near any tangent point in the C-plane the curves C and **f are analytic , and therefore the difference between them must be a monotone function in some neighborhood on either side of the tangent point .",0.758580416413766
follow.v.03,It follows that any effective policy toward the underdeveloped countries must have a realistically long working horizon .,0.8663773577765979
follow.v.03,Consider what follows from the positivist view .,0.7893625242549271
follow.v.03,"It follows that victory over Communism is the dominant , proximate goal of American policy .",0.8617923810643635
follow.v.03,"In the calm which follows the reading of a poem , for example , is the effect produced by the enforced quiet , by the musical quality of words and rhythm , by the sentiments or sense of the poem , by the associations with earlier readings , if it is familiar , by the boost to the self-esteem for the semi-literate , by the diversion of attention , by the sense of security in a legitimized withdrawal , by a kind license for some variety of fantasy life regarded as forbidden , or by half conscious ideas about the magical power of words ?",0.5891844816783751
follow.v.03,"In fact , I can only say this seems to me to follow from a wide , continuous , and properly guided exposure to literary art .",0.6519927399807368
follow.v.03,"If the Department of State is to take primary responsibility for foreign policy in Washington , it follows that the ambassador is expected to take charge overseas .",0.8417668164684928
follow.v.03,"Thus committed , action might follow .",0.6870811427917709
follow.v.03,( Quotations follow '' . ),0.5991904835153034
follow.v.03,"If we make it established custom that whenever butchery on the highways grows excessive , say beyond 25000 per annum , then somebody is going to hang , it follows that the more eminent the victim , the more impressive the lesson .",0.824514080935056
follow.v.03,"If the new Soviet series has followed the general pattern of previous Russian tests , the shots were roughly half fission and half fusion , meaning a fission yield of 30 to 40 megatons thus far .",0.5230732169609422
follow.v.03,It follows that teachers as a group cannot expect any marked salary increases ; there is a limit to how much the public will pay for shoddy performance .,0.8766099439805572
follow.v.03,Thus there was really an excess of eighteenth-century charm as one of these light-weight pieces followed another on Saturday night .,0.4963002121556052
follow.v.03,"Since the complex of singular lines is of order k and since there is no complex of invariant lines , it follows from the formula * * f that the order of the involution is * * f .",0.8463908562443074
follow.v.03,"A final class of exceptional lines is identifiable from the following considerations : Since no two generators of * * f can intersect , it follows that their image curves can have no free intersections .",0.8769081434359075
follow.v.03,"Since two curves of symbol * * f on Q intersect in * * f points , it follows that there are * * f lines of * * f which are tangent to \ g .",0.8872144901769614
follow.v.03,Thus it follows that the secants of \ g are all invariant .,0.8782635727712131
follow.v.03,"Since a ruled surface of order n with n concurrent generators is necessarily a cone , it follows finally that every line through a point , P , of \ g meets its image at P , as asserted .",0.870685546622136
follow.v.03,Hence it follows that the involution within the bundle must be a perspective de Jonquieres involution of order * * f and the invariant locus must have a multiple line of multiplicity either * * f or * * f .,0.8936111439620499
follow.v.03,"If | a is the multiple secant of \ g which passes through * * f and | b is the simple secant of \ g which passes through * * f , and if * * f are the points in which | a meets \ g , and if * * f is the image of * * f on the generator | b , it follows that the image of the line * * f is * * f .",0.843498238771538
follow.v.08,"Probably a larger percentage of Virginians and South Carolinians remain unreconstructed than elsewhere , with Georgia , North Carolina , and Alabama following along after them .",0.6809688922864418
follow.v.08,"In the discussion which follows , the time average of the radio emission will be referred to as the constant component , and the superimposed periodic variation will be called the variable component .",0.6208683583184302
follow.v.08,"The African rock python , a close second , is followed in turn by the reticulate python .",0.784949222425718
follow.v.08,Detailed information on record lengths of the giants is given in the section that follows .,0.5962331761082863
follow.v.08,form - any unique sequence of alphabetic characters that can appear in a language preceded and followed by a space .,0.7942066194013516
follow.v.08,"In the Steiners have busy lives without visiting relatives only context can indicate whether visiting relatives is equivalent in meaning to paying visits to relatives or to relatives who are visiting them , and in I looked up the number and I looked up the chimney only the meanings of number and chimney make it clear that up is syntactically a second complement in the first sentence and a preposition followed by its object in the second .",0.7932562155077127
follow.v.08,"But there is every reason to regard deal as a monosyllable , and because of the fact that / l / commonly has the quality of / / when it follows vowel sounds , deal seems to be a perfectly satisfactory rhyme with real .",0.7044082646827267
follow.v.08,"It is followed by Cain Street and Piedmont Avenue , NE ; the junction of the Northeast and Northwest Expressways and Jones Avenue and Marietta Street , NW .",0.7504999754345195
follow.v.08,"The best effects come from a combination of temperate climate and plenty of late-summer rain , followed by sunny days and cool nights .",0.7850369745656139
follow.v.08,"Psychologically the reception should be the climax , following the sermon .",0.7681522244240122
follow.v.08,"They recommended , also , that `` at a fixed hour , let the entire family be assembled for night prayers , followed by a short reading of the Holy Scriptures '' .",0.786597888794889
follow.v.08,"New York led in the number of inquiries , followed by California , New Jersey , Massachusetts , and Pennsylvania .",0.7285936943493037
follow.v.06,"Other THC activities followed , conducted by shopping centers , department stores , recreation equipment dealers , radio - TV stations , newspapers , and other organizations interested in the need existing to acquaint youngsters with the proper use of sporting firearms and the development of correct attitudes and appreciations related to hunting and wise use of our natural resources .",0.7868824008773027
follow.v.06,It was a three month journey in the dead of winter followed by three months of labor on Mackinac boats .,0.7648430447449187
follow.v.06,"One of the most damaging tsunami on record followed the famous Lisbon earthquake of November 1 , 1755 ; its waves persisted for a week and were felt as far away as the English coast .",0.761223780274145
follow.v.06,A sharp tremor was followed by a jerky roll .,0.7301481042365812
follow.v.06,"In general , friendly contact with a member followed by contact with a clergyman will account for a major share of recruitment by the churches , making it quite evident that the extension of economic integration through co-optation is the principal form of mission in the contemporary church ; economic integration and co-optation are the two methods by which Protestants associate with and recruit from the neighborhood .",0.7066806972350718
follow.v.06,"There followed a customary Department of Justice hearing , at which petitioner appeared .",0.7812659327913938
follow.v.06,"Upon return of the file to the local board , petitioner was again ordered to report for induction and this prosecution followed his failure to do so .",0.7812668691263995
follow.v.06,Other examples follow .,0.6102137602923812
follow.v.06,"She glanced at the man nodding beside her , a man with weather cracks furrowed into his lean cheeks , with powdery pale eyes reflecting all the droughts he had seen , reflecting the sky and the drought which must follow now in August - yes , with eyes predicting the drought and here it was only June , only festival time again and thoughts of Gratt Shafer would not leave her .",0.706007152246099
follow.v.06,"Their Majesties , The Queen of Carnival and The Queen of Comus , have jointly issued invitations for Shrove Tuesday evening at midnight at which time they will entertain in the grand ballroom of a downtown hotel following the balls of Rex and Comus .",0.7178120057201641
follow.v.06,"Mrs. Eleanor Kowalski , 42 , died yesterday afternoon in Holy Cross Hospital of burns suffered in a fire that followed a bottled gas explosion Saturday night at the flat of her widowed mother , Mrs. Mary Pankowski , in the adjoining suburb of Warren .",0.727529447471475
follow.v.06,"There followed the historic appropriations and budget fight , in which the General Assembly decided to tackle executive powers .",0.7898018991003156
follow.v.06,Thereupon followed a demonstration that tyranny knows no ideological confines .,0.7922829941347358
follow.v.06,"During the year that followed , Dick co-operated whole-heartedly with the dentist and was delighted with the final result achieved - an upper row of strong straight teeth that completely changed his facial appearance .",0.7170332103230398
follow.v.06,"This resulted in an improved appearance , but was followed by an increase in printing cost that necessitated the institution of major economies to keep within the total of allocated funds .",0.773849761816643
follow.v.01,The Georgia Legislature will wind up its 1961 session Monday and head for home - where some of the highway bond money it approved will follow shortly .,0.6377525462659136
follow.v.01,The left will follow at once .,0.7841472109958421
follow.v.01,Following reaction the cells were scratched with a file and opened under a 20 % aqueous sodium iodide solution .,0.5711159475115588
follow.v.01,"Following observation of the fact that the reaction rates of supposedly identical reaction mixtures prepared on the same filling manifold and exposed under identical conditions often differed by several hundred per cent , a systematic series of experiments was undertaken to see whether the difficulty could be ascribed to the method of preparing the chlorine , to the effects of oxygen or moisture or to the effect of surface to volume ratio in the reaction tubes .",0.5186361307834899
follow.v.01,"With the first reports , Russell 's horse wheeled to the right and ran towards the buildings while Cook , followed by a hail of bullets , raced towards the arroyo of Salyer 's Canyon immediately in front of him , just reaching it as his horse fell .",0.6634527522067319
follow.v.01,"Shot near the heart , he turned to one side and plunged for a door to another room several feet away , three bullets following him .",0.7184197470995587
follow.v.01,"In defiance , a chinless reprobate , Jake Camaret , marched down the aisle in St. Peter 's one Sunday morning , followed by one of the women from the Bordel , whose dress and walk plainly showed the lack of any shame .",0.7515335994289886
follow.v.01,But he had to follow the light .,0.7253733370845521
follow.v.01,"He had hoped to be alone in the bombproof , but the soldier had followed him .",0.7587548697378912
follow.v.01,"Jessica Packard lifted her head and followed the retreating figure , her eyes resting nearly closed on the unself-conscious rise and fall of the rounded hips .",0.768071982208129
follow.v.01,"Alex entered first and was followed by the doctor who , for all his care , manifested a perceptible bulge on his left side where the hen was cradled .",0.7907668105465471
follow.v.01,"Winston followed her around the room , collecting the small frail objects ( Christmas , birthday , and anniversary ) and wrapping them in tissue paper .",0.7979932470592574
follow.v.01,We followed him up the stairs .,0.7688001381965562
follow.v.01,"Andy passed into the corridor , their `` good lucks '' ! following him .",0.7890438127436016
follow.v.01,"So much for the tiresome facts , as familiar to you , I'm sure , as to the constables and state troopers who followed in your wake .",0.726901483118987
follow.v.01,"Do patriots everywhere know enough about how the persecution of the Jews in Germany and later in the occupied countries contributed to terrorizing the populations , splitting apart individuals and groups , arousing the meanest and most dishonest impulses , pulverizing trust and personal dignity , and finally forcing people to follow their masters into the abyss by making them partners in unspeakable crimes ?",0.6448213343421612
follow.v.01,`` Follow me '' .,0.7454418718395751
follow.v.01,"Goulding leaped to his feet and started forward , `` Garryowen '' ! on his lips , his men following .",0.7407151133870494
follow.v.01,"One day he followed the Irish Jasper Greens , the town band , to a picnic and spent the entire day listening , while his family spent the day looking .",0.7084038390159477
follow.v.01,"In a minute , or five minutes , the business would be done ; Mahzeer would stand up , the prime minister would follow .",0.7447101966034344
follow.v.01,"The other five Slash-B men followed them inside , crowding the small room .",0.8471044690962333
follow.v.01,They followed him into the rain and across to the squat stone building fifty feet to the rear .,0.8083991337315058
follow.v.01,"`` Do n't try it '' , Brannon told him , dismounting and starting up the steps with his men following .",0.7719186382282405
follow.v.01,The others followed Brannon inside .,0.8254690782558242
follow.v.01,"Two more shots followed in quick succession , dropping him limp and huddled on the ground .",0.6434853129271783
follow.v.01,"Curt followed , reaching behind him to shut the door and hook it .",0.7186617453476131
follow.v.01,"Forced behind him momentarily , Russ followed at once and halted two steps inside .",0.8024823048993255
follow.v.01,"Less assured than the tall , wide shouldered man in the lead , Cobb followed alertly , a hand on his gun butt .",0.7947205252339722
follow.v.01,"Pat let him go , following more leisurely .",0.780126637634087
follow.v.01,"When it was followed by a second , whining even closer , Cobb swerved sharply aside into a depression .",0.6547592215112039
follow.v.01,He expected nothing for himself but that which naturally follows those marked for misfortune .,0.5523903915317954
follow.v.01,He was followed by four of his men .,0.7458189644567141
follow.v.01,Phil followed Eddie into the office and shut the door .,0.7717717072800819
follow.v.01,He followed Mr. Blatz up the cellar stairs .,0.7833981127741743
follow.v.01,"Division three will be headed by the Marines followed by 12 states ; division four will be headed by the Navy , followed by 11 states ; division five , by the Air Force followed by 11 states .",0.655817904581023
follow.v.01,"Division three will be headed by the Marines followed by 12 states ; division four will be headed by the Navy , followed by 11 states ; division five , by the Air Force followed by 11 states .",0.655817904581023
follow.v.01,"Division three will be headed by the Marines followed by 12 states ; division four will be headed by the Navy , followed by 11 states ; division five , by the Air Force followed by 11 states .",0.655817904581023
follow.v.01,"Division six will be headed by the Coast Guard , followed by the reserve forces of all services , five states , Puerto Rico , the Virgin Islands , Guam , American Samoa , the trust territories and the Canal Zone .",0.6288619697487416
follow.v.01,The driver told police he followed as the Negro man got out of the cab with his money .,0.7625706636771307
follow.v.01,"As he approached the open bandstand , erected facing the South entrance to the Executive Mansion , the band struck up the `` Star Spangled Banner '' and followed it with `` Hail to the Chief '' .",0.7707222468322192
follow.v.01,"`` Follow Secretary Hodges through the Fiat plant , and you learn this :",0.7070699146168073
follow.v.01,"The grieving Hero and her father , Leonato , followed by the Friar , left the stage .",0.7385257781326497
follow.v.01,`` It is no good recommending surrender rather than nuclear warfare with the proviso that surrender could be followed by the effective military resistance by occupied peoples .,0.6288875986342821
follow.v.01,"There being no bridge , the master had to stop at the shore ; but his companion crossed the river walking on the water and beckoned to Hwang Pah to follow him .",0.7841591083892888
follow.v.01,They 're followed by the front and rear bulkheads as illustrated .,0.7222092391040651
follow.v.01,He was closely followed by the Ohio and Indiana troops - thus the old bridge has another distinction ; that of being the first such structure secured by force of arms in the war of the ' 60 s .,0.7486086787188012
follow.v.01,"A detachment of six men from the 701 st Chemical Maintenance Company under First Lt. Howard D. Beckstrom went aboard , followed by Lt. Thomas H. Richardson , the Cargo Security Officer .",0.6766525503825228
follow.v.01,I followed them in the jeep and now they did not care .,0.7753745592491126
follow.v.01,"They 'll move around that rock all day , following the shade .",0.7165725676109057
follow.v.01,I followed him out through the lobby to the street .,0.7723200126468903
follow.v.01,"I could n't see him , but the electric bugging device gave steady beeps when it was straight ahead , short half beeps when the car I was following was to the left , and long drawn-out beeps when it turned to the right .",0.6594057961208715
follow.v.01,The gun followed her .,0.771466803305069
follow.v.01,In her mind she followed the white Buick along the road somewhere between here and the Niagara River .,0.7436593607507703
follow.v.01,He opened the door and followed Rourke out .,0.7986959212293283
follow.v.01,"Whoever it was had meant to shut him up in here , had followed him and waited till the courthouse and square were deserted .",0.7267523733428608
follow.v.01,"And why was it causing so much agitation among the Angels , and being followed by so many of them ?",0.7513645042862932
follow.v.01,"Ekstrohm smiled , and followed the captain through the airlock with only a glance at the lapel gauge on his coverall .",0.798259089770893
follow.v.01,"Finally , Mercer did manage to follow B ' dikkat to the door of the cabin .",0.777874332532492
follow.v.01,"Jones followed him into the front room , closing the door behind him .",0.8006455379568469
follow.v.01,"A bold line of violet broke loose from the high ridge of the mountains , followed by feathers of red that swept the last stars from the sky .",0.6460458712242876
follow.v.01,"He fled through the door and down the steps , running , and the men grunted and followed , pushing Lester to one side where he backed against the wall with the sleeve of his jacket raised before his eyes to shut out the light .",0.748256787924804
follow.v.01,They followed the others toward the east gate .,0.8155857300467889
follow.v.01,Powers had not followed .,0.7244787046056715
follow.v.01,"Frank followed her into the bedroom , hooked her dress up the back .",0.7658209653649258
follow.v.01,"Rachel followed , looked at me , and clucked with her tongue .",0.7058051295130793
postdate.v.01,"A crowd of 1400 is expected for the ceremonies , which will be followed by the show in which the writers will lampoon baseball personalities in skit , dance and song .",0.7837209940899252
postdate.v.01,"`` Parsifal '' follows July 25 , with Hans Knappertsbusch conducting , and he also conducts `` Die Meistersinger '' , to be presented Aug. 8 and 12 .",0.6384314327598268
postdate.v.01,What followed the outburst brought almost breathless silence as Miss Sutherland revealed her mastery of a voice probably unique among sopranos today .,0.6839066434005021
postdate.v.01,"Mr. Claude is a specialist in torso development and he has long favored the now famous Weider Push-Pull Super-Set technique in which one exercise of the Super-Set is a pressing or `` pushing '' movement which accents one sector of a muscle group in a specific way , followed by a `` pulling '' exercise which works the opposing sector of the same muscle group .",0.7263590695753516
postdate.v.01,"It does n't really matter which month of the year you sow them , but they germinate best when they have a wide variation of temperature , very warm followed by cool in the same 24 hours .",0.6850584646105791
postdate.v.01,"Follow this by crossing from one corner of the room to the other on all fours , kicking as high as possible .",0.6138249465714042
postdate.v.01,"The right will land first , followed by the left .",0.6611110450738424
postdate.v.01,"Just as present technology had to await the explanations of physics , so one might expect that social invention will follow growing sociological understanding .",0.7711200268126545
postdate.v.01,This was followed by a comprehensive series of observations of the 1.25 - cm emission of the moon over three lunar cycles by Piddington and Minnett ( 1949 ) .,0.7411753855735231
postdate.v.01,It should be possible to prepare very pure chlorine by oxidation of inorganic chlorides on a vacuum system followed by multiple distillation of the liquid .,0.7688719540839195
