sense,sentence,centroid_cs
issue.v.03,"Heydrich , in opening the Conference , followed the reasoning and even the phraseology of the order issued earlier by Goering which authorized the Final Solution as `` a complement to '' previous `` solutions '' for eliminating the Jews from German living space through violence , economic strangulation , forced emigration , and evacuation .",0.7921981208815339
issue.v.03,"In 1920 , the Lambeth Conference repeated its 1908 condemnation of contraception and issued `` an emphatic warning against the use of unnatural means for the avoidance of conception , together with the grave dangers - physical , moral , and religious - thereby incurred , and against the evils which the extension of such use threaten the race '' .",0.8211637383951178
issue.v.03,The Secretary of the Interior may issue rules and regulations to effectuate the purposes of this Act .,0.7715903753109821
issue.v.03,"In an important assertion of national leadership in this field , he has issued an executive order establishing the President 's committee on Juvenile Delinquency and Crime , to be supported and assisted by a Citizens Advisory Council of recognized authorities on juvenile problems .",0.8079887112321281
issue.v.03,"The complaint on which the warrant was issued was filed by Leo Blaber , an attorney for the association .",0.7290228962845696
issue.v.03,The new President is in no position to start out his dealings with Moscow by issuing callable bluffs .,0.7312731102550909
issue.v.03,"To silence extremists , to warn the Axis , President Roosevelt issued this statement for the Allies in August :",0.8348540161424706
issue.v.03,He issued his Emancipation Proclamation only when he felt that necessity left him no other way to save the Union .,0.7643388170383055
issue.v.03,"The President of the United States , pursuant to a Joint Resolution of Congress , has issued a proclamation each year since 1933 declaring may 22 nd to be National Maritime Day .",0.8229225228524121
issue.v.03,"A royal decree issued in 1910 , two years after the Belgian government assumed authority for the administration of the Congo , prescribed the registration of all adult males by chiefdoms .",0.8329704980139997
issue.v.03,Further decrees along this line were issued in 1916 and 1919 .,0.8611633268826392
issue.v.03,"A unified set of regulations , applicable to all areas , was issued in 1929 , and a complementary series of demographic inquiries in selected areas was instituted at the same time .",0.8469437646115124
publish.v.02,"Meanwhile , it was learned the State Highway Department is very near being ready to issue the first $ 30 million worth of highway reconstruction bonds .",0.8140583437150497
publish.v.02,The department apparently intends to make the Rural Roads Authority a revolving fund under which new bonds would be issued every time a portion of the old ones are paid off by tax authorities .,0.7582221149848914
publish.v.02,"The Highway Department source told The Constitution , however , that Vandiver has not been consulted yet about the plans to issue the new rural roads bonds .",0.767970100475934
publish.v.02,There 's more specialization and a narrower purpose in two albums recently issued by Dover Publications .,0.6588810219880167
publish.v.02,They are leaving so fast that the president of the West German Employers' Federation issued an appeal this week to factory workers in the West to volunteer for six months ' front-line work in factories in West Berlin .,0.7685020103699458
publish.v.02,"On the street outside , Hieronymus envisions a holocaust of the vanities of this world , such a burning of artistic and erotic productions as his namesake actually brought to pass in Florence , and prophetically he issues his curse : `` Gladius Dei super terram cito et velociter '' .",0.6866761775668838
publish.v.02,"Until the Charter of Liberties was issued in the fall of 1958 , there were no guarantees of the right to assemble or to organize for political purposes .",0.7843277001127988
publish.v.02,"The day following his intervention the palace issued a statement reassuring the citizens that `` the possibility of introducing appeals concerning the establishment of electoral lists , lists of candidates and finally the holding of the consultation itself '' would be supported by the King himself .",0.7923949688022681
publish.v.02,A Mexican justice of the peace had issue a writ against Chavez for taking part in the `` murder '' of Manuel Gonzales so he and his father were anxious to be taken out of danger .,0.7613196827132082
publish.v.02,"In Berlin he published his views of the chemical laws of nature in German and this was issued in French translation ( Paris , 1813 ) under the title Recherches sur l ' identite des forces chimiques et electriques , a work held in very high esteem by the new generation of research chemists .",0.6844904984194011
publish.v.02,"The civil and military authorities are then advised of the danger , and they issue warnings and take all necessary protective steps .",0.7882525908186061
publish.v.02,"assemble and maintain pertinent and current scientific literature , both domestic and foreign , and issue bibliographical data with respect thereto ;",0.7005420006892035
publish.v.02,`` Meet the Artist '' is the invitation issued by members of the Greater Philadelphia Section of the National Council of Jewish Women as they arrange for an annual exhibit and sale of paintings and sculpture at the Philmont Country Club on April 8 and 9 .,0.766423505104292
publish.v.02,"Their Majesties , The Queen of Carnival and The Queen of Comus , have jointly issued invitations for Shrove Tuesday evening at midnight at which time they will entertain in the grand ballroom of a downtown hotel following the balls of Rex and Comus .",0.7900670267146777
publish.v.02,"Fire Fighters Local 798 , which is sponsoring the toy program for the 12 th straight year , issued a call for San Franciscans to turn in discarded toys , which will be repaired by off-duty firemen .",0.7177048608814647
publish.v.02,"Apparently at the insistence of the U. S. , the simultaneous announcements issued in Washington and Moscow last Friday emphasized the `` informal '' nature of the meeting .",0.8097882957479389
publish.v.02,"Since it was issued in the spring of 1611 , the King James Version has been most generally considered the most poetic and beautiful of all translations of the Bible .",0.7343361960749795
publish.v.02,For 10 years Sponsor has issued an annual survey of the size and characteristics of the Negro market and of successful techniques for reaching this market through radio .,0.8220074218301234
publish.v.02,"Two years ago , the Institute of Public Administration issued an extremely comprehensive report entitled `` State-Local Relations in Metropolitan Rhode Island .",0.8353093428108375
publish.v.02,"Reports already issued on the sampling census , 1955 - 57 , in various areas run as follows ( using only the French and omitting corresponding Flemish titles ) : .",0.7999476168909306
publish.v.02,"Other reports in identical form , but with somewhat varying content , have been issued for : .",0.8161245547922156
issue.v.02,"Three weeks later following his recovery , armed with a writ issued by the Catskill justice on affidavits prepared by the district attorney , Cook and Russell rode to arrest Martinez .",0.7595382313368915
issue.v.02,"The Manchester Depot Sewer Company issued 214 shares of stock at $ 10 each for construction of a sewer in that locality , and assessments were made for its maintenance .",0.8001595660000194
issue.v.02,"Wexler admitted in earlier court hearings that he issued grand jury subpenas to about 200 persons involved in the election investigation , questioned the individuals in the Criminal courts building , but did not take them before the grand jury .",0.8381840918441792
issue.v.02,"`` The kid had a .45 automatic , like they issue in the Army '' , he said .",0.6626509707556077
issue.v.02,"Progress , or lack of it , toward civil rights in the 50 states is reported in an impressive 689 - page compilation issued last week by the United States Commission on Civil Rights .",0.7549831035098943
issue.v.02,"In order to attract new industries , 15 states or more are issuing tax free bonds to build government owned plants which are leased to private enterprise .",0.7935695726068829
issue.v.02,Issuing bonds for plant construction has brought new industries to certain regions .,0.7257012965285995
issue.v.02,"Turn off at any one of the marked picnic areas ( gasoline companies have touring service bureaus that issue booklets on national parks to tell you where you have barbecue facilities ) and - with soft drinks cooled from morning loading up , hamburger , buns , an array of relishes , and fresh fruit - your lunch is 75 % cheaper than at a restaurant , and 100 % more fun .",0.7835708701693863
issue.v.02,"So that his customers should not soil their hands , Feuchtwanger issued white gloves .",0.7713561525604594
issue.v.02,"Personal identification cards are issued to all adult males on which tax payments , inoculations , periods of employment , and changes of residence are recorded .",0.8105287703008313
issue.v.02,Similar identification cards were issued in 1959 to all adult females .,0.8079546957374287
issue.v.02,"There was a check from his company , and the usual enthusiastic bulletins on new lines they always issued .",0.777467238155286
