sense,sentence,centroid_cs
lead.v.04,"Greg himself took two flights , with Todman leading the second , to patrol and look for targets of opportunities around Ormoc on the east coast of Leyte .",0.6116030684176376
lead.v.04,The son of a wealthy Evanston executive was fined $ 100 yesterday and forbidden to drive for 60 days for leading an Evanston policeman on a high speed chase over icy Evanston and Wilmette streets Jan. 20 .,0.7365487391608002
lead.v.04,"Our `` destiny '' in these perilous times should be to lead strongly in the pursuit of peace , with justice , under law .",0.7373733991758471
lead.v.04,"To `` Monty '' , the American people , who in two previous world wars were very reluctant to join the fight , `` now look like the nation most likely to lead us all into a third World War '' .",0.7855585348254354
lead.v.04,"Hustler ( Knight Dream-Torkin ) is a playful bay rascal of a colt , not the best gaited , but he surely can pace and is right there with them , and sometimes leading them , in the best miles .",0.7636804474013036
lead.v.04,Such writers as William Faulkner and Robert Penn Warren have led the field of somewhat less important writers in a sort of post-bellum renaissance .,0.7728627455558911
lead.v.04,"If Wilhelm Reich is the Moses who has led them out of the Egypt of sexual slavery , Dylan Thomas is the poet who offers them the Dionysian dialectic of justification for their indulgence in liquor , marijuana , sex , and jazz .",0.7896051563344929
run.v.03,This is a common symptom and the cause usually is pressure on the nerve leading to the affected hand .,0.6964518301789889
run.v.03,The face of one block contained a hole 1 16 '' in diameter which led to a manometer for the measurement of the normal pressure .,0.7891932072942436
run.v.03,She came to the ballroom and stood on the two carpeted steps that led down to it .,0.8581774388739268
run.v.03,"The road leading south along the river was shaded with old trees , and in the moonlight the silvery landscape was like a setting for trolls and wood gods rather than the Hudson River Valley of his boyhood memories .",0.8175751975281775
run.v.03,"A fringe of housing and gardens bearded the top of the heights , and behind it were sandy roads leading past farms and hayfields .",0.8125655793479751
run.v.03,Across the bay the Palisades were heavy in green timber ; their rock paths led down to the Hudson .,0.8713766266001514
run.v.03,"After finding that its coasts led nowhere , however , he turned north again , toward the main , ice filled passageway - and the crew , at first uneasy , then frightened , rebelled .",0.7882416914542423
run.v.03,"When he turned into the highway that led to the outskirts of the city and then rose toward home , he had to pull over to the curb and wait for a few minutes , sucking in air and squinting and blinking his eyes to clear them of tears .",0.8804164231728054
run.v.03,The Mississippi Sound leads into a protected waterway running about 200 miles from Pascagoula to Apalachicola .,0.7548498421267575
run.v.03,"`` Quoting Mr. Kennan 's phrase that anything would be better than a policy which led inevitably to nuclear war , he [ Toynbee ] says that anything is better than a policy which allows for the possibility of nuclear war '' .",0.6924038780751806
run.v.03,"I started my tour of them at the Turkish Government Tourist Office , next to Pan American 's office on the left as you enter the driveway that leads to the Hilton Hotel .",0.8197742404769219
run.v.03,"When the station wagon drew abreast of the dusty dirt road that led up to the porch of the Culver house , Pamela turned the wheel , guiding the car to its familiar parking spot close to the house , and stopped .",0.8806229832366238
