sense,sentence,centroid_cs
mark.v.02,"Old attitudes are held more tenaciously in the Tidewater than the Piedmont ; so that a line running down the length of the South marking the upper limits of tidewater would roughly divide the Old South from the new , but with , of course , important minority enclaves .",0.7031888285812864
mark.v.02,"In each of the last , the trial marked the beginning of a new course : in Moscow the liquidation of the Old Bolsheviks and the tightening of Stalin 's dictatorship ; in the United States the initiation of militant anti Communism , with the repentant ex Communist in the vanguard .",0.8356403853492951
mark.v.02,Of what new course could it mark the beginning ?,0.7776464924074251
mark.v.02,Pasley continued : `` They became an institution of the Chicago scene and marked the way to the moral and financial collapse of the municipal and county governments in 1928 - 29 '' .,0.7519786910748986
mark.v.02,"At four o ' clock , or four thirty , the coming of the newsboy marked the end of the day ; he tossed a paper toward every front door , and housewives came down to their steps to pick them up and read what their neighbors had been doing .",0.7669594357800374
mark.v.02,"Mercer 's Whiteman association brought him into contact with Hoagy Carmichael , whose `` Snowball '' Mercer relyriced as `` Lazybones '' , in which form it became a hit and marked the real beginning of Mercer 's song writing career .",0.7673641385688799
mark.v.02,"Thus in Mary wrote an account of the trip first strong stress on Mary marks Mary as the first in a series of people who wrote accounts of the trip , strong stress on wrote marks the writing as the first of a series of actions of Mary 's concerned with an account of her trip ( about which she may later have made speeches , for example ) , and strong stress on trip makes the trip the first of a series of subjects about which Mary wrote accounts .",0.7255803810864795
mark.v.02,"Thus in Mary wrote an account of the trip first strong stress on Mary marks Mary as the first in a series of people who wrote accounts of the trip , strong stress on wrote marks the writing as the first of a series of actions of Mary 's concerned with an account of her trip ( about which she may later have made speeches , for example ) , and strong stress on trip makes the trip the first of a series of subjects about which Mary wrote accounts .",0.7255803810864795
mark.v.02,Thus the Congress marks a formal recognition of the political system that was central to world politics for a century .,0.8255611529480399
mark.v.02,The arrest of Mr. Parker marks the third charge of wrongdoing involving the jury that heard the case .,0.7989043419935399
mark.v.02,"Remembering the step-by-step fate of Danzig and the West German misgivings about `` salami '' tactics , it is to be hoped that the dispatch of General Clay to West Berlin as President Kennedy 's representative will mark a stiffening of response not only to future indignities and aggressions but also to some that have passed .",0.8289571741140421
mark.v.02,I am a magazine ; my name is Guideposts ; this issue that you are reading marks my 15 th anniversary .,0.7856611248932381
mark.v.02,"With a wary eye on the farmer 's bull , Fred Somers of Montpelier and Mr. St. John marked the field with a red table cloth .",0.6736199681489164
distinguish.v.03,"It was marked by controversy , anonymous midnight phone calls and veiled threats of violence .",0.7813638856184163
distinguish.v.03,"Modern man , as Dietrich Bonhoeffer has told us , has `` come of age '' ; and though this process by no means represents an unambiguous gain and is , in fact , marked by the estrangement from the depths that seems to be the cost of human maturation , it is still a positive step forward ; and those of us who so richly benefit from it should be the last to despise it .",0.8800877544412581
distinguish.v.03,But the most impressive testimony to Schnabel 's distinction as a teacher is reflected by the individuality which marks each student 's approach as distinctly his own .,0.7715177934070747
distinguish.v.03,It must be marked by a patience and persistence which have not always been its trademark .,0.7498558364489657
distinguish.v.03,"The storms of the past had died away , and the great upheaval which was to mark the following century had not yet begun to disturb men 's minds .",0.7151192751394573
distinguish.v.03,He assumed his academic career with the same intensity and thoroughness that had marked every step in his rise from boyhood .,0.7679743809791494
distinguish.v.03,"This dinner was the start of a new blatancy in the relationship between the gangs and the politicians , which , prior to 1924 , says Pasley , `` had been maintained with more or less stealth '' , but which henceforth was marked by these ostentatious gatherings , denounced by a clergyman as `` Belshazzar feasts '' , at which `` politicians fraternized cheek by jowl with gangsters , openly , in the big downtown hotels '' .",0.8631077748774492
distinguish.v.03,The presence of genuine mimesis in art is marked by the persistence with which the work demands attention and compels valuation even though it is but vaguely understood .,0.8513364205755708
distinguish.v.03,The Newport-based destroyer picket escort Kretchmer has arrived back at Newport after three months ' patrol in North Atlantic waters marked by mercy jobs afloat and ashore .,0.7757374884741626
distinguish.v.03,"With contemporary English changing with the rapidity that marks this jet age , some of the words and phrases of the new version may themselves soon become archaic .",0.7596774160609633
distinguish.v.03,"The modern world has been marked by progressive disaffection with claims to divine sanction for the state , whatever its political form .",0.8320333060406724
distinguish.v.03,"It flags such possible breakdowns of communication as rehearsed dialogue , the note of disapproval , ambivalence or ambiguity , annoyance , resentment , and the disinclination to speak at all - this last often marked by a fade-in beginning of sentences .",0.8270658354455768
distinguish.v.03,"He was perhaps a trifle tipsy , having been long at sea where drinking is not permitted , and consequently out of practice ; he wore a brown tweed sports jacket obviously tailored in Hong Kong , and he was of an age that marked him as a lieutenant .",0.6550486560751247
tag.v.01,"The unstained strips were then marked , using the stained ones as a guide , and cut transversely so as to separate the various protein bands .",0.8582904172577677
tag.v.01,We talked after I hailed his Jeep marked with the U. N. flag .,0.6759791925717624
tag.v.01,"The first one or two roof boards ( marked `` E '' in fig. 6 ) are slipped into place across the roof beams , from outside the shelter .",0.771426439176862
tag.v.01,Dictionary forms found to match forms in the text list are marked .,0.7329466498587873
tag.v.01,"If each text form is marked when matched with a dictionary form , the text forms not contained in the dictionary can be identified when all dictionary forms have been read .",0.8615575263267398
tag.v.01,"Since the goal of our international planners is a World Government , this Atlantic Community would mark a giant step in that direction for , once American economic autonomy is absorbed , a larger grouping is a question of time .",0.6381049929709605
tag.v.01,The best procedure is to have a few friends hold the planking in place while you mark it off .,0.7873702657855585
tag.v.01,"Then it is marked on the inside where it comes in contact with the transom , frames , keelson and all the battens .",0.8918060159337684
tag.v.01,The next step is to remove it and spread glue where it has been marked at the contact points .,0.8658672607332806
tag.v.01,"When a hole is to be bored to a predetermined depth , mark the depth on the side of the stock , then run the bit down so that it is even with the mark .",0.8089336225717537
tag.v.01,"So , after the sitting has been held , several readings at one time are mailed , and the distant sitter ( whose name or whose communicator 's name was given to the medium ) must mark each little item as Correct ( Hit ) , Incorrect ( Miss ) , Doubtful , or Especially Significant ( applying to him and , he feels , not to anyone else ) .",0.8369417197489463
tag.v.01,He is required to mark every item and to indicate which reading he feels is actually his .,0.8436746576930542
tag.v.01,"That is , if he marks as most correct a reading not meant for him , the total experimental score falls .",0.7701474865973363
