sense,sentence,centroid_cs
entail.v.01,This does not mean that mythological language as such can no longer be used in theology and preaching .,0.787169391067171
entail.v.01,"If to be a Christian means to say yes where I otherwise say no , or where I do not have the right to say anything at all , then my only choice is to refuse to be a Christian .",0.7321865248179862
entail.v.01,"They speak of the work of Christ as the bestowal of incorruptibility , which can mean ( though it does not have to mean ) deliverance from time and history .",0.7765339102706764
entail.v.01,"They speak of the work of Christ as the bestowal of incorruptibility , which can mean ( though it does not have to mean ) deliverance from time and history .",0.7765339102706764
entail.v.01,I take this to mean that the intelligent - and therefore necessarily cynical ?,0.7181516434478752
entail.v.01,"And this , in effect , means most of modern America .",0.7393019716332102
entail.v.01,This means that work equals q which in turn equals * * f .,0.7762000594923107
entail.v.01,"In such a case , any attitude would be as fitting or unfitting as any other , which means that the notion of fitness has lost all point .",0.795520641967336
entail.v.01,"This meant , concretely , that the patient could not read at all without making writing like movements of the head or body , became easily confused by `` hasher marks '' inserted between hand-written words and thus confused the mark for one of the letters , and could recognize a simple straight line or a curved one only by tracing it .",0.7815679205496909
entail.v.01,"This would mean , it can readily be seen , that , again , for each new visual experience the tracing motions would have to be repeated because of the absence of visual imagery .",0.8178401354274556
entail.v.01,"And for him to leave this job now without accomplishing anything would mean practically the end of his career in the Methodist church , if not in all churches .",0.7424366527680671
entail.v.01,"A quarter inch this way or that for the hardbake , or the toffee , or the barley sugar , or the sardines , or the bitters , or the condensed milk , or the stationery , or the needles - what could it mean ?",0.6645972668547518
entail.v.01,He had a feeling that the girl meant trouble .,0.6024242197770886
entail.v.01,"The microscope and orthicon are both selected to operate well into the ultraviolet spectrum , which means that all lenses must be quartz .",0.7562271962379626
entail.v.01,This will mean that every time there 's an increase in hospital rates your cost will go up in like manner .,0.8146521690852584
entail.v.01,He cannot leave the farm to take work in another locality on short notice ; such a move may mean a loss of capital .,0.7807912993520258
entail.v.01,"This means that such factors as the health of the parents , particularly the mother , their ability to provide their children with the necessities of life , the degree of population density of a country and the shortage of housing facilities may legitimately be taken into consideration in determining the number of offspring .",0.7698680470075442
entail.v.01,"In combat , helping your CO make a fool of himself might mean getting yourself killed .",0.7555571478813473
entail.v.01,"To the extent , then , that declining U. S. prestige means that other nations will be tempted to place their bets on an ultimate American defeat , and will thus be more vulnerable to Soviet intimidation , there is reason for concern .",0.8132487008380844
entail.v.01,Success may mean merely the displacement of Western influence .,0.8259365187529172
entail.v.01,"The din was successful , too , for just before the moon disappeared , the frightened toad had begun to spit it out again , which meant good luck all around .",0.7121823534732523
entail.v.01,`` It means that you have to get ahead '' .,0.8170093840839814
entail.v.01,This means that a great many academically talented girls are discouraged from pursuing graduate work of a more demanding nature .,0.8152884071596662
entail.v.01,"A crucial question , therefore , is what evangelism and mission actually mean in metropolitan Protestantism .",0.7180346991399293
entail.v.01,"This means that the antennae of the congregation are extended into the community , picking up the wave lengths of those who will fit into the social and economic level of the congregation ; the mission of the church is actually a process of informal co-optation ; the lay ministry is a means to recruit like-minded people who will strengthen the social class nucleus of the congregation .",0.7965715196804366
entail.v.01,"The identification of the basic unit of religious organization - the parish or congregation - with a residential area is self defeating in a modern metropolis , for it simply means the closing of an iron trap on the outreach of the Christian fellowship and the transmutation of mission to co-optation .",0.8268621620068817
entail.v.01,`` What I am saying does not mean that there will henceforth be no form in art .,0.796858647243216
entail.v.01,"It only means that there will be new form , and that this form will be of such a type that it admits the chaos and does not try to say that the chaos is really something else .",0.8069338504203108
entail.v.01,"Somehow , the pictures and stories of Soviet T-34 tanks on Cuban beaches and Russian Mig jet fighters strafing rebel troops has brought home to all of us the stark , blunt truth of what it means to have a Russian military base 90 miles away from home .",0.542852919564837
entail.v.01,"That means that , if we are to achieve a new standard of leadership , we must think in terms of the total context of our situation .",0.8143303422550553
entail.v.01,"This does not mean in a purely bureaucratic sense but in an active , operational , interested , responsible fashion .",0.7352300701964237
entail.v.01,"The selection of the wrong tools can mean waste , at best , and at worst an unwanted inflammation of the problem itself .",0.7936884516325378
entail.v.01,"Mr. Phillips took a razor to Gonzalez , Prop. , but left the promise that Spanish would be understood because he thought it meant that Spanish clientele would be welcome .",0.7276013427213404
entail.v.01,An ' that could mean trouble with a fella that 's workin ' for crooks .,0.7555718700326599
entail.v.01,What did it mean ?,0.633374900061102
entail.v.01,"And he can be on the way to Memphis , your Gratt Shafer can , and you discover you can stay alive and hate him and love him and want him even if it means you want him - really want him - dead .",0.7318566775331514
entail.v.01,"It was an awkward hour , but I did n't have to punch any time clock , and it only meant that sometimes I had to stay a couple of hours later at the drawing board to finish up a job .",0.7148657758114035
entail.v.01,"But he hastened to add that , if United States policies were not always clear , despite Mr. Rusk 's analysis of the various global danger points and setbacks for the West , this may merely mean the new administration has not yet firmly fixed its policy .",0.7832335792365571
entail.v.01,"`` Our most immediate goal is to increase public awareness of the movement '' , he indicated , `` and to tell them what this will mean for the town '' .",0.6564712953134599
entail.v.01,"For hotels with 1000 rooms , the increased license fee would mean an expense of $ 5000 a year , Goodis said .",0.8190777655520478
entail.v.01,"This means that more than 100 million have no vital touch with the church or religious life '' , he told delegates Friday .",0.8049345907682259
entail.v.01,"The gala is the Thrift Shop 's annual bundle party and , as all Thrift Shop friends know , that means the admission is a bundle of used clothing in good condition , contributions of household equipment , bric-a-brac and such to stock the shelves at the shop 's headquarters at 1213 Walnut St. .",0.7796443529259784
entail.v.01,"At the rate of need indicated in the early weeks of the month , this could mean a shortage of as high as $ 17000 .",0.8163854537448645
entail.v.01,"Mr. Kennedy was less troubled by that possibility than by the belief that a Geneva breakdown , or even continued stalemate , would mean an unchecked spread of nuclear weapons to other countries as well as a fatal blow to any hope for disarmament .",0.7769893927440814
entail.v.01,But this in turn means that decisions are not merely imposed from the top but that there be some actual mechanism of faculty participation .,0.8470127923982239
entail.v.01,That added traffic means rising streams of dimes and quarters at toll gates .,0.7708323982836109
entail.v.01,But whether the murder of El Benefactor in Ciudad Trujillo means freedom for the people of the Caribbean fiefdom is a question that cannot now be answered .,0.7463317998280008
entail.v.01,Inevitably this means some compromise .,0.7799763280380622
entail.v.01,"Some plant-location specialists take these signs to mean St. Louis county does n't want industry , and so they avoid the area , and more jobs are lost .",0.7192751686103419
entail.v.01,The I. A. P. A. is a reflection of the problems and hopes of the hemisphere ; and in these days this inevitably means a concentration on the effects of the Cuban revolution .,0.8243472721323052
entail.v.01,"This means an added burden to innumerable postmen , who already are complaining of heavy loads and low pay , and it presumably means an increased postal deficit , but , our correspondent writes , think of the additional junk mail each citizen will now be privileged to receive on a regular basis .",0.8068361207999829
entail.v.01,"This means an added burden to innumerable postmen , who already are complaining of heavy loads and low pay , and it presumably means an increased postal deficit , but , our correspondent writes , think of the additional junk mail each citizen will now be privileged to receive on a regular basis .",0.8068361207999829
entail.v.01,"Her choice of one color means she is simply enjoying the motor act of coloring , without having reached the point of selecting suitable colors for different objects .",0.8228658010513165
entail.v.01,"This matter is of great importance , and the outcome may mean the difference between life or death , or at least serious injuries , for many veterans .",0.8135205918199799
entail.v.01,"Let us prepare for peace , instead of for a war which would mean the end of civilization .",0.7558716276908783
entail.v.01,"If the new Soviet series has followed the general pattern of previous Russian tests , the shots were roughly half fission and half fusion , meaning a fission yield of 30 to 40 megatons thus far .",0.7165962715973557
entail.v.01,"The Department of Agriculture averaged out U. S. food consumption last year at 1488 lbs. per person , which , allowing for the 17 million Americans that John Kennedy said go to bed hungry every night , means that certain gluttons on the upper end must somehow down 8 lbs. or more a day .",0.7732015849341258
entail.v.01,Neglect means spiritual paralysis or death .,0.7732419615800002
entail.v.01,"It can mean the difference between participation and inaction , spiritual growth and decay .",0.7564195977939202
entail.v.01,"Not to repel injury and uphold and improve pax-ordo means not simply to accept the misshapen order and injustice that challenges it at the moment , but also to start down the steep slope along which justice can find no place whereon to stand .",0.7062443336621006
entail.v.01,"( 1 ) the various ways in which they interpret a particular social issue ; ( 2 ) their pattern of involvement in the regular legal and political processes ; and , most pervasively , ( 3 ) their interpretation of who is a `` real pro '' , of what it means to be a professional man in a technical , fragmented society .",0.5581193716455163
entail.v.01,"And this would mean that we live in a mechanistic universe , governed by the laws of cause and effect , bound in chains of determinism that hold the universe on a completely predetermined course in which there is not room for soul or spirit or human freedom .",0.8240818139499412
entail.v.01,"And to offend the dead meant to incur their wrath , and thus provoke the unleashing of countrywide disasters .",0.5176621726112584
entail.v.01,"But let us not be mistaken about Confucian `` virtue '' ; this was not virtue as we understand the word today , and it did not mean an abandonment of the belief in magic manipulation .",0.810002616245606
entail.v.01,"To the Confucian , `` virtue '' simply meant mastery and correct observance of three hundred major rules of ritual and three thousand minor ones .",0.7054748355887609
entail.v.01,"They could be used to attack a nation 's people ( which would inevitably mean the loss of the attacker 's own people ) , or they could be used with discrimination to destroy the enemy 's military force .",0.7659939533189265
entail.v.01,"Survivability of our strategic forces ( Polaris , mobile and hardened Minuteman , hardened Atlas and Titan , and airborne Skybolt ) means that it will take some time , perhaps weeks , to destroy a strategic force .",0.7760169914102165
entail.v.01,But because science is based on mathematics does n't mean that a hot rodder must necessarily be a mathematician .,0.7683068259235334
entail.v.01,"The fact that the Deerstalker and the Jet were the only completely new designs this year does n't mean that 1961 did n't see changes in models , actions and calibers .",0.6869656647322756
entail.v.01,"Once on the road ( and especially if the passengers were all regulars and masculine ) , the schedule meant nothing .",0.7064293289473459
entail.v.01,"Fortunately , it is the FHA which has arrived at this conclusion , for it means that cooling equipment of all kinds may now be included in a mortgage , and thus acquired with a minimum of financial stress .",0.7897159883353541
entail.v.01,"The cleaner air means less time spent pushing a vacuum , fewer trips to the dry cleaners , lighter loads for the washing machine .",0.7372271269680108
entail.v.01,"If that 's done , the house can be designed and oriented for best operation , and this can mean savings both in the size of equipment and in the cost of the house itself .",0.8425686751561897
entail.v.01,"To him this means caring for the whole child , providing basic nutrition , and a spiritual attitude that lends freedom for the development of the mind .",0.7596247076997826
entail.v.01,"Since Fogg 's was a one-man , one-plane flying service , this meant that he would have to do both trips , flying alone 600 miles a day , under sub-freezing temperature conditions .",0.7577924182161322
entail.v.01,"If the wedding party lasted late , and the travel schedule means there are only a few hours before resuming the trip or making an early start , the husband may forestall tensions and uncertainties by confiding to his bride that lying in each other 's arms will be bliss enough for these few hours .",0.7726719072595942
entail.v.01,"However , this does not mean that a child 's teeth or jaws must necessarily resemble those of someone in his family .",0.7831739569564916
entail.v.01,Which does not mean that it is ugly .,0.7429082735984672
entail.v.01,It usually means a confused and disgruntled tax-paying public for a period of time .,0.7192972055129648
entail.v.01,It should be emphasized strongly that adjustments in fiscal dates or adoption of interim budgets do not necessarily mean financing over and above normal governmental requirements .,0.8274516462016172
entail.v.01,"This did not mean that married students could not enroll in other `` mixed '' sections , and some of them , largely because of scheduling difficulties , did .",0.7685247167544763
entail.v.01,That meant he 'd parked someplace .,0.6945012360934517
entail.v.01,"The agonies of nerves and itching of skin were phenomena which happened somewhere near him , but meant nothing .",0.6310140640128723
entail.v.01,Every new scandal which would provide more `` copy '' for Marshall 's pen would thus mean more publicity for Welch .,0.8018617223629874
