sense,sentence,centroid_cs
intend.v.01,"In the absence of a truly adequate conceptuality in which the gospel can be expressed , the unavoidable need to demythologize it makes use of whatever resources are at hand - and this usually means one or another of the various forms of `` folk religion '' current in the situation .",0.5248141476750718
intend.v.01,"He does not mean to say that Adam lost the similitude of God and his immortality through the fall ; for he was created not exactly immortal , nor yet exactly mortal , but capable of immortality as well as of mortality .",0.7173476092888111
intend.v.01,This meant sorting out press clippings and the like .,0.5420055801129117
intend.v.01,"The equation was simple : wealth brought them happiness , and their united front to the world was their warning that they meant to keep everything they had , let no one in on the secrets .",0.707578663096385
intend.v.01,He had not meant to shout .,0.7012705174145467
intend.v.01,It was meant to be my present '' .,0.7311996351021809
intend.v.01,"He meant to say more , but he never got the chance .",0.688923685201871
intend.v.01,`` I wrote Bill in my last letter to forget that I had told him that I did n't mean to reconsider my decision not to change my mind - and he seems to have misunderstood me '' .,0.7482134598288993
intend.v.01,This slip is so-called because its semi ambiguous English always seems to refer to a person 's anatomy but never quite means what it seems to say .,0.6537435030362343
intend.v.01,I meant him no harm .,0.6590211074620124
intend.v.01,"I do n't mean to pry , but do they hide the swimsuit with the bubbles ?",0.7329456368749035
intend.v.01,He found a jar of preserved tomatoes and one of eggs that they had meant to save .,0.7707857298698624
intend.v.01,"Or you could hope the parachute would n't open just so you could say you saw it not open , not because you meant any harm to Starkey Poe in his suit of red underwear , but mainly because you were tired of being an old maid - a thing which cannot admit when it thinks it might be pregnant , but must stand the dizzy feeling all alone and go on like everything is all right instead of being able to say to somebody in a normal voice : `` I think I 'm pregnant '' .",0.6347527951689629
intend.v.01,He must show at the outset that he means exactly what he says .,0.6429549957412164
intend.v.01,"Modern embroidered panels , framed and meant to be hung on the wall , are another aspect of this trend .",0.6352967263305798
intend.v.01,One may be sure the present Republican congressional leadership has n't meant to repeat this error .,0.7953065092041313
intend.v.01,"I do not mean to imply that Christians have adopted the liberal assumption , so prevalent in Hinduism , that all religions are merely different paths to the same summit .",0.6595041893214466
intend.v.01,In mentioning this under `` salvation reconsidered '' I do not mean to imply that Roman Catholic doctrine has changed in this area but rather that it has become clearer to the world community what that doctrine is .,0.7063976916072942
intend.v.01,"They all mean well , have great promises to make when they are about to go home , but drinking is their sickness .",0.6316810901025994
intend.v.01,"But it did n't matter now whether he meant to invade the Holy of Holies , or was simply headed in that direction by accident .",0.7700303323388643
intend.v.01,"She meant him well , but was in no condition for articulate speech .",0.6889346479694332
intend.v.01,He meant to help Gavin all the time .,0.7394491139648617
intend.v.01,"He really had n't meant to , he assured her , but it was plain to her that the importance of these small things was lost on Mr. Robards .",0.7297831867311598
intend.v.01,"`` Harro , girl-san '' ! he said , turning on what was meant to be charm .",0.7017364457508777
intend.v.01,"`` I do n't believe I know you , and I can n't understand your quaint brand of English - it was meant to be English , was n't it '' ?",0.7305310174155972
mean.v.03,Just what is meant by `` spirit '' and by `` matter '' ?,0.7482607134841506
mean.v.03,"It has come to mean myths , legends , tales , songs , proverbs , riddles , superstitions , rhymes and such literary forms of expression .",0.7760181354336687
mean.v.03,The third level leans on a belief that a lot of smoke means some fire .,0.7718055440505158
mean.v.03,"The word `` binomial '' means `` of two names '' or `` of two terms '' , and both usages apply in our work : the first to the names of the two outcomes of a binomial trial , and the second to the terms p and * * f that represent the probabilities of `` success '' and `` failure '' .",0.8338792277773577
mean.v.03,"Strictly speaking , this means that the probability for each possible outcome of the experiment can be computed by multiplying together the probabilities of the possible outcomes of the single binomial trials .",0.6297361252764119
mean.v.03,"A square inscribed in a curve C means a square with its four corner points on the curve , though it may not lie entirely in the interior of C .",0.7548414322549238
mean.v.03,Yet even that explosion did not mean much .,0.6128125579608068
mean.v.03,"It was a word he was proud of , a word that meant much to him , and he used it with great pleasure , almost as if it were an exclusive possession , and more : he sensed himself to be very highly educated , four cuts above any of the folks back home .",0.6481096011891789
mean.v.03,`` Though that does not mean that there may not be such records there .,0.6115912149691641
mean.v.03,"Thus , the masculine animate infinitive dabhumaksanigalu'ahai , meaning to live , was , in the perfect tense , ksu'u'peli'afo , and , in the future , mai'teipa .",0.6232488376272478
mean.v.03,"It now means ominous , as when one speaks of a funny sound in the motor ; disturbing , as when one says that a friend is acting funny ; and frightening , as when a wife tells the police that it is funny , but her husband has n't been home for two days and nights '' .",0.8184297172299873
mean.v.03,"It now means , in my country , homosexual '' , I said .",0.8676018599308577
mean.v.03,"In Ireland 's County Limerick , near the River Shannon , there is a quiet little suburb by the name of Garryowen , which means `` Garden of Owen '' .",0.7182679757966935
mean.v.03,"Boun My - the name means one who has a boun , a celebration , and is therefore lucky - was born in Savannakhet , the Border of Paradise .",0.7480447601572471
mean.v.03,"In the village of Soukhouma , which means `` Peaceful '' , we had a baci .",0.757458228518619
mean.v.03,( Co-optation means to choose by joint action in order to fill a vacancy ; it can also mean the assimilation of centers of power from an environment in order to strengthen an organization . ),0.7810967401463041
mean.v.03,( Co-optation means to choose by joint action in order to fill a vacancy ; it can also mean the assimilation of centers of power from an environment in order to strengthen an organization . ),0.7810967401463041
mean.v.03,"In the first instance , `` mimesis '' is here used to mean the recalling of experience in terms of vivid images rather than in terms of abstract ideas or conventional designations .",0.8353027399063394
mean.v.03,"By `` image '' is meant not only a visual presentation , but also remembered sensations of any of the five senses plus the feelings which are immediately conjoined therewith .",0.7934035351963691
mean.v.03,"`` The recognition of complicity is the beginning of innocence '' , where innocence , I think , means about the same thing as redemption .",0.7822430137902615
mean.v.03,"Among other things it means perception , discrimination , sensitivity to subtle differences .",0.8384566276432529
mean.v.03,"the term `` State '' includes the Commonwealth of Puerto Rico and any possession of the United States ; and the term `` commerce '' means commerce between any State and any place outside thereof , or between points within the same State but through any place outside thereof .",0.8255178286024637
mean.v.03,"The term `` State '' means the several States , the District of Columbia , the Virgin Islands , Guam and Puerto Rico ; the term `` United States '' includes the several States and the District of Columbia , and excludes the Virgin Islands , Guam and Puerto Rico , and , prior to 1962 , Alaska and Hawaii .",0.8136682041822763
mean.v.03,"The term `` State '' means the several States , the District of Columbia , the Virgin Islands , Guam and Puerto Rico ; the term `` United States '' includes the several States and the District of Columbia and excludes the Virgin Islands , Guam and Puerto Rico , and , prior to 1962 , Alaska and Hawaii .",0.8125667939556566
mean.v.03,"It occurred to me that you might be interested in some thoughts which I expressed privately in recent years , in the hope of clearing up a certain confusion in the public mind about what foreign policy is all about and what it means , and of developing a certain compassion for those who are carrying such responsibilities inside Government .",0.7177669919150772
mean.v.03,"The Congolese were clamoring for their independence , even though most were unsure what it meant ; and in Brussels , street crowds shouted , `` Pas une goutte de sang ! ''",0.6698262859288396
mean.v.03,"Thus some provinces contained tribes which detested each other , and to them independence meant an opportunity for war .",0.6942388857807879
mean.v.03,"Now , to translate from the Communese , this means :",0.7694579169307474
mean.v.03,"In the second and third chapters of Revelation the new version retains , however , the old phrase `` angel of the church '' which Biblical scholars have previously interpreted as meaning bishop .",0.7746006610382915
mean.v.03,Overt socialism means government ownership and management of a nation 's main industries .,0.8094758701094531
mean.v.03,"You may be sure he marries her in the end and has a fine old knockdown fight with the brother , and that there are plenty of minor scraps along the way to ensure that you understand what the word Donnybrook means .",0.8223930070270035
mean.v.03,"Watch people flock to amusement houses , cocktail lounges , and night clubs that advertise continuous entertainment , which means an endless flow of noise and frivolity by paid entertainers who are supposed to perform in those incredible ways which are designed to give men a few hours of dubious relaxation - watch them and you can tell that many of them are running away from something .",0.6931357951742845
mean.v.03,"Ask each member to write a statement on such topics as : `` What Christ Means to Me '' , `` What the Church Means to Me '' , `` Why Join the Church '' , `` The Duties of Church Members '' , etc. .",0.6346963035857145
mean.v.03,"Ask each member to write a statement on such topics as : `` What Christ Means to Me '' , `` What the Church Means to Me '' , `` Why Join the Church '' , `` The Duties of Church Members '' , etc. .",0.6346963035857145
mean.v.03,"This is what , in a technical sense , to `` only permit '' an evil result means .",0.7815480799855177
mean.v.03,"It means to do it and to know one is doing it , but as only a secondary if certain effect of the good one primarily does and intends .",0.8085967370498294
mean.v.03,"Contrary to popular opinion , `` a la mode '' does n't mean `` with ice cream '' - it just means , in the latest style .",0.8250741229564292
mean.v.03,"Contrary to popular opinion , `` a la mode '' does n't mean `` with ice cream '' - it just means , in the latest style .",0.8250741229564292
mean.v.03,"On the other hand significant facts may be concealed - she may mean I ; or everybody , as it did with the tense and irritable woman mentioned before , may refer to a specific person .",0.7604271687853889
mean.v.03,"It is , of course , easy to see how `` J '' will mean Uncle Jack to one person and little Jane to another .",0.8149192879993459
mean.v.03,Those names mean anything to you '' ?,0.6837209776330188
mean.v.03,"Without an instant 's transition , the green light that meant full fusion power winked on the board .",0.6576217323460136
mean.v.03,"I could observe the two fans down at the end , but their size in themselves meant nothing to me as long as I had no measure of comparison .",0.5993742047309853
mean.v.01,"And that 's meant as a boost , not a knock .",0.6349868077978507
mean.v.01,"Before deriving this formula , we explain what we mean by `` problems of this kind '' .",0.7374353646925907
mean.v.01,"The theory claims to show by analysis that when we say , `` That is good '' , we do not mean to assert a character of the subject of which we are thinking .",0.7307736810030037
mean.v.01,I shall argue that we do mean to do just that .,0.6629626338405258
mean.v.01,"I hold , on the contrary , that we mean to assert something of the pain itself , namely , that it was bad - bad when and as it occurred .",0.7032456238283894
mean.v.01,"It removes our present expression and shows that the badness we meant would not be affected by this , whereas on positivist grounds it should be .",0.7003326341896469
mean.v.01,"It ideally removes the past event , and shows that this would render false what we mean to say , whereas on positivist grounds it should not .",0.7124590030328071
mean.v.01,"And our question is , is such an implication consistent with what we meant ?",0.7492080699508022
mean.v.01,"The suggestion that in saying something evil had occurred we were after all making no mistake , because we had never meant anyhow to say anything about the past suffering , seems to me merely frivolous .",0.6759877974581707
mean.v.01,"If we did not mean to say this , why should we be so relieved on finding that the suffering had not occurred ?",0.6375033614919706
mean.v.01,"When we repeat the remark that such suffering was a bad thing , the feeling with which we made it last week may be at or near the vanishing point , but if we were asked whether we meant to say what we did before , we should certainly answer Yes .",0.6575567621732358
mean.v.01,"And if we can see that what we meant to say remains the same , while the feeling varies from intensity to near zero , it is not the feeling that we primarily meant to express .",0.6572208479391725
mean.v.01,"And if we can see that what we meant to say remains the same , while the feeling varies from intensity to near zero , it is not the feeling that we primarily meant to express .",0.6572208479391725
mean.v.01,"`` I mean , do you feel like seeing Kate '' ?",0.6800368684435075
mean.v.01,You see what I mean .,0.7658149530905566
mean.v.01,"Every woman has had the experience of saying no when she meant yes , and saying yes when she meant no .",0.6211021546491831
mean.v.01,"Every woman has had the experience of saying no when she meant yes , and saying yes when she meant no .",0.6211021546491831
mean.v.01,"What I mean is , he was a Pole and the greatest soldier in the Ulanys .",0.7608068172881414
mean.v.01,"`` She 's probably getting old - crotchety , I mean - and we figured uh-uh , better not .",0.534251896403176
mean.v.01,`` I do n't mean Miss Ada !,0.7714593175924307
mean.v.01,I mean our children '' .,0.7652920088813897
mean.v.01,You mean picture of me '' ?,0.7460151027322527
mean.v.01,"But my people - Martians , I mean ; I now grok you are my people - teach plants another way .",0.6008131777479766
mean.v.01,"Is that - I mean , ' Do you know '' ' -",0.6934027125752392
mean.v.01,`` You mean this punk can brush me aside and I 've got to hold still for it '' ?,0.6733424534776495
mean.v.01,"Then she turned back to Wilson and smiled , and he was n't quite sure what she meant by it .",0.6873613295775021
mean.v.01,I meant what I said about that fire .,0.6777744445456958
mean.v.01,"It was meant to insult him , and did n't quite succeed .",0.5978903757156129
mean.v.01,"He thought a moment , then inquired , `` You mean petted '' ?",0.726394867049043
mean.v.01,The speaker referred to the whiskey but his friend thought he meant the cold .,0.7366076847281784
mean.v.01,"`` If I have seemed to emphasize the structure of the composition , I mean to project equal concern for color .",0.7043253325606382
mean.v.01,"I do not mean to suggest that these assumptions are self-evident , in the sense that everyone agrees with them .",0.6597715779258125
mean.v.01,"I do mean , however , that I take them for granted , and that everything I shall be saying would appear quite idiotic against any contrary assumptions .",0.7795927477470551
mean.v.01,"Here I do not mean catharsis , the discharge of emotion .",0.8064676449800818
mean.v.01,"I mean something more like Freud 's concept of the utility of `` play '' to a small child : he plays `` house '' or `` doctor '' or `` fireman '' as a way of mastering slightly frightening experiences , reliving them imaginatively until they are under control .",0.7725527811655407
mean.v.01,Anyone who has watched children develop a taste for literature will understand what I mean .,0.7550645116033456
mean.v.01,"I use this term to mean three things : a search for the human significance of an event or state of affairs , a tendency to look at wholes rather than parts , and a tendency to respond to these events and wholes with feeling .",0.6808944522369222
mean.v.01,"This is what was meant , above , by describing history as inferential .",0.7568381169963413
mean.v.01,This means practically everybody in this room .,0.5392647426059306
mean.v.01,"Analysis means the evaluation of subparts , the comparative ratings of parts , the comprehension of the meaning of isolated elements .",0.56474605426686
mean.v.01,"At first I did not know what she meant ; I thought she must be seeing me as some one who had just come from seeing her grandmother , in their distant home city .",0.7415386257044346
mean.v.01,"I mean , we all figured - I guess anybody 'd figure - Angie '' -",0.5813355898190525
mean.v.01,I mean I 've got to - to see to the kitchen .,0.6653966692521858
mean.v.01,"You mean it , Phil ?",0.640958072316715
mean.v.01,"The day-watch platoon commander , Lt. Rinker , was calling out the beat assignments , but Matson could n't make the names mean anything .",0.5555825415784782
mean.v.01,"`` But I meant what I said , Casey .",0.7051368437185677
mean.v.01,`` What did you mean by that rattlesnake gag ?,0.744546105959321
mean.v.01,"`` Why , I meant what I said '' , Lord declared .",0.7090974287040962
mean.v.01,"`` What else would I mean , anyways '' ?",0.7720561835621993
mean.v.01,"`` You mean anyone who stood up for his rights '' , Curt said .",0.7358516200114699
mean.v.01,"I mean , surely we 've - '' .",0.6232956610698066
mean.v.01,I mean : Is advertising honest ?,0.628701137854117
mean.v.01,"Did , I mean '' .",0.763671011337218
mean.v.01,"The two little bangs meant that he was getting impatient to have a crowd of customers waited on and that if he had to he would jerk open the door and drag out , by the opposite door handle which she would be clutching , whichever-the-hell clerk it was who thought she could waste so much store time on the pot .",0.5288338977598486
mean.v.01,That 's what I mean by no heart for the game .,0.7746410731837499
mean.v.01,"Judge Parsons leaned over the bench and inquired , `` You mean some of the defendants made statements admitting this '' ?",0.6846872279395738
mean.v.01,Mitchell said the closeness of the outcome in last fall 's Presidential election did not mean that Eisenhower Republicanism was a dead issue .,0.5610763922876646
mean.v.01,"`` I mean '' , I went on ruthlessly , `` when he 's not talking about you or himself or the wonders of love , is he interesting ?",0.6985609544415273
mean.v.01,"More recently , the chairman of the Atomic Energy Commission , Dr. Glenn T. Seaborg , `` admitted '' to a news conference in Las Vegas , Nevada , that the US might fall behind Russia ( he apparently meant in weapons development ) if the Soviets continue to test in the atmosphere while we abstain .",0.7156240069980092
mean.v.01,Their demand against the Calvinist Orthodoxy for intellectual liberty had never meant that they would follow `` free inquiry '' to the extreme of proclaiming Christianity a `` natural '' religion .,0.5768107027408033
mean.v.01,"When they say that under no circumstances would it ever be right to `` permit '' the termination of the human race by human action , because there could not possibly be any proportionate grave reason to justify such a thing , they know exactly what they mean .",0.7772183178034946
mean.v.01,"I mean , however , that the moral theologian knows what he means by `` permit '' .",0.7418199942164005
mean.v.01,"I mean , however , that the moral theologian knows what he means by `` permit '' .",0.7418199942164005
mean.v.01,"He does not mean , in fact he addresses himself specifically to reject the proposition , that `` if we took the risk of surrendering , a new generation in Britain would soon begin to amass its strength in secret in order to reverse the consequences of that surrender '' .",0.7891303185774386
mean.v.01,It indicates the same thing but it is meant to pertain more specifically to establishments designed to cater to smaller type boats such as outboards .,0.6510482529484978
mean.v.01,You only have to think of franks and sausages to know what I mean .,0.8002038561067346
mean.v.01,"What does it mean to be creative , a term we hear with increasing frequency these days ?",0.5781639960657257
mean.v.01,"I do n't mean a few aesthetes who play about with sensations , like a young prince in a miniature dabbling his hand in a pool .",0.7718635789432431
mean.v.01,I really did n't know what he meant .,0.7688613421691636
mean.v.01,"Writers openly admit that the Negro is easier to write than the white man ; but they obviously mean by this , not a Negro personality , but a Negro type .",0.7764652908004723
mean.v.01,"Their President , Jefferson Davis , interpreted their Constitution to mean that it `` admits of no coerced association '' , but this remained so doubtful that `` there were frequent demands that the right to secede be put into the Constitution '' .",0.6394585707390914
mean.v.01,"It is difficult to tabulate exactly what was meant in each individual situation , but the conclusion may be drawn that 21 towns do not assess movable personal property , and of the remainder only certain types are valued for tax purposes .",0.6922741495607994
mean.v.01,"Recognizing the truth of the statement by the Institute of Public Administration that `` Metropolian Planning ( in Rhode Island ) means , or should mean , state planning '' , the state guide plan will take into account the metropolitan nature of many of Rhode Island 's problems .",0.6998922524292251
mean.v.01,"Recognizing the truth of the statement by the Institute of Public Administration that `` Metropolian Planning ( in Rhode Island ) means , or should mean , state planning '' , the state guide plan will take into account the metropolitan nature of many of Rhode Island 's problems .",0.6998922524292251
mean.v.01,The above discussion does not mean to imply that control factors were completely in abeyance in the Kohnstamm-positive subjects ; but rather that they could be diminished sufficiently not to interfere with arm-levitation .,0.697518620286564
mean.v.01,"`` You must have loved that girl very much , but you could n't have meant it when you said that you wanted to kill her '' .",0.6444792266604801
mean.v.01,"`` That 's what I mean about you , Anderson '' , she said .",0.7692470355230535
mean.v.01,"I 'll bet he would n't be pleased if a rumdum like me were to ask his daughter for a date - I mean , after I 'm out of the hospital , a month or so from now '' .",0.6117092901690051
mean.v.01,"`` You mean you 're all alone , Mr. Richards '' ?",0.7077565823035169
mean.v.01,Dave made some sound meant to convey agreement .,0.47982678307045995
mean.v.01,"Whoever it was had meant to shut him up in here , had followed him and waited till the courthouse and square were deserted .",0.5774461209912182
mean.v.01,"`` I meant that you have a nice singing voice , dear '' , the lady amended .",0.7300957165697998
mean.v.01,"Mercer stammered , not knowing what B ' dikkat meant , and the two-nosed man answered for him , `` I think he has a nice baby head , but it is n't big enough for you to take yet '' .",0.7324225120037674
mean.v.01,`` You mean a game with cards '' ?,0.7757935196118683
mean.v.01,"I mean we know the order in which things happen , but we have no clocks and nobody cares enough to count days or to make calendars and there 's not much climate here , so none of us know how long anything takes .",0.577833287660849
mean.v.01,`` You mean you dragged your wife all over hell 's half-acre looking for work '' ?,0.6527465902750008
mean.v.01,"`` I mean , we do n't have any way to get there and we can n't expect you to quit work just to take us to town '' .",0.6972765698414505
mean.v.01,"`` Do you mean '' - he asked almost shyly - `` you want me to go with you , wherever you 're goin '' ?",0.7545312882683199
mean.v.01,He was thinking that the way she had responded to his own kiss had n't meant what he had believed it had .,0.5669401880241196
mean.v.01,`` Meaning you want me to ride out '' ?,0.608235424417499
mean.v.01,"You see , I thought - I mean I really had no idea '' -",0.6171328758132419
mean.v.01,What I meant to say was that I started to start in on the dishes by gathering them all together in the kitchen sink .,0.6732661135188358
entail.v.01,That means Stan Musial probably will ride the bench on the seventh anniversary of his record five home run day against the Giants .,0.7568170763267167
entail.v.01,"In addition , the motor has the seal of approval of the Underwriters Laboratories , which means it is safe .",0.7878495350630957
entail.v.01,"He is a Buddhist , which means that to him peace and the sanctity of human life are not only religious dogma , but a profound and unshakable Weltanschauung .",0.788960251107452
