sense,sentence,centroid_cs
meet.v.06,Only the Federal government is likely to be able to take a long-run and nation-wide view and to pay for training to meet national skilled manpower needs .,0.8910821539071099
meet.v.06,"With our current $ 3 per hundred tax rate , it is safe to assume that this will qualify when you suggest a community should `` try to develop a modest industrial plant '' as the best way to meet these problems .",0.8912884979179023
meet.v.06,"Until professional planners meet this situation squarely and update the concepts of zoning in a manner acceptable to the courts , I hope we in East Greenwich can continue to shape our own destiny .",0.7495964289002864
meet.v.06,How can we have the wisdom to meet such a new and difficult challenge ?,0.8463180663909499
meet.v.06,Still others sprang up late in the century to meet conditions which arose from fresh stages of the revolutionary age .,0.814726806901816
meet.v.06,"In recent weeks , as a result of a sweeping defense policy reappraisal by the Kennedy Administration , basic United States strategy has been modified - and large new sums allocated - to meet the accidental-war danger and to reduce it as quickly as possible .",0.8959097234355793
meet.v.06,"It met these problems by the creation of the state automobile maintenance unit ( more popularly called the motor pool ) , a centralized operation for the maintenance and control of all state transportation .",0.7840596957020713
meet.v.06,"They had been through trying times , but their faith in the Almighty had given them the courage and the strength to meet and overcome the many problems and difficulties that were the price they had to pay for freedom .",0.7903696470047681
meet.v.06,"Something had to be done about the furnace , the fuel bills , the washing machine , the doctor and dentist bills , about making money stretch for food , for the mortgage , for taxes , for shoes , for half soles , for overshoes , for clothes , for the new leaks in the roof , for gas and light bills ; about keeping warm , about keeping well , about meeting the minor emergencies that came up once , twice , fifty times a day .",0.7818553258751756
meet.v.07,`` Officials Meet on Rubbish .,0.8072072526679075
meet.v.07,"The upshot of the evening was that I got the address of Pendleton 's studio - or rather , of the studio in which he gave his classes , for he did n't work there himself - and joined the life class , which met every Tuesday and Thursday from ten to twelve in the morning .",0.7840008976085205
meet.v.07,Mr. Martinelli said yesterday that the Citizens Group of Johnston will meet again July 24 to plan further strategy in the charter movement .,0.8710125592025358
meet.v.07,"If Barnett does n't call a special session in 1961 , it will be the first year in the last decade that the Legislature has not met in regular or special session .",0.7601146822666611
meet.v.07,"A 14 - power conference on Laos should then meet on May 5 , he said .",0.8839563449481099
meet.v.07,"The commission , meeting for the first time with both of its newly-appointed commissioners , Roy Webster , of Hood River , and Dr. Ennis Keizer , of North Bend , approved a year 's contract for a consultant in the data processing department who has been the center of considerable controversy in the past .",0.7534262224336951
meet.v.07,It is no coincidence that the Texas Cotton Ginner 's Association is meeting here this week for the 46 th time in their 52 - year history .,0.8520424609580217
meet.v.07,The U. S. and Soviet heads of Government have met three times since Sir Winston Churchill in 1953 introduced a new word into international diplomacy with his call for a fresh approach to the problem of peace `` at the summit of the nations '' .,0.7483625076456247
meet.v.07,"Moreover , the President is meeting the Soviet leader at a time when the Administration has still not decided on the scope of America 's firm foreign policy commitments .",0.7628929566039258
meet.v.07,"Paradoxically , the same week in which Senator McClellan was attempting to extend the anti-trust act to labor in transportation , the Civil Aeronautics Board was assuring the airlines that if they met in concert to eliminate many costly features of air travel , the action would not be deemed a violation of the anti-trust act .",0.8271772431999685
meet.v.07,The U. N. session scheduled for today will meet under the cloud of his passing .,0.8594835121476143
meet.v.07,"The Inter-american Press Association , which blankets the Western Hemisphere from northern Canada to Cape Horn , is meeting in New York City this week for the first time in eleven years .",0.8417053504054651
meet.v.07,That is why the United Nations was formed so that intelligent men with good intentions from all countries could meet and solve problems without resorting to war .,0.7805599165308832
meet.v.07,"Others meet on Sunday night , at the mid-week service , or for a series of four nights .",0.7788181276190688
meet.v.04,"They are struggling to meet the demand for camping space , but families are being turned away , especially on holiday weekends .",0.8226357865003219
meet.v.04,"Neither are shelters , because there is one to meet the needs of every camper or prospective camper .",0.8634971256331616
meet.v.04,"The connective system , or network , is tailored to meet the requirements of the objective , and it is therefore not surprising that a military body acting as a single coordinated unit has a different communication network than a factory , a college , or a rural village .",0.8331438324800747
meet.v.04,"In view of the increasing shortage of usable surface and ground water in many parts of the Nation and the importance of finding new sources of supply to meet its present and future water needs , it is the policy of the Congress to provide for the development of practicable low-cost means for the large-scale production of water of a quality suitable for municipal , industrial , agricultural , and other beneficial consumptive uses from saline water , and for studies and research related thereto .",0.8981025657634615
meet.v.04,These strengths are considered adequate to meet the essential roles and missions of the reserves in support of our national security objectives .,0.8648308511139059
meet.v.04,"He said his plan is designed to `` meet the needs of those millions who have no wish to receive care at the taxpayers ' expense , but who are nevertheless staggered by the drain on their savings - or those of their children - caused by an extended hospital stay '' .",0.8553022878121537
meet.v.04,"`` This is a very modest proposal cut to meet absolutely essential needs '' , he said , `` and with sufficient ' deductible ' requirements to discourage any malingering or unnecessary overcrowding of our hospitals .",0.8880902702298361
meet.v.04,The President said the nation 's 92 medical and 47 dental schools cannot now handle the student load needed to meet the rising need for health care .,0.8957178703583147
meet.v.04,`` The church 's ability to change her methods is going to determine her ability to meet the challenge of this hour '' .,0.8598627436109899
meet.v.04,"`` Emory could not continue to operate according to its present standards as an institution of higher learning , of true university grade , and meet its financial obligations , without the tax-exemption privileges which are available to it only so long as it conforms to the aforementioned constitutional and statutory provisions '' , the statement said .",0.8358976953941508
meet.v.04,"Stein said he needed the money , Leavitt said , to `` meet the payroll '' at National Maintenance company .",0.7905346055553517
meet.v.04,"Vague in wording , it called for withdrawal of Belgian troops and authorized the Secretary-General `` to take the necessary steps to provide the [ Congolese ] Government with such military assistance as may be necessary , until , through the efforts of the Congolese Government with the technical assistance of the United Nations , the national security forces may be able , in the opinion of the Government , to meet fully their tasks '' .",0.8441362577244902
meet.v.04,"A startlingly high percentage do not exceed $ 500 annually , which includes the librarian 's salary , and not even the New York Public has enough money to meet its needs - this in the world 's richest city .",0.9036147241136144
meet.v.04,It is good to know that Georgia will continue to have sufficient electrical power not only to meet the demands of normal growth but to encourage a more rapid rate of industrialization .,0.9055830410736967
meet.v.04,"But , lacking money from commercial sponsors , the stations have had difficulties meeting expenses or improving their service .",0.7732237956866447
meet.v.04,The demand for these lots can be met for some time to come .,0.7523559847779085
meet.v.04,"If Mr. Kennan is sometimes a little somber in his appraisals , if his analysis of how Western diplomacy met the challenge of an era of great wars and social revolutions is often critical and pessimistic - well , the record itself is not too encouraging .",0.7068650226525448
meet.v.04,"When that fear has been removed by faith in Jesus Christ , when we know that He is our Savior , that He has paid our debt with His blood , that He has met the demands of God 's justice and thus has turned His wrath away - when we know that , we have peace with God in our hearts ; and then , with this God on our side , we can face the whole world without fear .",0.7981297177992227
meet.v.04,"For example , early in my life , when one of my editorial workers wanted to find out how churches and philanthropic organizations met the needs of New York 's down-and-outers , he did n't just ask questions .",0.8034286451820617
meet.v.04,They say all personnel have spiritual needs which Guideposts helps to meet .,0.8362543946688309
meet.v.04,"If ever a rifle met the needs of the whitetail hunter , this is it .",0.7513947093631692
meet.v.04,"To establish an emotionally meaningful relationship the worker must demonstrate actual or potential helpfulness immediately , preferably within the first interview , by meeting the client 's specific needs .",0.8255847546575565
meet.v.04,Adaptation to the social and non-social environment through the economy has been met to a degree through a type of occupational segregation .,0.680918171180295
