sense,sentence,centroid_cs
vicinity.n.01,"Even in the neighborhood of the Earth , where information has been obtained both directly and indirectly , the derived flux values vary by at least four orders of magnitude .",0.8145683988709475
vicinity.n.01,The flux of micrometeorites in the neighborhood of the Earth can be estimated by extrapolation from radar and visual meteor data .,0.8029181428421363
vicinity.n.01,"An ordinary point will be any point of intersection A such that in every neighborhood of A in the C-plane , **f meets both the interior and the exterior of C .",0.8496075493348465
vicinity.n.01,"In some neighborhood in the f-plane of any ordinary point of the graph , the function f is a single valued , continuous function .",0.8414434506173534
vicinity.n.01,We first show that the function is single valued in some neighborhood .,0.8651885614169862
vicinity.n.01,"In a neighborhood of Q the difference between these functions is also a single valued , analytic function of u .",0.8313439076019079
vicinity.n.01,"Furthermore , one can find a neighborhood of Q in which the difference function is monotone , for since it is analytic it can have only a finite number of extrema in any interval .",0.8514795607982859
vicinity.n.01,"Thus **f is also continuous at **f , and in a neighborhood of **f which does not contain a tangent point .",0.8481732612378019
vicinity.n.01,"The fact that there can not be any limit points of the set except in closed intervals follows from the argument used in Lemma 1 , namely , that near any tangent point in the C-plane the curves C and **f are analytic , and therefore the difference between them must be a monotone function in some neighborhood on either side of the tangent point .",0.8226957430597717
vicinity.n.01,"In some neighborhood of an isolated tangent point in the f-plane , say **f , the function **f is either double valued or has no values defined , except at the tangent point itself , where it is single valued .",0.8564779310679967
vicinity.n.01,In the second category the function **f has no values defined in a neighborhood **f .,0.8638926482964385
vicinity.n.01,"In the neighborhood of an end point of an interval of tangent points in the f-plane the function is two valued or no valued on one side , and is a single valued function consisting entirely of tangent points on the other side .",0.843704817028743
vicinity.n.01,"While she was thus engaged , McFeeley questioned her about her whereabouts the previous day , any recollections she had of people hanging around , of overcurious delivery boys or repairmen , of strange cars cruising the neighborhood .",0.795522155340328
vicinity.n.01,"They went shopping in the neighborhood , and bought two loaves of bread with the ration coupons they had been given in Blois , and some cheese , and a dozen eggs , and a bag of oranges from a peddler in the Place Redoute - the first oranges they had seen since they landed .",0.7342237317238068
vicinity.n.01,"Above it , from a second story showroom , wooden angels surveyed the neighborhood .",0.7764105142374712
vicinity.n.01,"Indeed , in some periods of our history and in some neighborhoods the job opportunities have been so good that undoubtedly a great many boys who were potential members of the professions quit school at an early age and went to work .",0.7826261754716904
vicinity.n.01,In the Negro neighborhoods and also to some extent in the mixed neighborhoods the problem may be one of identification and motivation .,0.8031701416002868
vicinity.n.01,In the Negro neighborhoods and also to some extent in the mixed neighborhoods the problem may be one of identification and motivation .,0.8031701416002868
vicinity.n.01,"The neighborhood high schools are not , strictly speaking , comprehensive schools , because some of the boys and girls may be attending a vocational or technical high school instead of the local school .",0.7723994292057432
vicinity.n.01,"The congregation perishes when it is no longer possible to replenish that core from the neighborhood ; moreover , residential mobility is so high in metropolitan areas that churches have to recruit constantly in their core stratum in order to survive ; they can lose higher - and lower status members from the church without collapsing , but they need adequate recruits for the core stratum in order to preserve economic integration .",0.8399787113824981
vicinity.n.01,"If there 's no suitable academy in your own neighborhood , there 's always New England .",0.8085147131112483
vicinity.n.01,"In order to equate the samples on socioeconomic status , we chose schools in both cities on the basis of socioeconomic status of the neighborhoods .",0.8451394355395022
vicinity.n.01,School principals and guidance workers made ratings of the various neighborhoods and the research team made independent observations of houses and dwelling areas .,0.8388232823066901
vicinity.n.01,An objective scale was developed for rating school neighborhoods from these data .,0.7956728470497201
vicinity.n.01,Equal proportions of children in each city were drawn from upper-lower and lower-middle class neighborhoods .,0.8379469540746775
vicinity.n.01,"She was going to keep on scheming , poking , prodding , suggesting , and dictating until the cops got up enough interest in him to go back to their old neighborhood and ask questions .",0.745503470291155
vicinity.n.01,"He could tell them his fears of being involved , he could explain what had happened in the old neighborhood and how Mae had misunderstood and how she had held it over him - the scene was complete in his mind at the moment , even to his own jerkings and snivelings , and Ferguson 's silent patience .",0.7686565583381109
vicinity.n.01,"Up to date , however , his garden was still more or less of a mess , he had n't even started his workshop and if there was a meadow pond in the neighborhood he had n't found it .",0.7923089974424066
neighborhood.n.02,"This , of course , was the sort of thing that used to take place in Southern cities - putting white houses of prostitution colored girls in colored neighborhoods and carrying them on openly .",0.8238920668382356
neighborhood.n.02,"My memory has catalogued for easy reference and withdrawal the image of her pink , scented stationery and the unsloped , almost printed configurations of her neat , studious handwriting with which she invited me to recall our summer , so many sentences beginning with `` Remember when '' ; and others concerning camp friends who resided in her suburban neighborhood , and news of her commencing again her piano lessons , her private school , a visit to Boston to see her grandparents and an uncle who was a surgeon returned on furlough , wounded , from the war in Europe .",0.8475422354056025
neighborhood.n.02,"Among my school and neighborhood friends , during the next months , I bragged and swaggered and pompously described my impending date .",0.8029788796333599
neighborhood.n.02,"I felt superior to the neighborhood friends I was leaving behind , felt older than my years , and was full of compliments for myself as I headed into the subway that was carrying its packs of passengers out of that dull borough and into the unstable , tantalizing excitement of Manhattan .",0.8602871406767281
neighborhood.n.02,"One wife , described by a New York psychologist , so dominated her husband that she actually placed their sexual relationship on a schedule , writing it down right between the weekly PTA meetings and the Thursday night neighborhood card parties .",0.8398615173461911
neighborhood.n.02,Look for a farm in a neighborhood of well-kept homes .,0.806199049169165
neighborhood.n.02,"For most Brooklyn College students , college is at once a perpetuation of their ethnic attachments and a breaking away from the cage of neighborhood and family .",0.8521096365853029
neighborhood.n.02,Missionary outreach by friendly contact looks somewhat different when one reflects on what is known about friendly contact in metropolitan neighborhoods ; the majority of such contacts are with people of similar social and economic position ; association by level of achievement is the dominant principle of informal relations .,0.8651785598072796
neighborhood.n.02,"In general , friendly contact with a member followed by contact with a clergyman will account for a major share of recruitment by the churches , making it quite evident that the extension of economic integration through co-optation is the principal form of mission in the contemporary church ; economic integration and co-optation are the two methods by which Protestants associate with and recruit from the neighborhood .",0.8258592375212096
neighborhood.n.02,It could be argued that any fellowship which centers in residential neighborhoods is doomed to become an expression of the panic for stable identity among the middle classes .,0.8832276938646391
neighborhood.n.02,"It could be argued that only such neighborhoods can sustain religious activity , since worship presupposes some local stabilities .",0.8231485723713945
neighborhood.n.02,In there are n't many young people in the neighborhood the modifier young takes dominant stress away from its head people : the fact that the young creatures of interest are people seems rather obvious .,0.8428850894799721
neighborhood.n.02,Mission Street at this hour was populated by a whole community that Gun could not have seen on his tour of duty - the neighborhood that had known Urbano Quintana by day .,0.8011780075877483
