sense,sentence,centroid_cs
publish.v.02,Dover `` publishes '' what the company calls `` Listen and Learn '' productions designed to teach foreign languages .,0.7388960477593478
publish.v.02,"As a matter of fact , the incorrect classification , the result of many weeks of labor by Dr. Hilprecht , was about to be published by him the following day .",0.8031903449417656
publish.v.02,"Accounts have been published of Northern liberals in the South up against segregationist prejudice , especially in state-supported universities where pressure may be strong to uphold the majority view .",0.7403317846487416
publish.v.02,"The shooting development program of the Sporting Arms and Ammunition Manufacturers ' Institute has successfully published these facts in all major outdoor magazines , many national weeklies and the trade papers .",0.8304126984288738
publish.v.02,The planter aristocracy has appeared in literature at least since John Pendleton Kennedy published Swallow-Barn in 1832 and in his genial portrait of Frank Meriwether presiding over his plantation dominion initiated the most persistent tradition of Southern literature .,0.7214461687327219
publish.v.02,"After his speech , reporters asked him about the report of his political intentions , published in yesterday 's New York Times .",0.8039845686080966
publish.v.02,"In addition to the interlibrary loan service and the children 's program , headquarters has a public relations director who seeks to get wider grassroots support for quality library service in the county ; it prepares cooperative displays ( posters , booklists , brochures , and other promotional material ) for use in member libraries ; it maintains a central exhibit collection to share displays already created and used ; and it publishes Sum and Substance , a monthly newsletter , which reports the system 's activities to the staffs and trustees of member libraries .",0.7288395822817306
publish.v.02,"The Armed Forces Medical Publication Agency , established in 1949 , has published , since January 1950 , the United States Armed Forces Medical Journal as a triservice publication to furnish material of professional interest to Medical Department officers of the three military services .",0.8570307076124332
publish.v.02,"These publications replaced the U. S. Naval Medical Bulletin , published continuously from 1907 through 1959 , as well as the Navy 's Hospital Corps Quarterly and the Bulletin of the U. S. Army Medical Department , published from 1922 to 1949 .",0.8396500623678601
publish.v.02,"These publications replaced the U. S. Naval Medical Bulletin , published continuously from 1907 through 1959 , as well as the Navy 's Hospital Corps Quarterly and the Bulletin of the U. S. Army Medical Department , published from 1922 to 1949 .",0.8396500623678601
publish.v.02,"From 1 July 1958 to 30 June 1960 , 24 numbers of the Journal and nine of the Bulletin were published .",0.8580403383101788
publish.v.02,"Two special issues were published , one for November 1959 on Space Medicine , the other the Tenth Anniversary issue for January 1960 .",0.8271482301280865
print.v.01,The American Institute of Interior Designers has published a recommended course for designers and a percentage layout of such a course .,0.7904243637718065
print.v.01,`` The Dictionary of Occupational Titles '' published by the U. S. Department of Labor describes him as follows :,0.7688911261127581
print.v.01,"The observations of Mayer , McCullough , and Sloanaker at 3.15 cm and of Sloanaker at 10.3 cm have not previously been published and will be briefly described .",0.8297187885624958
print.v.01,There are no data published in the literature on the shape of low viscosity drops to confirm the above formulas .,0.7510152979031183
print.v.01,The introduction of the United States Pharmacopoeia reference standard in 1952 and the redefinition and equating of the USP and international units of thyroid stimulating activity have made it possible to compare results published by different investigators since that time .,0.7712784095003171
print.v.01,The committee submitted a report signed by Louis Martin and Leon Wiley with a map published in the 1946 town report .,0.7695101485118292
print.v.01,"Alastor was published only to be savagely attacked , contemptuously ignored .",0.8252920651177046
print.v.01,"The same month that Alastor was published , Murray sold twenty thousand copies of The Siege of Corinth , a slovenly bit of Byronism that even Shelley 's generosity rebelled at .",0.7570351771649443
print.v.01,On Earth elections continued and a very advanced poet published a limited edition of verse consisting entirely of punctuation marks and spaces ; Time magazine reviewed it and suggested that the Federation Assembly Daily Record should be translated into the medium .,0.8112855741400494
print.v.01,"L'Unita and Hoy published identical denunciations of Short 's elevation , l'Osservatore Romano and the Christian Science Monitor ignored it , Times of India snickered at it , and the Manchester Guardian simply reported it - the Fosterites in England were few but extremely militant .",0.7966869381518935
print.v.01,"In Berlin he published his views of the chemical laws of nature in German and this was issued in French translation ( Paris , 1813 ) under the title Recherches sur l ' identite des forces chimiques et electriques , a work held in very high esteem by the new generation of research chemists .",0.791734809400182
print.v.01,"With the first of a group of historical novels , The Charles Men ( Karolinerna ) , published in 1897 - 8 , he achieved the masterpiece of his career .",0.7686828659796772
print.v.01,"Rather than from a first-hand study of Jewish people , his delineation of Shylock stems from a collection of Italian stories , Il Pecorone , published in 1558 , although written almost two centuries earlier .",0.80713220722045
print.v.01,"Augustus Baldwin Longstreet , a preacher and a college and university president in four Southern states , published the earliest of these backwoods sketches and in the character Ransy Sniffle , in the accounts of sharp horse-trading and eye gouging physical combat , and in the shockingly unliterary speech of his characters , he set an example followed by many after him .",0.7849537985651468
print.v.01,"Dr. Isaacs was so pleased with the quality of her biographical study of Sara Sullam that he considered submitting it to the Century Magazine or Harper 's but he decided that its Jewish subject probably would not interest them and published it in The Messenger , `` so our readers will be benefited instead '' .",0.7922815326985773
print.v.01,"coordinate , correlate , and publish information with a view to advancing the development of low-cost saline water conversion projects ; and cooperate with other Federal departments and agencies , with State and local departments , agencies , and instrumentalities , and with interested persons , firms , institutions , and organizations .",0.6766527294300017
print.v.01,"A set of tables containing spectral intensities for 39000 lines of 70 elements , as observed in a copper matrix in a d-c arc , was completed and published .",0.8454202518019677
print.v.01,"In 1960 , David D. Thomas published Basic Vocabulary in some Mon Khmer Languages AL 2 , no. 3 , pp. 7 - 11 ) , which compares 8 Mon-Khmer languages with the I-E language data on which Swadesh based the revised retention rate ( * * f ) in place of original ( * * f ) , and his revised 100 word basic glottochronological list in Towards Greater Accuracy ( IJAL 21 : 121 - 137 ) .",0.7420849830590888
print.v.01,"While the U. S. Department of Labor has a program of projecting industry and occupational employment trends and publishing current outlook statements , there is little tangible evidence that these projections have been used extensively in local curriculum planning .",0.7508883264275834
print.v.01,`` With my trial coming up in Federal Court next week I would n't want that picture published '' .,0.7752357353258353
print.v.01,`` Who says it 's going to be published '' ?,0.8299864030114348
print.v.01,"Published annually by William Hord Richardson , the 1962 edition , subtitled Society Register of Southern California , is scheduled to arrive with Monday morning 's postman .",0.8315946841143669
print.v.01,"The New English Bible ( the Old Testament and Apocrypha will be published at a future date ) has not been planned to rival or replace the King James Version , but , as its cover states , it is offered `` simply as the Bible to all those who will use it in reading , teaching , or worship '' .",0.8370283694081969
print.v.01,"To begin with , the all-powerful Los Angeles Times does not publish a transcript of these press conferences .",0.7850803611622469
print.v.01,I was surprised and sorry to find in your issue of March 4 a long and detailed attack upon a book that had not yet been published .,0.8232403936013946
print.v.01,"Representatives of Harvard University Press , which is publishing the book this month of April , recognize and freely acknowledge that they invited such reaction by allowing Life magazine to print an excerpt from the book in advance of the book 's publication date .",0.7503143350348306
print.v.01,"One of the very best is only now published in this country , five years after its first publication in England .",0.8191142684915884
print.v.01,"The programs were so well received by the British public that the arguments have been published in a totally engrossing little book called , `` Rival Theories of Cosmology '' .",0.8392112806657098
print.v.01,"Significantly , no realtor and few of the faculty present were familiar with any of the six volumes ( published by the University of California Press ) that present the commission 's findings .",0.8150319321438035
print.v.01,"This two-part bridge is best described by Rev. Timothy Dwight , president of Yale College , in his `` Travels in New-England and New-York '' , published in New Haven in 1821 .",0.8182180903581149
print.v.01,"Its original appearance is shown in an engraving published in the `` Massachusetts Magazine '' in May 1793 , which is reproduced herewith ( Fig. 1 ) .",0.8196718857988995
print.v.01,"His revolutionary pamphlets , published when he was only 19 , quickly brought him to the attention of the patriot leaders .",0.8097340241501927
print.v.01,"In connection with this conference , a 64 - page supplement was published in the October 2 nd edition of the Providence Sunday Journal .",0.8845910087835431
print.v.01,"The Industrial Division published , in 1960 , a new , attractive industrial brochure , `` Rhode Island - Right For Industry '' , and prepared copy for a new edition of the Directory of Manufacturers ( to be printed shortly ) , and for a new space catalogue .",0.7900110364176024
print.v.01,"In this same period , six new fascicles of the Atlas of Tumor Pathology were published and distributed to medical centers world-wide .",0.8965428346246681
print.v.01,"Occasional features were published on historical medicine , special reports , bibliography , and `` Collector 's Items '' .",0.8422332334181063
print.v.01,"It is planned to double the number of teams and to make use of improved equipment in a second demographic inquiry in 1960 , so that the inquiry can be carried through in one year and the results published more expeditiously .",0.8050902629354882
