sense,sentence,centroid_cs
report.v.03,"Upon return of the file to the local board , petitioner was again ordered to report for induction and this prosecution followed his failure to do so .",0.8856256342194156
report.v.03,"Gun set the captain 's fifth of Hiram Walker inside the safe before he reported to Lt. Killpath , though he knew that Killpath 's ulcer prevented him from making any untoward incursion on Herman Wolff 's gift .",0.8231839650734235
report.v.03,"Killpath said , `` You were expected to report to my office twenty minutes ago , Sergeant .",0.8819146905681111
report.v.03,"`` I might point out that your inability to report to my office this morning when you were instructed to do so has not , ah , limited my knowledge of your activities as you may have hoped '' .",0.8861505345757804
report.v.03,The shortage was discovered after Huff failed to report for work on Sept. 18 .,0.8092292022791467
report.v.03,"The day before Election Day , to which we are entitled as a legal holiday , we were informed to report to our respective polls to work as `` workers of the party '' .",0.8851889321456257
report.v.03,"But , in spite of this , I , at present a man 31 years of age and a College Professor , have been recalled `` by direction of the President '' to report on November 25 th to Fort Devens , Massachusetts , for another twelve months of Active Duty as an Sp 4 ( the equivalent of a PFC ) .",0.8552891986394713
report.v.03,Some pastors write a letter the same night the decision is reported by the visitors .,0.72517254721311
report.v.03,The soles of her sandals reported sharply on the cobblestones .,0.6738131331722326
