sense,sentence,centroid_cs
sound.n.02,"The beehive voices , for no one could bear silence , drowned out the sound of Mrs. Lincoln 's weeping .",0.8551615357863863
sound.n.02,"One moment , the road was filled with disciplined troops , marching four by four with a purpose as implacable as death ; the next , a cloud of gun smoke covered a screaming fury of sound , out of which the redcoat soldiers emerged with their bayonets and their cursing fury .",0.8012218685388017
sound.n.02,"I had squeezed the trigger of my own gun , and to my amazement , it had fired and kicked back into my shoulder with the force of an angry mule ; and then I was adding my own voice to the crescendo of sound , hurling more vile language than I ever thought I knew , sobbing and shouting , and aware that if I had passed water before , it was not enough , for my pants were soaking wet .",0.790693284468992
sound.n.02,"For an instant John longed for the sound of the bells of Noyon-la-Sainte , the touch of his mother 's hand , the lilt of Charles 's voice in the square raftered rooms , his father 's bass tones rumbling to the canons , and the sight of the beloved bishop .",0.7756629825038882
sound.n.02,The week after Manassas the sound of horses in the yard brought Kate up in shock from an afternoon 's rest when she saw the Federal soldiers from her upstairs window .,0.7792755988565723
sound.n.02,"He watched the girl until she had gone into the trees , and waited until he could n't hear the sound of her horse any longer , then went up to where the children were sleeping .",0.8584548746742293
sound.n.02,"Yet if he were not there , they would have missed him , as they would have missed the sounds of bees buzzing against the screen door in early June ; or the smell of thick tomato paste - the ripe smell that was both sweet and sour - rising up from aluminum trays wrapped in fly dotted cheesecloth .",0.8388132724125295
sound.n.02,"Or the surging whirling sounds of bats at night , when their black bodies dived into the blackness above and below the amber street lights .",0.8244419535951145
sound.n.02,"Also , it should be noted that the polytonal freedom of his melodies and harmonic modulations , the brilliant orchestrations , the adroitness for evading the heaviness of figured bass , the skill in florid counterpoint were not lost in his mature output , even in the spectacular historical dramas of the stage and cinema , where a large , dramatic canvas of sound was required .",0.7012204505323371
sound.n.02,"If a child watched its progress he whispered , `` Hay , hay , load of hay - make a wish and turn away '' , and then stared rigidly in the opposite direction until the sound of the horses ' feet returned no more .",0.8372058657660192
sound.n.02,"When words can be used in a more fresh and primitive way so that they strike with the force of sights and sounds , when tones of sound and colors of paint and the carven shape all strike the sensibilities with an undeniable force of data in and of themselves , compelling the observer into an attitude of attention , all this imitates the way experience itself in its deepest character strikes upon the door of consciousness and clamors for entrance .",0.8019716936133257
sound.n.02,"When words can be used in a more fresh and primitive way so that they strike with the force of sights and sounds , when tones of sound and colors of paint and the carven shape all strike the sensibilities with an undeniable force of data in and of themselves , compelling the observer into an attitude of attention , all this imitates the way experience itself in its deepest character strikes upon the door of consciousness and clamors for entrance .",0.8019716936133257
sound.n.02,"He was silent again , possibly listening to the sounds in the squadroom .",0.8169602721157326
sound.n.02,"And the bed that sagged in a certain place where all the weight had been put too many times before and the walls fine and thin for overhearing talk in the next room when Gratt went out for ice , the sound coming through the walls like something on the other side of the curtain , so you knew they heard you when they were quiet and while you lay wondering what they had heard you listened .",0.8646593568835756
sound.n.02,"And every sound that might be the rain also might be the man who thinks after he has raped you he has to beat your brains out with a tire tool so you won n't tell , a combination like ham and eggs , rape her and kill her , and that is being an old maid too .",0.8143622388767329
sound.n.01,"his scrawny , tottering sound adds a delightful hilarity to the performance . )",0.818845759833055
sound.n.01,"Telefunken has accorded him beautiful sound , and this bargain-priced disc ( it sells for $ 2.98 ) is worthy of consideration .",0.6859008476120619
sound.n.01,"The sound may be good ; but if you know The Real Thing , you know that what you are hearing is only a clever imitation .",0.8641971462273677
sound.n.01,The sound of his footsteps was like a muffled drum .,0.8407027645082616
sound.n.01,"Alex suppressed those expressions of relief which offered to prevail in his face and escape from his throat ; unwarranted they were in any case for , as he stood facing the fille de chambre , his ears were assailed by new sounds from the interior of the shower room .",0.8056792942407608
sound.n.01,"The doctor 's wits had not left him , however , for all his sixty-eight years , and the wails were almost immediately lost in the sound of water rushing out from the showerhead .",0.8146690109455232
sound.n.01,"They could hear the pony 's feet on the dry leaves for a while , then the sound faded out .",0.8435136798285529
sound.n.01,"It now means ominous , as when one speaks of a funny sound in the motor ; disturbing , as when one says that a friend is acting funny ; and frightening , as when a wife tells the police that it is funny , but her husband has n't been home for two days and nights '' .",0.8074212477335676
sound.n.01,The sound mockery of sheep is like the salubrious horse laugh '' .,0.819912162889238
sound.n.01,"bursting from the lips of a charging cavalry trooper was the last sound heard on this earth by untold numbers of Cheyennes , Sioux and Apaches , Mexican banditos under Pancho Villa , Japanese in the South Pacific , and Chinese and North Korean Communists in Korea .",0.834644843641388
sound.n.01,"The commands are specified by the military regulations ; are few in number , briefly worded , all different in sound ; and are combinable into sequences which permit any marching maneuver that could be desired on a parade ground .",0.7620595914030075
sound.n.01,Johnny Mercer practically grew up with the sound of jazz and the blues in his ears .,0.8357960761264759
sound.n.01,"To a much less full extent , the hebephrenic person 's belching or flatus has a comparable communicative function ; in working with these patients the therapist eventually gets to do some at least private mulling over of the possible meaning of a belch , or the passage of flatus , not only because he is reduced to this for lack of anything else to analyze , but also because he learns that even these animal like sounds constitute forms of communication in which , from time to time , quite different things are being said , long before the patient can become sufficiently aware of these , as distinct feelings and concepts , to say them in words .",0.7824822285421363
sound.n.01,The single shot would come ; Hoag would carry its sound to his grave .,0.8157285617685787
sound.n.01,For a blood chilling ring of terror to the very sound of his name was the tool he needed for the job he 'd promised to do .,0.7017909008058765
sound.n.01,His earphones were constantly full of the sounds of enemy contacts made by other flights .,0.8326661467781317
sound.n.01,"Just as I got to my knees , there was again the sound of the fence stretching , and I had time only to start taking my kneeling posture seriously .",0.8081139087230446
sound.n.01,"Teeth again flashing back at me , the driver released a deluge of Spanish in which `` amigo '' appeared every so often like an island in the stormy waves of surrounding sound .",0.7389577748652395
sound.n.01,This time there was no sound of brakes but the shrieking of women .,0.7811591236631223
sound.n.01,It was filled with dust and wind and sound and violence .,0.8073942630241452
sound.n.01,"Beaten with fear and sound and wet and chill , they crawled to the hurricane deck and looked out haggardly at a world of water that reached clear to the surrounding hills .",0.7809184006375822
