sense,sentence,centroid_cs
discipline.n.01,Grover also would require junior senior high teachers to have at least 24 semester hours credit in the subject they are teaching .,0.8900019392574137
discipline.n.01,The remainder of the 4 - year college requirement would be in general subjects .,0.8367062094595009
discipline.n.01,"Not only should every educator above the rank of instructor be expected to be a member of one of the professional organizations , but his first qualification for membership as an educator should be so sharply scrutinized that membership would be equivalent to certification to teach the subject .",0.8037001058235163
discipline.n.01,Beyond any question of curriculum and approach to subject must be the quality of the teachers themselves .,0.7981158071818885
discipline.n.01,"It will occur to anyone that the teacher must have adequate education , a depth and breadth of knowledge far beyond the immediate necessities of his course plus complete dedication to his subject and to his students .",0.8251620710817935
discipline.n.01,"Considerable specialization in teaching subjects such as architecture , furniture design , textiles and color is also desirable .",0.8710131249839702
discipline.n.01,"It is only fair to demand that teachers of courses in English , history , psychology and so on be as well informed in matters of art , especially interior design , as are the art teachers educated in the academic subjects .",0.8844319890378174
discipline.n.01,"This , plus the habit of many schools of simply adding interior design to the many subjects of their home economics department , yet , nevertheless , claiming that they teach interior design , has contributed to the low repute of many university courses in interior design .",0.8468543256767138
discipline.n.01,"In spite of this , many universities offer adequate and even distinguished courses in the subject .",0.8494229072972269
discipline.n.01,There are three levels on which to treat the subject .,0.7800677057169575
discipline.n.01,"From the town surveyor , Hans learned drawing and mathematics and , from a university student , some academic subjects .",0.8311070249680402
subject.n.01,"Ordinary politeness may have militated against this opinion being stated so badly but anyone with a wide acquaintance in both groups and who has sat through the many round tables , workshops or panel discussions - whatever they are called - on this subject will recognize that the final , boiled down crux of the matter is education .",0.8357965682039844
subject.n.01,We may then dismiss the time difference between these courses and the usual four year course of the interior design student as not having serious bearing on the subject .,0.847668031062084
subject.n.01,"However , readers who accept Freud 's findings and believe that he has solved completely the mystery of dreams , should ponder over the following words in his Interpretation Of Dreams , Chapter 1 , : `` as a matter of fact no such complete solution of the dream has ever been accomplished in any case , and what is more , every one attempting such solution has found that in most cases there have remained a great many components of the dream the source of which he has been unable to explain , nor is the discussion closed on the subject of the mantic or prophetic power of dreams '' .",0.8165299351188775
subject.n.01,"For one thing , this is not a subject often discussed or analyzed .",0.8644229960165354
subject.n.01,How and why this process occurs would provide an interesting separate subject for study .,0.7776221185620338
subject.n.01,"Although a somewhat technical subject , it has important political implications as the above discussion of the voting system indicated .",0.851112585062937
subject.n.01,It was hardly possible to get any argument on the subject .,0.7824187587814759
subject.n.01,`` What will be the subject '' ?,0.7306266736178342
subject.n.01,Hino talked very little about himself except for the infrequent times when he used a personal illustration in connection with another subject .,0.8242650067903292
subject.n.01,"I had no idea of what subjects one discussed when alone with a girl , or how one behaved :",0.8070470722495352
subject.n.01,"Forty years ago an English writer , W. L. George , dealt with this subject in Eddies of the Day , and said , as an example , that ' Saint George for Merry England ' would not start a spirit half so quickly as ' Strike frog eating Frenchmen dead '' ' !",0.8588754247080969
subject.n.01,"New Englanders were a bit sensitive on the subject of their complicity in Negro slavery at the time of the drafting of the Declaration of Independence , as Jefferson explained in his `` Autobiography '' : `` The clause reprobating the enslaving the inhabitants of Africa was struck out in complaisance to South Carolina and Georgia , who had never attempted to restrain the importation of slaves , and who on the contrary still wished to continue it .",0.7884529057811247
subject.n.01,"The Charles Men consists not of a connected narrative but of a group of short stories , each depicting a special phase of the general subject .",0.8046609483037068
subject.n.01,And she wrote the libretto for an oratorio on the subject of Judas Maccabeus performed at the Hanukkah festival which came in December .,0.7841299949503321
subject.n.01,"In a symposium and general exploration of the field of Person Perception and Interpersonal Behavior the discussion does not touch upon this aspect of the subject , with one possible exception ; Solomon Asch shows the transcultural stability of metaphors based on sensation ( hot , sweet , bitter , etc . ) dealing with personal qualities of human beings and events .",0.8737338458369287
subject.n.01,"Thus in Mary wrote an account of the trip first strong stress on Mary marks Mary as the first in a series of people who wrote accounts of the trip , strong stress on wrote marks the writing as the first of a series of actions of Mary 's concerned with an account of her trip ( about which she may later have made speeches , for example ) , and strong stress on trip makes the trip the first of a series of subjects about which Mary wrote accounts .",0.7549842557037115
subject.n.01,"For our present purposes we assume that the sole subject of bargaining is the basic wage rate ( not including productivity improvement factors or cost-of-living adjustments ) , and it is this basic wage rate which determines the level of costs .",0.7148578461758112
subject.n.02,"The `` moving '' picture of the train or the wave coming at the audience is , to be sure , more intense than a still picture of the same subject , but the difference is really one of degree ; the cinematic element of time is merely used to increase the realism of an object which would still be reasonably realistic in a still photo .",0.8286992425979371
subject.n.02,"In their very first collages , Braque and Picasso draw or paint over and on the affixed paper or cloth , so that certain of the principal features of their subjects as depicted seem to thrust out into real , bas-relief space - or to be about to do so - while the rest of the subject remains imbedded in , or flat upon , the surface .",0.9055557713076425
subject.n.02,"In their very first collages , Braque and Picasso draw or paint over and on the affixed paper or cloth , so that certain of the principal features of their subjects as depicted seem to thrust out into real , bas-relief space - or to be about to do so - while the rest of the subject remains imbedded in , or flat upon , the surface .",0.9055557713076425
subject.n.02,"Out of this re-created literalness , the Cubist subject reemerged .",0.8500507927579419
subject.n.02,"In order to be saved , plasticity had had to be isolated ; and as the aspect of the subject was transposed into those clusters of more or less interchangeable and contour obliterating facet-planes by which plasticity was isolated under the Cubist method , the subject itself became largely unrecognizable .",0.9264277308741229
subject.n.02,"In order to be saved , plasticity had had to be isolated ; and as the aspect of the subject was transposed into those clusters of more or less interchangeable and contour obliterating facet-planes by which plasticity was isolated under the Cubist method , the subject itself became largely unrecognizable .",0.9264277308741229
subject.n.02,"Large planes juxtaposed with other large planes tend to assert themselves as independent shapes , and to the extent that they are flat , they also assert themselves as silhouettes ; and independent silhouettes are apt to coincide with the recognizable contours of the subject from which a picture starts ( if it does start from a subject ) .",0.9063046413747361
subject.n.02,"Large planes juxtaposed with other large planes tend to assert themselves as independent shapes , and to the extent that they are flat , they also assert themselves as silhouettes ; and independent silhouettes are apt to coincide with the recognizable contours of the subject from which a picture starts ( if it does start from a subject ) .",0.9063046413747361
subject.n.02,"And like this English master , Mason realizes his subjects in large , simplified masses which , though they seem effortless , are in reality the result of skilled design born of hard work and a thorough distillation of the natural form that inspired them .",0.8329076352821555
subject.n.02,"Out of this background of hunting and fishing , it was only natural that Roy first painted subjects he knew best : hunters in the field , fishermen in the stream , ducks and geese on the wing - almost always against a vast backdrop of weather landscape .",0.825807110700274
subject.n.02,"First I make preliminary watercolor sketches in quarter scale ( approximately * * f inches ) in which I pay particular attention to the design principles of three simple values - the lightest light , the middle tone , and the darkest dark - by reducing the forms of my subject to these large patterns .",0.8985267185651322
subject.n.02,"Often , in working out-of-doors under all conditions of light and atmosphere , a particular passage that looked favorable in relation to the subject will be too bright , too dull , or too light , or too dark when viewed indoors in a mat .",0.9075526700690473
subject.n.02,"He does not insist on telling all he knows about any given subject ; rather his pictures invite the observer to draw on his memory , his imagination , his nostalgia .",0.879246228909715
subject.n.02,It is for this reason that Roy avoids selecting subjects that require specific recognition of place for their enjoyment .,0.7308150572460407
