sense,sentence,centroid_cs
surface.n.02,"However , the surface temperature gradient can produce erroneous vapor-pressure measurements for the bulk liquid helium unless precautions are taken to isolate the tube ( which passes through the surface to the vapor pressure bulb ) from the liquid helium surface .",0.8269163583853678
surface.n.02,"However , the surface temperature gradient can produce erroneous vapor-pressure measurements for the bulk liquid helium unless precautions are taken to isolate the tube ( which passes through the surface to the vapor pressure bulb ) from the liquid helium surface .",0.8269163583853678
surface.n.02,"However , the surface temperature gradient can produce erroneous vapor-pressure measurements for the bulk liquid helium unless precautions are taken to isolate the tube ( which passes through the surface to the vapor pressure bulb ) from the liquid helium surface .",0.8269163583853678
surface.n.02,"It has also been observed , in helium 2 , , that large discrepancies can exist between surface vapor pressures and those pressures measured by a vapor pressure thermometer .",0.8325392200781482
surface.n.02,"At the pool 's far end was the little cabana Joyce had mentioned , and on the water 's surface floated scattered lavender patches of limp looking lather .",0.6998662659776921
surface.n.02,"The jetting , frothing surface of the river reached the level of the runoff .",0.7587494475016834
surface.n.03,Neutral or inversion meteorological conditions are necessary for a cloud to travel along the surface .,0.8560422910184782
surface.n.03,"The best chance , of course , is offered by gently sloping terrain where the water remains close to the surface and where the air is dry , so that a high evaporation leaves salty deposits which permit only sparse plant growth .",0.9050936006330176
surface.n.03,"Even so , he could not ease the tension of his body ; the rough surface of the earth itself seemed to resist every attempt on his part to relax .",0.7082585057159216
surface.n.03,"Sometimes this is accompanied by visible shifts of the ground surface ; often the shifts cannot be seen , but they are there ; and everywhere can be found scars of earlier breaks once deeply buried .",0.8057626781080418
surface.n.03,"These waves have shown that 1800 miles below the surface a liquid core begins , and that it , in turn , has a solid inner core .",0.8589043196573292
surface.n.03,"Earthquakes originate as far as 400 miles below the surface , but they do not occur at greater depths .",0.8633456002190153
surface.n.03,"( 1 ) As far down as 400 miles below the surface the material should be hot enough to be plastic and adjust itself to twisting forces by sluggish flow rather than by breaking , as rigid surface rocks do .",0.8993723642155314
surface.n.03,"In view of the increasing shortage of usable surface and ground water in many parts of the Nation and the importance of finding new sources of supply to meet its present and future water needs , it is the policy of the Congress to provide for the development of practicable low-cost means for the large-scale production of water of a quality suitable for municipal , industrial , agricultural , and other beneficial consumptive uses from saline water , and for studies and research related thereto .",0.7734148122097255
surface.n.03,"This shelter could be built in regions where water or rock is close to the surface , making it impractical to build an underground shelter .",0.9217779998431117
surface.n.03,These are particularly suitable for regions where water or rock is close to the surface .,0.9301676379938578
surface.n.03,"For example , the importance of the Regulus 2 , , a very promising aerodynamic ship to surface missile designed to be launched by surfaced submarines , was greatly diminished by the successful acceleration of the much more advanced Polaris ballistic missile launched by submerged submarines .",0.6499485548861776
