sense,sentence,centroid_cs
table.n.01,"Radio observations of the moon have been made over the range of wave lengths from 4.3 mm to 75 cm , and the results are summarized in Table 1 .",0.900294126335688
table.n.01,The **f values are listed in Table 1 together with the measured surface temperatures and arc voltages .,0.9091908334196809
table.n.01,"Whereas the usual organic surface-active agent is strongly sorbed at oil-water interfaces , the highly charged ions are most strongly sorbed at interfaces between water and insoluble materials exhibiting an ionic structure ( see Table 26 - 2 on p. 1678 ) .",0.8460858289452378
table.n.01,Data on such comparisons together with data on the effect of light intensity are given in Table /1 .,0.843056322785695
table.n.01,"A summary of meteorite data , prepared by Whipple ( 1958 ) on the basis of photographic , visual , and radar evidence , is given in Table 5 - 1 .",0.8841819520446522
table.n.01,"The mass scale used in Table 5 - 1 was derived on the assumption that the motion of the glowing trail is related to the momentum transfer to the trail by the meteorite , permitting the calculation of the mass if the velocity is known ( Cook and Whipple , 1958 ) .",0.8991928908468197
table.n.01,These extrapolated fluxes are about an order of magnitude less than the values from the satellite data and the figures in Whipple 's table .,0.8399482516518538
table.n.01,The relationship between particle size and infectious dose is illustrated in Table 1 .,0.9255776579391581
table.n.01,Some of the features of the top portions of Figure 1 and Figure 2 were mentioned in discussing Table 1 .,0.8872645142750357
table.n.01,"Although the standard deviation values on which spread of the lines are based are relatively larger for those centers which begin to ossify early ( Table 1 ) , there are considerable differences in this value between centers having the closely timed Onsets .",0.8974425536973158
table.n.01,"It may be assumed that differences in ratings due to selection of growth centers from specific regions of the body will be small , according to existing tables of onset age and completion age for centers throughout the body .",0.7497837502842288
table.n.01,It was stated earlier that one purpose of this study was to extend the analysis of variability of Onset and Completion in each of the 21 growth centers somewhat beyond that provided by the data in Tables 1 and 2 .,0.8260785212830725
table.n.01,The numbering system used in Tables 1 and 2 and Figures 1 and 2 was continued for the 21 growth centers .,0.8646292114666825
table.n.01,"The length of the arrow indicates amount of slowing or acceleration at Completion over that at Onset , and the difference in months can be read roughly by referring the arrow to the age scale along the base of each figure , or more precisely by referring to the original data in the appropriate tables .",0.8306858199540165
table.n.01,This difference is readily clarified by referring to Table 1 .,0.911839203039093
table.n.01,Length of the shaft of these arrows may be evaluated according to the standard deviation values for each center in Table 1 .,0.9191850685017895
table.n.01,Forty other figures similar to 5 and 6 and the original data used in the construction of all figures and tables in this monograph have been included in the Appendix .,0.7711835596672508
table.n.01,"At the top of Figure 5 , for example , the Onset range and Completion range lines for the chosen growth center have been drawn for girls according to their mean and standard deviation values in Table 1 .",0.9146768016115975
table.n.01,"The mean onset age was 25.3 months ( Table 1 ) , and the average Span of the osseous stage was 133 months .",0.8663973005671258
table.n.01,"The correlation ( Table 2 ) between onset age and completion age was + .50 , and that between onset age and Span was - .10 .",0.8885010526112512
table.n.01,Table 7 - 1 illustrates the point .,0.8700182830571455
table.n.01,The table shows that 0.6 of the boys and 0.6 of the girls vote for picture A .,0.7795360589578494
table.n.01,"But Table 7 - 1 shows that * * f or 0.70 agree , too many for independent voting .",0.8955724970711109
table.n.01,"However , the regionally differentiated results , which appear below in tables , are interesting evidence of the problems of developing self-government under even the most favorable circumstances .",0.8454230231310857
table.n.01,"The value of the elections was lost , both as an experiment in increased political participation and as a reliable indicator of commercial interest , as shown in Table /1 , .",0.8443157861238277
table.n.01,"A goal was fixed , as given in Table 2 , and attention focused on its fulfillment .",0.892433697031589
table.n.01,The registration figures given in Table 2 must be interpreted with caution since the estimate for eligible electors were made without the benefit of a reliable census .,0.8804136806763787
table.n.01,"Examination of the data in Table 1 , shows that a few samples contributed to raising the effluent BOD .",0.9056776254313241
table.n.01,"The flow rate remained relatively constant during the winter months as shown in Table 1 , .",0.9019823945493664
table.n.01,"The data given in Table 2 , show the routine operation of the aerator .",0.9214214133750417
table.n.01,"The rate of oxygen transfer at 1.0 - mg / l dissolved oxygen concentration and 10 ` C for various rotor speeds is given in Table 3 , .",0.9023989135317302
table.n.01,"The BOD data are given in Table 4 , .",0.9018915495200184
table.n.01,"In deciding on the enterprises to be managed by family labor , compare the amount of labor that can be supplied by the family with the labor needs of various enterprises listed in table 1 .",0.9176678942331289
table.n.01,"Today a battle cry may seem an anachronism , for in the modern Army , esprit de corps has been sacrificed to organizational charts and tables .",0.6733483736342336
table.n.01,"It will be shown that the objectives of the cooperative people in an organization determine the type of network required , because the type of network functions according to the characteristics of the messages enumerated in Table 1 .",0.9201645052240685
table.n.01,"However , for convenience we will stick to the idea that information can be classified according to Table 1 .",0.9127234803718921
table.n.01,"All four types of message listed in Table 1 are permitted , although decorum and cocktail tradition require holding the commands to a minimum , while exclamations having complimentary intonations are more than customarily encouraged .",0.8642204593938486
table.n.01,"Of types of message listed in Table 1 , commands and statements are the only ones sent through the vertical network shown in Figure 3 .",0.8956322866195566
table.n.01,"The results of the study , based on collision integrals computed from the latest critically evaluated data on intermolecular forces in air , will be reported in the form of a table of viscosity , thermal conductivity , thermal diffusion , and diffusion coefficients at temperatures of 1000 to 10000 * * f and of logarithm of pressure in atmospheres from * * f to * * f times normal density .",0.7845614536611323
table.n.01,Selected bibliographies and tables of available data are now in preparation .,0.7033440480978094
table.n.01,"A set of tables containing spectral intensities for 39000 lines of 70 elements , as observed in a copper matrix in a d-c arc , was completed and published .",0.7354666311524383
table.n.01,"The following table shows , for selected years , the authorizations , appropriations , allotment base , Federal grants to States and State matching funds for this part of the grant program .",0.7433577289182578
table.n.01,"If you elect to use the Standard Deduction or the Tax Table , and later find you should have itemized your deductions , you may do so by filing an amended return within the time prescribed for filing a claim for refund .",0.7303983297610418
table.n.01,The same is true if you have itemized your deductions and later decide you should have used the Standard Deduction or Tax Table .,0.7275577426021202
table.n.01,These deductions may not be claimed if you elect to use the Standard Deduction or tax Table .,0.7464505486474915
table.n.01,Tables 1 and 2 present the results of the statistical analysis of the data when compulsivity is used as the descriptive variable .,0.8038201906497734
table.n.01,The statistical analyses of achievement in relation to anxiety and teaching methods and the interactions of the two are presented in Tables 3 and 4 .,0.8432235767113889
table.n.01,These two pieces of information for each dictionary form that is matched by a text form constitute the table of dictionary usage .,0.7974669572707126
table.n.01,"When a match is found , an entry is made in the table of dictionary usage .",0.8105239062251473
table.n.01,"The final step merely uses the table of dictionary usage to select the dictionary information that pertains to each form matched in the text form list , and uses the list of information cells recorded in text order to attach the appropriate information to each occurrence in text .",0.7429053422791075
table.n.01,"When entries are being retrieved from this file , the table of dictionary usage indicates which entries to skip and which entries to store in the computer .",0.7995400252849192
table.n.01,( The address of the information cell is also supplied by the table of dictionary usage . ),0.8302270430949347
table.n.02,Teachers - men who wore brown suits and had gray hair and pleasant smiles - came to their table to talk shop and to be introduced to Scotty and Rachel .,0.7783032134774541
table.n.02,"Scotty murmured , `` No , thanks '' , so softly his father had to bend his gaunt height across the table and turn a round brown ear to him .",0.8668410043741741
table.n.02,His stethoscope was on the table by Scotty 's bed and he picked it up and wagged it at Scotty .,0.8406325850127565
table.n.02,"They slept - Mynheer with a marvelously high-pitched snoring , the damn seahorse ivory teeth watching him from a bedside table .",0.8015633224892093
table.n.02,"It was just me and Eileen getting drunk together like we used to in the old days , and me staring at her across the table crazy to get my hands on her partly because I wanted to wring her neck because she was so ornery but mostly because she was so wonderful to touch .",0.8141077693073979
table.n.02,There was a man 's jacket on the chair and a straw hat on the table .,0.8879373501148711
table.n.02,"He got no relief from drink because , though sometimes Precious would buy himself a drink if he went out with us in the evening , he 'd leave it on the table untouched .",0.8742973224876268
table.n.02,Everything 's on the table '' .,0.7296101583331589
table.n.02,"She signed the letters quickly , stamped them , and placed them on the hall table for Raphael to mail in town .",0.8592985482100148
table.n.02,Angelina placed the tray on the table and with a flick of dark wrist drew off the cloth .,0.9000934416806359
table.n.02,"It seemed to her , as it seemed each night , that the gloom drew itself in and became densest at the table 's empty chairs , giving her the frequent illusion that she dined with shadows .",0.8357952380248453
table.n.02,"Here , too , she talked low , quirking her head at one or another of the places , most often at Izaak 's armchair which faced her across the long table .",0.8509557043900328
table.n.02,"Water from the snow and water from the towels had run off the kid to the table where the dough was , and the dough was turning pasty , sticking to the kid 's back and behind .",0.891526669979088
table.n.02,"But just when she seemed to have sunk into some depravity of peasanthood she would disappear and come down bathed , brushed , and taking breaths of air , and even with her broken nails her hands would come to rest on a table or a leaf with a thoughtless delicacy , a grace of history , so to speak , and for an instant one saw how ferociously proud she was and adamant on certain questions of personal value .",0.8445597846928858
table.n.02,"Now she could let out the three parakeets without fear they would be stepped on or that Stowey would let them out one of the doors ; she could dust the plants , then break off suddenly and pick up an old novel and read from the middle on ; improvise cha-chas on the harp ; and finally , the best part of all , simply sit at the plank table in the kitchen with a bottle of wine and the newspapers , reading the ads as well as the news , registering nothing on her mind but letting her soul suspend itself above all wishing and desire .",0.8129183397555163
table.n.02,"She fell asleep leaning on her hand , hearing the house creaking as though it were a living a private life of its own these two hundred years , hearing the birds rustling in their cages and the occasional whirring of wings as one of them landed on the table and walked across the newspaper to perch in the crook of her arm .",0.8991503501141633
table.n.02,A colossal campaign opened to sell more sexual organs of plants and Mrs. Joseph Shadow of Greatness Douglas was quoted as saying : `` I would no more sit down without flowers on my table than without serviettes '' .,0.8134313608052397
table.n.02,"He would sit inside the coffee shop and pound a gloved fist upon the table and a girl would hear him and come running , bowing with her running , calling out in her bowing , `` At your service '' .",0.8739022083431989
table.n.02,The action centers about a group of outspoken and offbeat students sitting around a table in a cafeteria and their collective and ultimately fruitless search for a cup of hot coffee .,0.7730281357509621
table.n.02,"Save for brief periods in garrison or winter quarters , soldiers rarely enjoyed the luxury of a writing desk or table .",0.7992174408109247
table.n.02,"a lighted lamp stood on the table that dusky , drizzling day .",0.8957155478321832
table.n.02,"Muller , nakedly exposed at the bright window like a deer pinned in a car 's headlights , threw down the rifle and turned to jump from the table ; his face wore a look of outrage .",0.8726213138622038
table.n.02,"A shot caught him and straightened him up in screaming pain ; a following volley of shots shattered glass , ripped the ceiling , and sent him lurching heavily from the table .",0.862441319082513
table.n.02,"He put the shells on the table , as though he could no longer bear to hold them .",0.8976426737685776
table.n.02,"It dawns on you that instead of a lump to fill the seat across the bridge table from you , he was a man , and that because Gratt Shafer was making you miserable , you were passing it down to him , to Gratt Shafer 's substitute , that other guy .",0.808955081981377
