sense,sentence,centroid_cs
expect.v.01,"The Louisiana city is known , of course , for its fine food , good music and its colorful hospitality `` and , when guests arrive at Philmont that night '' , says Mrs. Grinsfelder , `` that is exactly what we expect to offer them .",0.8023801077207107
expect.v.01,"Both of those have had dynamic run-ups in price on the market in recent months , both were selling at higher price-earnings and yield bases than Morton was coming to market at , and everyone who knew anything about it expected the Morton stock to have a fast run-up .",0.7666436072348016
expect.v.01,"Treasury Secretary Douglas Dillon said the economy is expected to advance by a whopping 8 % next year , paving the way for lower taxes .",0.7509191532890847
expect.v.01,Maybe it 's taking longer to get things squared away than the bankers expected .,0.7220808024010164
expect.v.01,"Expect their own production volume , and presumably sales , to jump 30 percent in 1961 .",0.7006863100792395
expect.v.01,"With cash receipts from marketings expected to be slightly above 1960 , farmers ' gross income is estimated at $ 39.5 billion , $ 1.5 billion above 1960 's record high .",0.7272681681004092
expect.v.01,"Requests for substantiation , the Service indicated , can be especially expected in cases where it suspects the donor received some material benefit in return , such as tickets to a show .",0.7482739383431402
expect.v.01,More than 200 are expected at the autumn event which is matched in the spring .,0.7661977700722935
expect.v.01,More than 300 teenagers last Sunday proved there is and as many more are expected to prove it again for Jim Kern and his wife Lynn from 4 to 8 p. m. Sunday at First Presbyterian Church .,0.7747427786448086
expect.v.01,About 1500 delegates are expected to register today for the biennial session of the Ancient and Accepted Scottish Rite for the Southern Jurisdiction of the United States .,0.7655346235953382
expect.v.01,"And while no one expects total democracy on the academic scene , the scholar will be particularly sensitive to a line between first and second class citizenship drawn on any basis other than that of academic rank or professional achievement .",0.808896108241745
expect.v.01,"The House , which had passed its smaller appropriation before the President 's urgent call for more , was expected to go along with the increased defense budget in short order .",0.7942458405126955
expect.v.01,"The Senate ( by voice vote ) and the House ( by 224 - 170 ) passed and sent to the White House the compromise farm bill which the President is expected to sign , not too unhappily .",0.7756872388707472
expect.v.01,"Further improvements in earnings of the Kansas Turnpike are expected late in 1961 , with the opening of a new bypass at Wichita , and still later when the turnpike gets downtown connections in both Kansas City , Kans. , and Kansas City , Mo. .",0.7370435486841335
expect.v.01,"Coupling its own budget of $ 83750 with a $ 30000 state grant authorized by Gov. Vandiver , the group expects to sign a contract in March with Georgia Tech. .",0.6666417923848693
expect.v.01,"Since Laos is of no more purely military value to Moscow itself than it is to Washington , this approach might be expected to head off Mr. Khrushchev for the moment .",0.8024970224870511
expect.v.01,The House communications subcommittee is expected to report out a good bill calling for the states to match federal funds .,0.7347106931100793
expect.v.01,"Anybody who is expecting a joyride should , according to Mr. Shriver , get off the train right now .",0.7349580899096765
expect.v.01,"According to the original program , Premier Khrushchev expected the millions looking toward the Kremlin this morning to be filled with admiration or rage - depending upon individual or national politics - because of the `` bold program for building communism in our time '' which the Congress will adopt .",0.7848399843754108
expect.v.01,He does not expect to get great riches or he would not have chosen to answer the call to preach .,0.8146216781750657
expect.v.01,"So successful has been this program , worked out by white and Negro civic leaders , that further extensions are expected in the next few months .",0.7835834499106692
expect.v.01,You certainly can n't expect the infield to do any better than it did last year .,0.7978352155659736
expect.v.01,"You can n't expect it , though .",0.762390591024829
expect.v.01,"They do n't expect to stop him , just slow him down some with the bat .",0.7656275346715988
expect.v.01,But they expect to reduce his over-all offensive production .,0.7302393109558948
expect.v.01,"So , all in all , the infield can n't be expected to supply the added improvement to propel the Birds from second to first .",0.7849903900973405
expect.v.01,`` They 're the ones we can expect to do better '' .,0.8081163686380418
expect.v.01,"The scientists have also warned that no life above ground or underground , sheltered or unsheltered could be expected to survive in an area at least 50 miles in diameter .",0.7722770292669765
expect.v.01,"The funeral for my husband was just what I wanted and I paid a fair price , far less than I had expected to pay .",0.7350844432626555
expect.v.01,"If any are left , presently , we may expect to see signs specifically prohibiting the feeding of them too .",0.7902751234161138
expect.v.01,"All false gods resemble Moloch , at least in the early phases of their careers , so it would be unreasonable to expect any form of idol-worship to become widespread without the accompaniment of human sacrifice .",0.7806107562574569
expect.v.01,It was expected that the comparison of different approaches to ethics would produce a better grasp of each other 's positions and better comprehension of one 's own .,0.7489104981019591
expect.v.01,It follows that teachers as a group cannot expect any marked salary increases ; there is a limit to how much the public will pay for shoddy performance .,0.7958600925136554
expect.v.01,"The limitations are those one expects from untrained and unsettled voices - an occasional shrillness of almost earsplitting intensity , an occasional waver and now and then a bleat .",0.7171415389088077
expect.v.01,"Norman Paris has provided them with extremely effective orchestral accompaniment Turning to the current musical season on Broadway , the most widely acclaimed of the new arrivals , How to Succeed in Business Without Really Trying , has been transferred to an original cast album ( R. C. A. Victor LOC 1066 ; stereo LSO 1066 ) that has some entertaining moments , although it is scarcely as inventive as the praise elicited by the show might lead one to expect .",0.7086678191067283
expect.v.01,"With three fine Russian films in recent months on World War 2 , - `` The House I Live In '' , `` The Cranes Are Flying '' and `` Ballad of a Soldier '' - we had every right to expect a real Soviet block-buster in `` The Day the War Ended '' .",0.8088845935165128
expect.v.01,"Last season , the Comedie 's two principal experiments came to grief , and , in consequence , we can expect fairly soon to see still newer productions of Racine 's `` Phedre '' and Moliere 's `` School for Wives '' .",0.8006703686751456
expect.v.01,Mr. White admires him profoundly and leaves no doubt that he is a Democrat himself who expects Mr. Kennedy to be a fine President .,0.7243638368183454
expect.v.01,"No orchestra , however , could be expected to follow a singer through quite as many adventures with pitch as Miss Pons encountered last night .",0.7708900406265489
expect.v.01,"But slowly they take over as Alain Delon ( Life , Sept. 15 ) , playing a sometimes appealing but always criminal boy , casually tells a rich and foot-loose American that he is going to murder him , then does it even while the American is trying to puzzle out how Delon expects to profit from the act .",0.7133454537583198
expect.v.01,"The ramblings on life , death , and the wonder of it all are distressing ; the love-making , perhaps because it is pale and low-key when one has been conditioned to expect harsh colors and explicitness , is often charming ; the automobile racing bears little relation to reality .",0.7453636926389664
expect.v.01,"Race-drivers , on the other hand , are quite often killed on the circuit , and since it was obviously Mr. Remarque 's intention to establish automobile racing as life in microcosm , one might reasonably have expected him to demonstrate precise knowledge not only of techniques but of mores and attitudes .",0.7922186632828851
expect.v.01,"Again , India has imposed formidable barriers against the entrance of additional missionaries , and fanatical Hindu parties are expected to seek further action against Christians once the influence making for tolerance due to Nehru and his followers is gone .",0.7889942072239123
expect.v.01,He does not expect to be able to trammel up all the future consequences of his action .,0.827706747253978
expect.v.01,"For the aged horses : Mr. Budlong , p , 2 : 00.2 h , Lottie Thomas , p , 2 : 04.2 h , Mighty Signal 2 : 03 , Clever Braden , p , 2 : 01.1 h , and Glow Star , p , 2 : 02.3 have been in 2 : 35 ; Miss Demon Abbe , p , 1 : 59.3 has trotted in 2 : 26 , and is expected to race at this gait ; Carter Creed , p , 3 , 2 : 01.1 , Great Lullwater 2 : 00.3 , and Hi Jay , p , 2 : 05.1 h have been in 2 : 30 ; Tanker T. , 3 , 2 : 05.3 is now wearing hopples and has trained in 2 : 19 ; Stormy Dream , p , 2 : 01.3 h , Demon Abbe , p , 2 : 02 , Dundeen B. , 4 , 2 : 04.2 h , Claudia 's Song , 3 , 2 : 06.3 h , and ( jet Fire , 4 , 2 : 02.2 have been in 2 : 25 ; Maria Key , 2 , 2 : 06 h looked great in 2 : 22 ; Mocking Byrd , p , 2 : 01.1 h has been in 2 : 12 , with a racing date approaching at Bay Meadows .",0.7677643318815425
expect.v.01,"Like its long-lived cousin , the refrigerator , a conditioner can be expected to last 20 to 25 years or more .",0.7791263146169429
expect.v.01,"We can n't expect any help from the fighters at Foggia , either .",0.7791618928090742
expect.v.01,What can 10 - year-old Susan expect when she enters the orthodontist 's office ?,0.7010653502401318
expect.v.01,"The debate needed no additional controversy and soon I could ask each individually what he expected from life , what his hopes were and what his fears .",0.7213731835196178
expect.v.01,"The latter in turn assured him that `` were I arraigned at the bar , and you my judge , I should expect to stand or fall only by the merits of my cause '' .",0.7846567833467567
expect.v.01,"In establishing conditions of self-help , it is important that we not expect countries to remake themselves in our image .",0.8215651018856516
expect.v.01,It also provides a frame within which the registration of vital events is gradually gaining force ( though one cannot expect to obtain reliable vital statistics in most parts of the Congo from this source in the near future ) .,0.8128390963271286
expect.v.01,"Whereas a high per cent of the regular students can be expected to read other texts which more or less plow the same ground in a little different direction , the married students chose whole books on specific areas and went into much greater detail in their areas of interest .",0.7521054662759264
expect.v.01,"From here they proceeded to 3 ) These same areas in relation to their own future family life stages , developing these to the extent of examining various crises which could be expected to confront them at some time or other .",0.7995182904050933
expect.v.01,"The boy came on to the porch and sat down , his gaze on Morgan as if half expecting him to shoot and not really caring .",0.643347416977575
expect.v.01,"The worst part had been the waiting ; although we did n't expect the attack before dawn , the long cloudy night , filled with the sounds of the industrious insects , seemed endless .",0.782070583166291
expect.v.01,It sprang from a type of mentality I 'd encountered often enough but certainly had not expected to find here .,0.711001635078748
expect.v.01,"As I had expected , he insisted that my visits to the hall would do nothing to further the process of my application .",0.6624092198562216
expect.v.01,"I was at once disappointed , although just what I had expected him to look like I could not have explained .",0.6376861469156198
expect.v.01,"He wore perforated , white-topped shoes ; they somehow made me expect to see him launch into a vaudeville tapdance routine any moment .",0.7043510122194978
expect.v.01,That 's what they 'll expect you to do .,0.7401330305419161
expect.v.01,"Doc Doolittle 's scheduled appearance at captain 's mast was a very unusual thing , because the discipline dispensed there is ordinarily for the young and immature , and a chief is naturally expected to stay off the report .",0.7310674869151265
expect.v.01,But what quarter could a poor defenseless woman expect from a dictator who would even make so bold as to close all of the banks in our great nation ?,0.7020221779731037
expect.v.01,"Even though I have always had a genius for `` throwing myself into '' every role and `` playing it for all it 's worth '' , no actress can be expected to do her best work when her fortune , her reputation , her livelihood , her home and her nation itself are all imperilled .",0.7115421649574116
ask.v.04,"His desires are so strong that he needs constant reassurance of his mother 's love for him and what she expects of him , in order to overcome them .",0.7137729819964362
ask.v.04,"In addition to this the U. S. Civil Service Bureau , when examining applicants for government positions as interior designers , expects that `` when various needed objects are not obtainable on the market he will design them .",0.7655681874497188
ask.v.04,"Not only should every educator above the rank of instructor be expected to be a member of one of the professional organizations , but his first qualification for membership as an educator should be so sharply scrutinized that membership would be equivalent to certification to teach the subject .",0.798418655501836
ask.v.04,"Well , one did not expect much of people like Herold .",0.741741507273232
ask.v.04,"Unless God expected a man to believe the Holy Scriptures , why had He given them to him ?",0.7740114851652145
ask.v.04,They assured him that they did not expect or need to be entertained .,0.7608238924275512
ask.v.04,"They went to the Flea Market , expecting to find the treasures of Europe , and found instead a duplication of that long double row of booths in Tours .",0.6893730261214606
ask.v.04,A man with so big and so staggeringly developed a torso and such long and powerful arms is expected to stand taller than five feet five .,0.7219958499280514
ask.v.04,"They expected greater things from him , regardless of how trying the circumstances , and they were disappointed .",0.8098503369149059
ask.v.04,"During the decade that followed , the common man , as that piece put it , grew uncomfortable as the Voice of God and fled from behind Saint Woodrow ( Wilson ) only to learn from Science , to his shocked relief that after all there was no God he had to speak for and that he was just an animal anyhow - that there was a chemical formula for him , and that too much could n't be expected of him .",0.6523623437047217
ask.v.04,"If the Department of State is to take primary responsibility for foreign policy in Washington , it follows that the ambassador is expected to take charge overseas .",0.7863270118231179
ask.v.04,He is expected to know about what is going on among the representatives of other agencies who are stationed in his country .,0.8274630668669025
ask.v.04,"He is expected to supervise , to encourage , to direct , to assist in any way he can .",0.7162107455416133
ask.v.04,"Killpath said , `` You were expected to report to my office twenty minutes ago , Sergeant .",0.7332884764583538
ask.v.04,"Then we have informed a large number of our crew that when they reach the United States , they will be punished but that in the meanwhile , they may run loose and are expected to perform their jobs in good order .",0.7774610905371362
ask.v.04,"`` I would expect the proposed committee to hold public hearings '' , Mr. Notte said , `` to obtain the views of the general public and religious , labor and special-interest groups affected by these laws '' .",0.7602170210716561
ask.v.04,He expects that if the present timetable is followed a vote will be scheduled during the last week in September .,0.7423419537096693
ask.v.04,It might be added that as he kept his word so he expected that others keep theirs .,0.8309136658075847
ask.v.04,He expected Democrats to do their duty when it had been patiently pointed out to them .,0.7934898499150739
ask.v.04,"Nobody can deny the right of former Chief Executives to take part in politics , but the American people expect them always to remember the obligations of national leadership and to treat issues with a sense of responsibility .",0.8313876101144793
ask.v.04,"Yet we who lean upon such a man and draw strength from him and expect interpretation of the infinite through him - we who readily accept his sacrifice as our due , we of the congregations are the first to tell him what is in our minds instead of listening to what is in his soul .",0.8197083632783675
ask.v.04,"We do not defeat the good ones with this cruelty , but we add to their burden , while expecting them to bestow saintliness upon us in return for ostentatious church attendance and a few bucks a week , American cash .",0.7728664019876044
ask.v.04,"We expect him to be noble , and to make us so - yet he knows , and tries to tell us , how very humble man must be .",0.8126387130676466
ask.v.04,We expect bestowal of God 's love through him .,0.8467542673406163
ask.v.04,"Now he is apparently expected to give up his evenings - and Sundays , too , for this is coming .",0.7742290741622521
ask.v.04,The Church expects certain things of those who become members .,0.8116294036911291
ask.v.04,The new members justifiably expect some things from their church family :,0.8023626010355362
ask.v.04,"He knows your signals , what is expected of him and the way the Class is conducted , right up through the flash-bulbs of the photographers '' .",0.7159508712372786
ask.v.04,"Each card is expected to show certain information about the individual concerned , including his or her date of birth ( or age at a specified time ) , spouses , and children .",0.7102484241771446
ask.v.04,"`` I mean , we do n't have any way to get there and we can n't expect you to quit work just to take us to town '' .",0.7627423931316758
